col1,col2
It is interesting to observe that this improvement is even more significant for fine classes.,Results/Conclusion
No. Train Test P 1 P =5 1 1000 500 83.80 95.60 2 2000 500 84.80 96.40 3 3000 500 91.00 98.00 4 4000 500 90.80 98.00 Table 3: Classification accuracy for coarse classes ondifferent training sets using the feature set RelWord.,Results/Conclusion
Re sults are evaluated using P 1 and P 5 . No.,Results/Conclusion
Train Test P 1 P =5 1 1000 500 71.00 83.80 2 2000 500 77.80 88.20 3 3000 500 79.80 90.60 4 4000 500 80.00 91.20Table 4: Classification accuracy for fine classes on different training sets using the feature set RelWord.,Results/Conclusion
"Re sults are evaluated using P 1 and P 5 . Tables 3 and 4 show the P 1 and P 5 accuracyof the hierarchical classifier on training sets of dif ferent sizes and exhibit the learning curve for this problem.We note that the average numbers of labels out put by the coarse and fine classifiers are 1.54 and 2.05 resp., (using the feature set RelWord and 5,500 training examples), which shows the decision model is accurate as well as efficient.",Results/Conclusion
"Comparison of the hierarchical and the flat classifier The flat classifier consists of one classifier which isalmost the same as the fine classifier in the hierar chical case, except that its initial confusion set is the whole set of fine classes.",Results/Conclusion
"Our original hope was that the hierarchical classifier would have a better performance, given that its fine classifier only needs to deal with a smaller confusion set.",Results/Conclusion
"However, it turns out that there is a tradeoff between this factor and the inaccuracy, albeit small, of the coarse levelprediction.",Results/Conclusion
"As the results show, there is no perfor mance advantage for using a level of coarse classes, and the semantically appealing coarse classes do not contribute to better performance.",Results/Conclusion
Figure 2 give some more intuition on the flat vs. hierarchical issue.,Results/Conclusion
"We define the tendency of Class i to be confused with Class j as follows: D ij = Err ij  2=(N i + N j ); (3) where (when using P 1 ), Err ij is the number ofquestions in Class i that are misclassified as belong P 1 Word Pos Chunk NE Head RelWord h 77.60 78.20 77.40 78.80 78.80 84.20 f 52.40 77.20 77.00 78.40 76.80 84.00 P =5 Word Pos Chunk NE Head RelWord h 86.00 86.60 87.60 88.60 89.40 95.00 f 83.20 86.80 86.60 88.40 89.80 95.60 Table 5: Comparing accuracy of the hierarchical (h) and flat (f) classifiers on 500 TREC 10 question; training is done on 5,500 questions.",Results/Conclusion
"Results are shown for different feature sets using P 1 and P 5 . Fine Classes 1?50 Fi ne C la ss es 1 ?5 0 2 24 28 32 37 50 2 24 28 32 37 50 Figure 2: The gray?scale map of the matrix D[n,n].",Results/Conclusion
"The color of the small box in position (i,j) denotes D ij . The.",Results/Conclusion
"larger D ij is, the darker the color is. The dotted lines separate the 6 coarse classes.",Results/Conclusion
"ing to Class j, and N i ; N jare the numbers of ques tions in Class i and j resp.",Results/Conclusion
"Figure 2 is a gray-scale map of the matrix D[n,n].",Results/Conclusion
"D[n,n] is so sparse that most parts of the graph areblank.",Results/Conclusion
"We can see that there is no good cluster ing of fine classes mistakes within a coarse class,which explains intuitively why the hierarchical clas sifier with an additional level coarse classes does not work much better.",Results/Conclusion
4.4 Discussion and Examples.,Results/Conclusion
We have shown that the overall accuracy of our clas sifier is satisfactory.,Results/Conclusion
"Indeed, all the reformulation questions that we exemplified in Sec.",Results/Conclusion
3 have been correctly classified.,Results/Conclusion
"Nevertheless, it is constructive to consider some cases in which the classifier fails.Below are some examples misclassified by the hier archical classifier.What French ruler was defeated at the battle of Water loo?",Results/Conclusion
"The correct label is individual, but the classifier, failing to relate the word ?ruler?",Results/Conclusion
"to a person, since it was not in any semantic list, outputs event.",Results/Conclusion
"What is the speed hummingbirds fly ? The correct label is speed, but the classifier outputs animal.",Results/Conclusion
Our feature sensors fail to determine that the focus of the question is ?speed?.,Results/Conclusion
This example illustrates the necessity of identifying the question focus by analyzing syntactic structures.,Results/Conclusion
What do you call a professional map drawer ? The classifier returns other entities instead ofequivalent term.,Results/Conclusion
"In this case, both classes are ac ceptable.",Results/Conclusion
The ambiguity causes the classifier not to output equivalent term as the first choice.,Results/Conclusion
This paper presents a machine learning approach to question classification.,Results/Conclusion
"We developed a hierarchicalclassifier that is guided by a layered semantic hierarchy of answers types, and used it to classify questions into fine-grained classes.",Results/Conclusion
"Our experimental re sults prove that the question classification problemcan be solved quite accurately using a learning ap proach, and exhibit the benefits of features based on semantic analysis.",Results/Conclusion
"In future work we plan to investigate further the application of deeper semantic analysis (including better named entity and semantic categorization) to feature extraction, automate the generation of thesemantic features and develop a better understand ing to some of the learning issues involved in thedifference between a flat and a hierarchical classi fier.",Results/Conclusion
