col1,col2
the from predicate signaling that the logical-form describes flights with more than one origin city.,Experiment/Discussion
We introduce similar features which track disjunction as opposed to conjunction.,Experiment/Discussion
4.2 An Online Learning Algorithm.,Experiment/Discussion
"Figure 4 shows a learning algorithm that takes a training set of (xi, zi) pairs as input, and returns a weighted CCG (i.e., a pair (w,?)) as its output.The algorithm is online, in that it visits each example in turn, and updates both w and ? if neces sary.",Experiment/Discussion
"In Step 1 on each example, the input xi isparsed.",Experiment/Discussion
"If it is parsed correctly, the algorithm im mediately moves to the next example.",Experiment/Discussion
"In Step 2,the algorithm temporarily introduces all lexical en tries seen in GENLEX(xi, zi), and finds the highest scoring parse that leads to the correct semantics zi.",Experiment/Discussion
"A small subset of GENLEX(xi, zi)?namely, only those lexical entries that are contained in the highest scoring parse?are added to ?.",Experiment/Discussion
"In Step 3, a simple perceptron update (Collins, 2002) is performed.",Experiment/Discussion
"The hypothesis is parsed again with the new lexicon, andan update to the parameters w is made if the result ing parse does not have the correct logical form.",Experiment/Discussion
This algorithm differs from the approach in ZC05in a couple of important respects.,Experiment/Discussion
"First, the ZC05 al gorithm performed learning of the lexicon ? at each iteration in a batch method, requiring a pass over the entire training set.",Experiment/Discussion
"The new algorithm is fully online, learning both ? and w in an example-by-example fashion.",Experiment/Discussion
This has important consequences for the efficiency of the algorithm.,Experiment/Discussion
"Second, the parameter estimation method in ZC05 was based on stochasticgradient descent on a log-likelihood objective func tion.",Experiment/Discussion
"The new algorithm makes use of perceptron 683 Inputs: Training examples {(xi, zi) : i = 1 . . .",Experiment/Discussion
"n} where each xi is a sentence, each zi is a logical form.",Experiment/Discussion
An initial lexicon ?0.,Experiment/Discussion
"Number of training iterations, T . Definitions: GENLEX(x, z) takes as input a sentence x anda logical form z and returns a set of lexical items as de scribed in section 2.4.",Experiment/Discussion
GEN(x; ?) is the set of all parses for x with lexicon ?.,Experiment/Discussion
"GEN(x, z; ?) is the set of all parses for x with lexicon ?, which have logical form z. Thefunction f(x, y) represents the features described in sec tion 4.1.",Experiment/Discussion
The function L(y) maps a parse tree y to its associated logical form.,Experiment/Discussion
Initialization: Set parameters w to initial values described in section 6.2.,Experiment/Discussion
Set ? = ?0.,Experiment/Discussion
Algorithm: ? For t = 1 . . .,Experiment/Discussion
"T, i = 1 . . .",Experiment/Discussion
n : Step 1: (Check correctness) ? Let y?,Experiment/Discussion
= argmaxy?GEN(xi;?),Experiment/Discussion
"w ? f(xi, y) . ? If L(y?) = zi, go to the next example.",Experiment/Discussion
Step 2: (Lexical generation) ? Set ? = ? ?,Experiment/Discussion
"GENLEX(xi, zi) . ? Let y?",Experiment/Discussion
"= argmaxy?GEN(xi,zi;?)",Experiment/Discussion
"w ? f(xi, y) . ? Define ?i to be the set of lexical entries in y?.",Experiment/Discussion
Set lexicon to ? = ? ?,Experiment/Discussion
?i . Step 3: (Update parameters) ? Let y?,Experiment/Discussion
= argmaxy?GEN(xi;?),Experiment/Discussion
"w ? f(xi, y) . ? If L(y?) 6= zi : ? Set w = w + f(xi, y?)",Experiment/Discussion
"f(xi, y?)",Experiment/Discussion
Output: Lexicon ? together with parameters w. Figure 4: An online learning algorithm.,Experiment/Discussion
"updates, which are simpler and cheaper to compute.As in ZC05, the algorithm assumes an initial lex icon ?0 that contains two types of entries.",Experiment/Discussion
"First, we compile entries such as Boston := NP : boston for entities such as cities, times and month-names that occur in the domain or underlying database.",Experiment/Discussion
In practice it is easy to compile a list of these atomic entities.,Experiment/Discussion
"Second, the lexicon has entries for some function words such as wh-words, and determiners.9",Experiment/Discussion
There has been a significant amount of previous work on learning to map sentences to under lying semantic representations.,Experiment/Discussion
"A wide variety 9Our assumption is that these entries are likely to be domain independent, so it is simple enough to compile a list that can be reused in new domains.",Experiment/Discussion
"Another approach, which we may consider in the future, would be to annotate a small subset of the training examples with full CCG derivations, from which these frequently occurring entries could be learned.of techniques have been considered including ap proaches based on machine translation techniques (Papineni et al, 1997; Ramaswamy and Kleindienst, 2000; Wong and Mooney, 2006), parsing techniques(Miller et al, 1996; Ge and Mooney, 2006), tech niques that use inductive logic programming (Zelle and Mooney, 1996; Thompson and Mooney, 2002; Tang and Mooney, 2000; Kate et al, 2005), andideas from string kernels and support vector ma chines (Kate and Mooney, 2006; Nguyen et al, 2006).",Experiment/Discussion
"In our experiments we compare to He and Young (2006) on the ATIS domain and Zettlemoyerand Collins (2005) on the Geo880 domain, because these systems currently achieve the best per formance on these problems.",Experiment/Discussion
The approach of Zettlemoyer and Collins (2005) was presented in section 2.4.,Experiment/Discussion
He and Young (2005) describe an algorithm that learns a probabilisticpush-down automaton that models hierarchical de pendencies but can still be trained on a data set that does not have full treebank-style annotations.,Experiment/Discussion
"Thisapproach has been integrated with a speech recog nizer and shown to be robust to recognition errors (He and Young, 2006).There is also related work in the CCG litera ture.",Experiment/Discussion
Clark and Curran (2003) present a method forlearning the parameters of a log-linear CCG pars ing model from fully annotated normal?form parse trees.,Experiment/Discussion
Watkinson and Manandhar (1999) present an unsupervised approach for learning CCG lexiconsthat does not represent the semantics of the training sentences.,Experiment/Discussion
Bos et al (2004) present an al gorithm that learns CCG lexicons with semantics but requires fully?specified CCG derivations in thetraining data.,Experiment/Discussion
Bozsahin (1998) presents work on us ing CCG to model languages with free word order.,Experiment/Discussion
"In addition, there is related work that focuses on modeling child language learning.",Experiment/Discussion
Siskind (1996) presents an algorithm that learns word-to-meaning mappings from sentences that are paired with a set of possible meaning representations.,Experiment/Discussion
"Villavicencio (2001) describes an approach that learns a categorial grammar with syntactic and semantic information.Both of these approaches use sentences from child directed speech, which differ significantly from the natural language interface queries we consider.",Experiment/Discussion
"Finally, there is work on manually developing parsing techniques to improve robustness (Carbonell 684and Hayes, 1983; Seneff, 1992).",Experiment/Discussion
"In contrast, our ap proach is integrated into a learning framework.",Experiment/Discussion
The main focus of our experiments is on the ATIS travel planning domain.,Results/Conclusion
"For development, we used4978 sentences, split into a training set of 4500 ex amples, and a development set of 478 examples.",Results/Conclusion
"Fortest, we used the ATIS NOV93 test set which con tains 448 examples.",Results/Conclusion
"To create the annotations, wecreated a script that maps the original SQL annotations provided with the data to lambda-calculus ex pressions.",Results/Conclusion
"He and Young (2006) previously reported results on the ATIS domain, using a learning approachwhich also takes sentences paired with semantic annotations as input.",Results/Conclusion
"In their case, the semantic struc tures resemble context-free parses with semantic (asopposed to syntactic) non-terminal labels.",Results/Conclusion
"In our experiments we have used the same split into training and test data as He and Young (2006), ensur ing that our results are directly comparable.",Results/Conclusion
"He and Young (2006) report partial match figures for their parser, based on precision and recall in recovering attribute-value pairs.",Results/Conclusion
"(For example, the sentence flights to Boston would have a single attribute-valueentry, namely destination = Boston.)",Results/Conclusion
"It is sim ple for us to map from lambda-calculus expressions to attribute-value entries of this form; for example, the expression to(x,Boston) would be mapped to destination = Boston.",Results/Conclusion
"He and Young (2006) gave us their data and annotations, so we can directly compare results on the partial-match criterion.",Results/Conclusion
"Wealso report accuracy for exact matches of lambda calculus expressions, which is a stricter criterion.",Results/Conclusion
"In addition, we report results for the method on the Geo880 domain.",Results/Conclusion
"This allows us to compare directly to the previous work of Zettlemoyer and Collins (2005), using the same split of the data intotraining and test sets of sizes 600 and 280 respec tively.",Results/Conclusion
"We use cross-validation of the training set, asopposed to a separate development set, for optimiza tion of parameters.",Results/Conclusion
6.1 Improving Recall.,Results/Conclusion
The simplest approach to the task is to train the parser and directly apply it to test sentences.,Results/Conclusion
"In our experiments we will see that this produces resultswhich have high precision, but somewhat lower recall, due to some test sentences failing to parse (usu ally due to words in the test set which were neverobserved in training data).",Results/Conclusion
A simple strategy to alle viate this problem is as follows.,Results/Conclusion
"If the sentence failsto parse, we parse the sentence again, this time al lowing parse moves which can delete words at some cost.",Results/Conclusion
The cost of this deletion operation is optimizedon development data.,Results/Conclusion
This approach can significantly improve F-measure on the partial-match cri terion in particular.,Results/Conclusion
We report results both with and without this second pass strategy.,Results/Conclusion
6.2 Parameters in the Approach.,Results/Conclusion
"The algorithm in figure 4 has a number of param eters, the set {T, ?, ?, ?}, which we now describe.The values of these parameters were chosen to op timize the performance on development data.",Results/Conclusion
"T is the number of passes over the training set, and was set to be 4.",Results/Conclusion
Each lexical entry in the initial lexicon?0 has an associated feature which counts the num ber of times this entry is seen in a parse.,Results/Conclusion
The initial parameter value in w for all features of this form was chosen to be some value ?.,Results/Conclusion
"Each of the newCCG rules?the application, composition, crossedcomposition, and type-raising rules described in sec tion 3?has an associated parameter.",Results/Conclusion
We set al of these parameters to the same initial value ?.,Results/Conclusion
"Finally, when new lexical entries are added to ?",Results/Conclusion
"(in step 2 of the algorithm), their initial weight is set to some value ?.",Results/Conclusion
"In practice, optimization on developmentdata led to a positive value for ?, and negative val ues for ? and ?.",Results/Conclusion
6.3 Results.,Results/Conclusion
Table 1 shows accuracy for the method by the exact match criterion on the ATIS test set.,Results/Conclusion
"The two passstrategy actually hurts F-measure in this case, al though it does improve recall of the method.Table 2 shows results under the partial-match cri terion.",Results/Conclusion
"The results for our approach are higher than those reported by He and Young (2006) even without the second, high-recall, strategy.",Results/Conclusion
"With the two-pass strategy our method has more than halved the F-measure error rate, giving improvements from 90.3% F-measure to 95.9% F-measure.",Results/Conclusion
Table 3 shows results on the Geo880 domain.,Results/Conclusion
The 685 Precision Recall F1 Single-Pass Parsing 90.61 81.92 86.05 Two-Pass Parsing 85.75 84.6 85.16 Table 1: Exact-match accuracy on the ATIS test set.,Results/Conclusion
Precision Recall F1 Single-Pass Parsing 96.76 86.89 91.56 Two-Pass Parsing 95.11 96.71 95.9 He and Young (2006) ? ?,Results/Conclusion
90.3 Table 2: Partial-credit accuracy on the ATIS test set.,Results/Conclusion
"new method gives improvements in performance both with and without the two pass strategy, showingthat the new CCG combinators, and the new learn ing algorithm, give some improvement on even this domain.",Results/Conclusion
The improved performance comes from aslight drop in precision which is offset by a large in crease in recall.,Results/Conclusion
"Table 4 shows ablation studies on the ATIS data, where we have selectively removed various aspectsof the approach, to measure their impact on performance.",Results/Conclusion
"It can be seen that accuracy is seriously de graded if the new CCG rules are removed, or if the features associated with these rules (which allow the model to penalize these rules) are removed.Finally, we report results concerning the effi ciency of the new online algorithm as compared to the ZC05 algorithm.",Results/Conclusion
"We compared running times for the new algorithm, and the ZC05 algorithm, on the geography domain, with both methods making 4 passes over the training data.",Results/Conclusion
"The new algorithm took less than 4 hours, compared to over 12 hours for the ZC05 algorithm.",Results/Conclusion
"The main explanation for this improved performance is that on many trainingexamples,10 in step 1 of the new algorithm a cor rect parse is found, and the algorithm immediately moves on to the next example.",Results/Conclusion
"Thus GENLEX is not required, and in particular parsing the example with the large set of entries generated by GENLEX is not required.",Results/Conclusion
"We presented a new, online algorithm for learning a combinatory categorial grammar (CCG), together with parameters that define a log-linear pars ing model.",Results/Conclusion
"We showed that the use of non-standardCCG combinators is highly effective for parsing sen 10Measurements on the Geo880 domain showed that in the 4 iterations, 83.3% of all parses were successful at step 1.",Results/Conclusion
Precision Recall F1 Single-Pass Parsing 95.49 83.2 88.93 Two-Pass Parsing 91.63 86.07 88.76 ZC05 96.25 79.29 86.95 Table 3: Exact-match accuracy on the Geo880 test set.,Results/Conclusion
Precision Recall F1 Full Online Method 87.26 74.44 80.35 Without control features 70.33 42.45 52.95 Without relaxed word order 82.81 63.98 72.19 Without word insertion 77.31 56.94 65.58 Table 4: Exact-match accuracy on the ATIS development setfor the full algorithm and restricted versions of it.,Results/Conclusion
The sec ond row reports results of the approach without the featuresdescribed in section 3 that control the use of the new combi nators.,Results/Conclusion
The third row presents results without the combinators from section 3.1 that relax word order.,Results/Conclusion
"The fourth row reports experiments without the type-raising combinators presented in section 3.2.tences with the types of phenomena seen in spontaneous, unedited natural language.",Results/Conclusion
The resulting sys tem achieved significant accuracy improvements in both the ATIS and Geo880 domains.,Results/Conclusion
Acknowledgements Wewould like to thank Yulan He and Steve Young for their help with obtaining the ATIS data set.,Results/Conclusion
We also acknowledge the support for this research.,Results/Conclusion
Luke Zettlemoyer was funded by a Microsoft graduateresearch fellowship and Michael Collins was sup ported by the National Science Foundation under grants 0347631 and DMS-0434222.,Results/Conclusion
