col1,col2
This can be explained by the difference between the decoders.,"{'title': '5 Experiments', 'number': '5'}"
"In particular, the graph-based model is unable to score the actions “Reduce” and “Shift”, since they do not modify the parse tree.","{'title': '5 Experiments', 'number': '5'}"
"Nevertheless, the score serves as a reference for the effect of additional features in the combined parser.","{'title': '5 Experiments', 'number': '5'}"
"Using both transition-based features and graphbased features from the MSTParser (“Combined [TM]”), the combined parser achieved 92.0% perword accuracy, which is significantly higher than the pure graph-based and transition-based parsers.","{'title': '5 Experiments', 'number': '5'}"
"Additional graph-based features further improved the accuracy to 92.1%/45.5%, which is the best among all the parsers compared.1 We use the Penn Chinese Treebank (CTB) 5 for experimental data.","{'title': '5 Experiments', 'number': '5'}"
"Following Duan et al. (2007), we 1A recent paper, Koo et al.","{'title': '5 Experiments', 'number': '5'}"
"(2008) reported parent-prediction accuracy of 92.0% using a graph-based parser with a different (larger) set of features (Carreras, 2007).","{'title': '5 Experiments', 'number': '5'}"
"By applying separate word cluster information, Koo et al. (2008) improved the accuracy to 93.2%, which is the best known accuracy on the PTB data.","{'title': '5 Experiments', 'number': '5'}"
"We excluded these from Table 5 because our work is not concerned with the use of such additional knowledge. split the corpus into training, development and test data as shown in Table 6, and use the head-finding rules in Table 8 in the Appendix to turn the bracketed sentences into dependency structures.","{'title': '5 Experiments', 'number': '5'}"
"Most of the head-finding rules are from Sun and Jurafsky (2004), while we added rules to handle NN and FRAG, and a default rule to use the rightmost node as the head for the constituent that are not listed.","{'title': '5 Experiments', 'number': '5'}"
"Like Duan et al. (2007), we use gold-standard POS-tags for the input.","{'title': '5 Experiments', 'number': '5'}"
"The parsing accuracy is evaluated by the percentage of non-root words that have been assigned the correct head, the percentage of correctly identified root words, and the percentage of complete matches, all excluding punctuation.","{'title': '5 Experiments', 'number': '5'}"
The accuracies are shown in Table 7.,"{'title': '5 Experiments', 'number': '5'}"
"Rows “Graph [MA]”, “Transition”, “Combined [TM]” and “Combined [TMA]” show our models in the same way as for the English experiments from Section 5.2.","{'title': '5 Experiments', 'number': '5'}"
"Row “Duan 2007” represents the transition-based model from Duan et al. (2007), which applies beamsearch to the deterministic model from Yamada and Matsumoto (2003), and achieved the previous best accuracy on the data.","{'title': '5 Experiments', 'number': '5'}"
Our observations on parsing Chinese are essentially the same as for English.,"{'title': '5 Experiments', 'number': '5'}"
Our combined parser outperforms both the pure graph-based and the pure transition-based parsers.,"{'title': '5 Experiments', 'number': '5'}"
It gave the best accuracy we are aware of for dependency parsing using CTB.,"{'title': '5 Experiments', 'number': '5'}"
Our graph-based parser is derived from the work of McDonald and Pereira (2006).,"{'title': '6 Related work', 'number': '6'}"
"Instead of performing exact inference by dynamic programming, we incorporated the linear model and feature templates from McDonald and Pereira (2006) into our beam-search framework, while adding new global features.","{'title': '6 Related work', 'number': '6'}"
"Nakagawa (2007) and Hall (2007) also showed the effectiveness of global features in improving the accuracy of graph-based parsing, using the approximate Gibbs sampling method and a reranking approach, respectively.","{'title': '6 Related work', 'number': '6'}"
Our transition-based parser is derived from the deterministic parser of Nivre et al. (2006).,"{'title': '6 Related work', 'number': '6'}"
"We incorporated the transition process into our beamsearch framework, in order to study the influence of search on this algorithm.","{'title': '6 Related work', 'number': '6'}"
"Existing efforts to add search to deterministic parsing include Sagae and Lavie (2006b), which applied best-first search to constituent parsing, and Johansson and Nugues (2006) and Duan et al. (2007), which applied beamsearch to dependency parsing.","{'title': '6 Related work', 'number': '6'}"
"All three methods estimate the probability of each transition action, and score a state item by the product of the probabilities of all its corresponding actions.","{'title': '6 Related work', 'number': '6'}"
"But different from our transition-based parser, which trains all transitions for a parse globally, these models train the probability of each action separately.","{'title': '6 Related work', 'number': '6'}"
"Based on the work of Johansson and Nugues (2006), Johansson and Nugues (2007) studied global training with an approximated large-margin algorithm.","{'title': '6 Related work', 'number': '6'}"
"This model is the most similar to our transition-based model, while the differences include the choice of learning and decoding algorithms, the definition of feature templates and our application of the “early update” strategy.","{'title': '6 Related work', 'number': '6'}"
Our combined parser makes the biggest contribution of this paper.,"{'title': '6 Related work', 'number': '6'}"
"In contrast to the models above, it includes both graph-based and transition-based components.","{'title': '6 Related work', 'number': '6'}"
"An existing method to combine multiple parsing algorithms is the ensemble approach (Sagae and Lavie, 2006a), which was reported to be useful in improving dependency parsing (Hall et al., 2007).","{'title': '6 Related work', 'number': '6'}"
"A more recent approach (Nivre and McDonald, 2008) combined MSTParser and MaltParser by using the output of one parser for features in the other.","{'title': '6 Related work', 'number': '6'}"
Both Hall et al. (2007) and Nivre and McDonald (2008) can be seen as methods to combine separately defined models.,"{'title': '6 Related work', 'number': '6'}"
"In contrast, our parser combines two components in a single model, in which all parameters are trained consistently.","{'title': '6 Related work', 'number': '6'}"
"We developed a graph-based and a transition-based projective dependency parser using beam-search, demonstrating that beam-search is a competitive choice for both parsing approaches.","{'title': '7 Conclusion and future work', 'number': '7'}"
"We then combined the two parsers into a single system, using discriminative perceptron training and beam-search decoding.","{'title': '7 Conclusion and future work', 'number': '7'}"
"The appealing aspect of the combined parser is the incorporation of two largely different views of the parsing problem, thus increasing the information available to a single statistical parser, and thereby significantly increasing the accuracy.","{'title': '7 Conclusion and future work', 'number': '7'}"
"When tested using both English and Chinese dependency data, the combined parser was highly competitive compared to the best systems in the literature.","{'title': '7 Conclusion and future work', 'number': '7'}"
"The idea of combining different approaches to the same problem using beam-search and a global model could be applied to other parsing tasks, such as constituent parsing, and possibly other NLP tasks.","{'title': '7 Conclusion and future work', 'number': '7'}"
This work is supported by the ORS and Clarendon Fund.,"{'title': 'Acknowledgements', 'number': '8'}"
We thank the anonymous reviewers for their detailed comments.,"{'title': 'Acknowledgements', 'number': '8'}"
