col1,col2
One interesting technique for evaluating machine translation quality is through reading comprehension questions about automatically translated text.,"{'title': '5 Feasibility of more complex evaluations', 'number': '5'}"
The quality of machine translation systems can be quantified based on how many questions are answered correctly.,"{'title': '5 Feasibility of more complex evaluations', 'number': '5'}"
"Jones et al. (2005) evaluated translation quality using a reading comprehension test the Defense Language Proficiency Test (DLPT), which is administered to military translators.","{'title': '5 Feasibility of more complex evaluations', 'number': '5'}"
"The DLPT contains a collection of foreign articles of varying levels of difficulties, and a set of short answer questions.","{'title': '5 Feasibility of more complex evaluations', 'number': '5'}"
"Jones et al used the Arabic DLPT to do a study of machine translation quality, by automatically translating the Arabic documents into English and seeing how many human subjects could successfully pass the exam.","{'title': '5 Feasibility of more complex evaluations', 'number': '5'}"
The advantage of this type of evaluation is that the results have a natural interpretation.,"{'title': '5 Feasibility of more complex evaluations', 'number': '5'}"
"They indicate how understandable the output of a machine translation system is better than Bleu does, and better than other manual evaluation like the relative ranking.","{'title': '5 Feasibility of more complex evaluations', 'number': '5'}"
"Despite this advantage, evaluating MT through reading comprehension hasn’t caught on, due to the difficulty of administering it and due to the fact that the DLPT or similar tests are not publicly available.","{'title': '5 Feasibility of more complex evaluations', 'number': '5'}"
We conducted a reading comprehension evaluation using Mechanical Turk.,"{'title': '5 Feasibility of more complex evaluations', 'number': '5'}"
"Instead of simply administering the test on Mechanical Turk, we used it for all aspects from test creation to answer grading.","{'title': '5 Feasibility of more complex evaluations', 'number': '5'}"
"Our procedure was as follows: Test creation We posted human translations of foreign news articles, and ask Tukers to write three questions and provide sample answers.","{'title': '5 Feasibility of more complex evaluations', 'number': '5'}"
We gave simple instructions on what qualifies as a good reading comprehension question.,"{'title': '5 Feasibility of more complex evaluations', 'number': '5'}"
"System google.fr-en google.de-en rbmt5.de-en geneva.de-en tromble.de-en Question selection We posted the questions for each article back to Mechanical Turk, and asked other Turkers to vote on whether each question was a good and to indicate if it was redundant with any other questions in the set.","{'title': '5 Feasibility of more complex evaluations', 'number': '5'}"
"We sorted questions to maximize the votes and minimized redundancies using a simple perl script, which discarded questions below a threshold, and eliminated all redundancies.","{'title': '5 Feasibility of more complex evaluations', 'number': '5'}"
"Taking the test We posted machine translated versions of the foreign articles along with the questions, and had Turkers answer them.","{'title': '5 Feasibility of more complex evaluations', 'number': '5'}"
We ensured that no one would see multiple translations of the same article.,"{'title': '5 Feasibility of more complex evaluations', 'number': '5'}"
Grading the answers We aggregated the answers and used Mechanical Turk to grade them.,"{'title': '5 Feasibility of more complex evaluations', 'number': '5'}"
"We showed the human translation of the article, one question, the sample answer, and displayed all answers to it.","{'title': '5 Feasibility of more complex evaluations', 'number': '5'}"
"After the Turkers graded the answers, we calculated the percentage of questions that were answered correctly for each system.","{'title': '5 Feasibility of more complex evaluations', 'number': '5'}"
"Turkers created 90 questions for 10 articles, which were subsequently filtered down to 47 good questions, ranging from 3–6 questions per article.","{'title': '5 Feasibility of more complex evaluations', 'number': '5'}"
25 Turkers answered questions about each translated article.,"{'title': '5 Feasibility of more complex evaluations', 'number': '5'}"
"To avoid them answering the questions multiple times, we randomly selected which system’s translation was shown to them.","{'title': '5 Feasibility of more complex evaluations', 'number': '5'}"
Each system’s translation was displayed an average of 5 reference 0.94 google.fr-en 0.85 google.de-en 0.80 rbmt5.de-en 0.77 geneva.de-en 0.63 jhu-tromble.de-en 0.50 times per article.,"{'title': '5 Feasibility of more complex evaluations', 'number': '5'}"
"As a control, we had three Turkers answer the reading comprehension questions using the reference translation.","{'title': '5 Feasibility of more complex evaluations', 'number': '5'}"
Table 3 gives the percent of questions that were correctly answered using each of the different systems’ outputs and using the reference translation.,"{'title': '5 Feasibility of more complex evaluations', 'number': '5'}"
"The ranking is exactly what we would expect, based on the HTER scores and on the human evaluation of the systems in WMT09.","{'title': '5 Feasibility of more complex evaluations', 'number': '5'}"
This again helps to validate that the reading comprehension methodology.,"{'title': '5 Feasibility of more complex evaluations', 'number': '5'}"
"The scores are more interpretable than Blue scores and than the WMT09 relative rankings, since it gives an indication of how understandable the MT output is.","{'title': '5 Feasibility of more complex evaluations', 'number': '5'}"
Appendix A shows some sample questions and answers for an article.,"{'title': '5 Feasibility of more complex evaluations', 'number': '5'}"
Mechanical Turk is an inexpensive way of gathering human judgments and annotations for a wide variety of tasks.,"{'title': '6 Conclusions', 'number': '6'}"
In this paper we demonstrate that it is feasible to perform manual evaluations of machine translation quality using the web service.,"{'title': '6 Conclusions', 'number': '6'}"
"The low cost of the non-expert labor found on Mechanical Turk is cheap enough to collect redundant annotations, which can be utilized to ensure translation quality.","{'title': '6 Conclusions', 'number': '6'}"
By combining the judgments of many non-experts we are able to achieve the equivalent quality of experts.,"{'title': '6 Conclusions', 'number': '6'}"
"The suggests that manual evaluation of translation quality could be straightforwardly done to validate performance improvements reported in conference papers, or even for mundane tasks like tracking incremental system updates.","{'title': '6 Conclusions', 'number': '6'}"
This challenges the conventional wisdom which has long held that automatic metrics must be used since manual evaluation is too costly and timeconsuming.,"{'title': '6 Conclusions', 'number': '6'}"
We have shown that Mechanical Turk can be used creatively to produce quite interesting things.,"{'title': '6 Conclusions', 'number': '6'}"
"We showed how a reading comprehension test could be created, administered, and graded, with only very minimal intervention.","{'title': '6 Conclusions', 'number': '6'}"
"We believe that it is feasible to use Mechanical Turk for a wide variety of other machine translated tasks like creating word alignments for sentence pairs, verifying the accuracy of document- and sentence-alignments, performing non-simulated active learning experiments for statistical machine translation, even collecting training data for low resource languages like Urdu.","{'title': '6 Conclusions', 'number': '6'}"
"The cost of using Mechanical Turk is low enough that we might consider attempting quixotic things like human-in-the-loop minimum error rate training (Zaidan and Callison-Burch, 2009), or doubling the amount of training data available for Urdu.","{'title': '6 Conclusions', 'number': '6'}"
"This research was supported by the EuroMatrixPlus project funded by the European Commission, and by the US National Science Foundation under grant IIS-0713448.","{'title': 'Acknowledgments', 'number': '7'}"
The views and findings are the author’s alone.,"{'title': 'Acknowledgments', 'number': '7'}"
"The actress Heather Locklear, Amanda on the popular series Melrose Place, was arrested this weekend in Santa Barbara (California) after driving under the influence of drugs.","{'title': 'A Example reading comprehension questions', 'number': '8'}"
"A witness saw her performing inappropriate maneuvers while trying to take her car out of a parking space in Montecito, as revealed to People magazine by a spokesman for the Californian Highway Police.","{'title': 'A Example reading comprehension questions', 'number': '8'}"
"The witness stated that around 4.30pm Ms. Locklear “hit the accelerator very roughly, making excessive noise and trying to take the car out from the parking space with abrupt back and forth maneuvers.","{'title': 'A Example reading comprehension questions', 'number': '8'}"
"While reversing, she passed several times in front of his sunglasses.” Shortly after, the witness, who at first, apparently had not recognized the actress, saw Ms. Locklear stopping in a nearby street and leaving the vehicle.","{'title': 'A Example reading comprehension questions', 'number': '8'}"
"It was this person who alerted the emergency services, because “he was concerned about Ms. Locklear’s life.” When the patrol arrived, the police found the actress sitting inside her car, which was partially blocking the road.","{'title': 'A Example reading comprehension questions', 'number': '8'}"
"“She seemed confused,” so the policemen took her to a specialized centre for drugs and alcohol and submitted her a test.","{'title': 'A Example reading comprehension questions', 'number': '8'}"
"According to a spokesman for the police, the actress was cooperative and excessive alcohol was ruled out from the beginning, even if “as the officers initially observed, we believe Ms. Locklear was under the influences drugs.” Ms. Locklear was arrested under suspicion of driving under the influence of some - unspecified substance, and imprisoned in the local jail at 7.00pm, to be released some hours later.","{'title': 'A Example reading comprehension questions', 'number': '8'}"
"Two months ago, Ms. Locklear was released from a specialist clinic in Arizona where she was treated after an episode of anxiety and depression.","{'title': 'A Example reading comprehension questions', 'number': '8'}"
4 questions were selected She was arested on suspicion of driving under the influence of drugs.,"{'title': 'A Example reading comprehension questions', 'number': '8'}"
She was cured for anxiety and depression.,"{'title': 'A Example reading comprehension questions', 'number': '8'}"
"Answers to Where was Ms. Locklear two months ago? that were judged to be correct: Arizona hospital for treatment of depression; at a treatmend clinic in Arizona; in the Arizona clinic being treated for nervous breakdown; a clinic in Arizona; Arizona, under treatment for depression; She was a patient in a clinic in Arizona undergoing treatment for anxiety and depression; In an Arizona mental health facility ; A clinic in Arizona.","{'title': 'A Example reading comprehension questions', 'number': '8'}"
; In a clinic being treated for anxiety and depression.,"{'title': 'A Example reading comprehension questions', 'number': '8'}"
; at an Arizona clinic These answers were judged to be incorrect: Locklear was retired in Arizona; Arizona; Arizona; in Arizona; Ms.Locklaer were laid off after a treatment out of the clinic in Arizona.,"{'title': 'A Example reading comprehension questions', 'number': '8'}"
