col1,col2
"This problem of ellipsis can frequently occur in research abstracts, and it can be argued that the tokenization criteria must be changed for texts in biomedical domain (Yamamoto and Sa tou, 2004) so that such fragment as ?IL-18?","{'title': 'Discussion. ', 'number': '5'}"
and ?mediated?,"{'title': 'Discussion. ', 'number': '5'}"
in ?IL-18-ediated?,"{'title': 'Discussion. ', 'number': '5'}"
should be regarede as separate tokens.,"{'title': 'Discussion. ', 'number': '5'}"
"The Pennsylvania biology corpus (Kulick et al, 2004) partially solves this problem by separating a token where two or more subtokens are connected with hyphens, but in the cases where a shared part of the word is not separated by a hyphen (e.g. ?metric?","{'title': 'Discussion. ', 'number': '5'}"
of ?ste reo- and isometric alleles?),"{'title': 'Discussion. ', 'number': '5'}"
the word including the part is left uncut.,"{'title': 'Discussion. ', 'number': '5'}"
"The current GTB follows the GENIA corpus that it retains the tokeniza tion criteria of the original Penn Treebank, but this must be reconsidered in future.","{'title': 'Discussion. ', 'number': '5'}"
"For analysis of coordination with ellipsis, if the information on full forms is available, one strategy would be to leave the inside structure of coordination unannotated in the treebank corpus (and in the phase of text analysis the structure is not established in the phase of parsing but with a different mechanism) and later merge it with the coordination structure annotation.","{'title': 'Discussion. ', 'number': '5'}"
The GENIA term corpus annotates the full form of a techni cal term whose part is omitted in the surface as an attribute of the ?<cons>?,"{'title': 'Discussion. ', 'number': '5'}"
"element indicating a technical term (Kim et al, 2003).","{'title': 'Discussion. ', 'number': '5'}"
"In the above mentioned Pennsylvania corpus, a similar mechanism (?chaining?)","{'title': 'Discussion. ', 'number': '5'}"
is used for recovering the full form of named entities.,"{'title': 'Discussion. ', 'number': '5'}"
"However, in both corpora, no such information is available outside the terms/entities.","{'title': 'Discussion. ', 'number': '5'}"
The cases where scope of modification in coordinated phrases is problematic are few but they are more difficult in abstracts than in gen eral texts because the resolution of ambiguity needs domain knowledge.,"{'title': 'Discussion. ', 'number': '5'}"
"If term/entity annota tion is already done, that information can help resolve this type of ambiguity, but again the problem is that outside the terms/entities such information is not available.","{'title': 'Discussion. ', 'number': '5'}"
"It would be practi cal to have the structure flat but specially marked when the tree annotators are unsure and have a domain expert resolve the ambiguity, as the sentences that needs such intervention seems few.","{'title': 'Discussion. ', 'number': '5'}"
Some cases of ambiguity in modifier at tachment (which do not involve coordination) can be solved with similar process.,"{'title': 'Discussion. ', 'number': '5'}"
"We believe that other type of disagreements can be solved with supplementing criteria for linguistic phenomena not well-covered by the scheme, and annotator training.","{'title': 'Discussion. ', 'number': '5'}"
Automatic pre processing by POS taggers and parsers can also help increase the consistent annotation.,"{'title': 'Discussion. ', 'number': '5'}"
224,"{'title': 'Discussion. ', 'number': '5'}"
A subset of the GENIA corpus is annotated for syntactic (tree) structure.,"{'title': 'Conclusion. ', 'number': '6'}"
"Inter-annotator agreement test indicated that the annotation can be done stably by linguists without much knowledge in biology, provided that proper guideline is established for linguistic phenomena particular to scientific research abstracts.","{'title': 'Conclusion. ', 'number': '6'}"
We have made the 500-abstract corpus in both XML and PTB formats and made it publicly available as ?the GENIA Treebank beta version?,"{'title': 'Conclusion. ', 'number': '6'}"
(GTB beta).,"{'title': 'Conclusion. ', 'number': '6'}"
"We are in further cleaning up process of the 500-abstract set, and at the same time, initial annotation of the remaining abstracts is being done, so that the full GENIA set of 2000 ab stracts will be annotated with tree structure.","{'title': 'Conclusion. ', 'number': '6'}"
"For parsers to be useful for information ex traction, they have to establish a map between syntactic structure and more semantic predicate argument structure, and between the linguistic predicate-argument structures to the factual relation to be extracted.","{'title': 'Conclusion. ', 'number': '6'}"
Annotation of various in formation on a same set of text can help establish these maps.,"{'title': 'Conclusion. ', 'number': '6'}"
"For the factual relations, we are annotating relations between proteins and genes in cooperation with a group of biologists.","{'title': 'Conclusion. ', 'number': '6'}"
"For predicate-argument annotation, we are in vestigating the use of the parse results of the Enju parser.","{'title': 'Conclusion. ', 'number': '6'}"
Acknowledgments The authors are grateful to annotators and colleagues that helped the construction of the corpus.,"{'title': 'Conclusion. ', 'number': '6'}"
This work is partially supported by Grant in-Aid for Scientific Research on Priority Area C ?Genome Information Science?,"{'title': 'Conclusion. ', 'number': '6'}"
"from the Min istry of Education, Culture, Sports, Science and Technology of Japan.","{'title': 'Conclusion. ', 'number': '6'}"
