col1,col2
Linguistically annotated corpus based on texts in biomedical domain has been constructed to tune natural language processing (NLP) tools for bio textmining.,{}
"As the focus of information extraction is shifting from ""nominal"" information such as named entity to ""verbal"" information such as function and interaction of substances, applica tion of parsers has become one of the key technologies and thus the corpus annotated for syntactic structure of sen tences is in demand.",{}
A subset of the GENIA corpus consisting of 500 MEDLINE abstracts has been annotated for syntactic structure in an XML based format based on Penn Treebank II (PTB) scheme.,{}
"Inter-annotator agreement test indicated that the writ ing style rather than the contents of the research abstracts is the source of the difficulty in tree annotation, and that annotation can be stably done by linguists without much knowledge of bi ology with appropriate guidelines regarding to linguistic phenomena par ticular to scientific texts.",{}
Research and development for information extraction from biomedical literature (bio textmining) has been rapidly advancing due to demands caused by information overload in the genome-related field.,"{'title': 'Introduction', 'number': '1'}"
Natural language process ing (NLP) techniques have been regarded as useful for this purpose.,"{'title': 'Introduction', 'number': '1'}"
Now that focus of in formation extraction is shifting from extraction of ?nominal?,"{'title': 'Introduction', 'number': '1'}"
information such as named entity to ?verbal?,"{'title': 'Introduction', 'number': '1'}"
"information such as relations of enti ties including events and functions, syntactic analysis is an important issue of NLP application in biomedical domain.","{'title': 'Introduction', 'number': '1'}"
"In extraction of rela tion, the roles of entities participating in the relation must be identified along with the verb that represents the relation itself.","{'title': 'Introduction', 'number': '1'}"
"In text analysis, this corresponds to identifying the subjects, ob jects, and other arguments of the verb.","{'title': 'Introduction', 'number': '1'}"
"Though rule-based relation information ex traction systems using surface pattern matching and/or shallow parsing can achieve high precision (e.g. Koike et al, 2004) in a particular target domain, they tend to suffer from low recall due to the wide variation of the surface ex pression that describe a relation between a verb and its arguments.","{'title': 'Introduction', 'number': '1'}"
"In addition, the portability of such systems is low because the system has to be re-equipped with different set of rules when different kind of relation is to be extracted.","{'title': 'Introduction', 'number': '1'}"
"One solution to this problem is using deep parsers which can abstract the syntactic variation of a relation between a verb and its arguments repre sented in the text, and constructing extraction rule on the abstract predicate-argument structure.","{'title': 'Introduction', 'number': '1'}"
"To do so, wide-coverage and high-precision parsers are required.","{'title': 'Introduction', 'number': '1'}"
"While basic NLP techniques are relatively general and portable from domain to domain, customization and tuning are inevitable, especially in order to apply the techniques effec tively to highly specialized literatures such as research papers and abstracts.","{'title': 'Introduction', 'number': '1'}"
"As recent advances in NLP technology depend on machine learning techniques, annotated corpora from which system can acquire rules (including grammar rules, lexicon, etc.) are indispensable 220 resources for customizing general-purpose NLP tools.","{'title': 'Introduction', 'number': '1'}"
"In bio-textmining, for example, training on part-of-speech (POS)-annotated GENIA cor pus was reported to improve the accuracy of JunK tagger (English POS tagger) (Kazama et al., 2001) from 83.5% to 98.1% on MEDLINE abstracts (Tateisi and Tsujii, 2004), and the FraMed corpus (Wermter and Hahn, 2004) was used to train TnT tagger on German (Brants, 2000) to improve its accuracy from 95.7% to 98% on clinical reports and other biomedical texts.","{'title': 'Introduction', 'number': '1'}"
"Corpus annotated for syntactic structures is expected to play a similar role in tuning parsers to biomedical domain, i.e., similar improve ment on the performance of parsers is expected by using domain-specific treebank as a resource for learning.","{'title': 'Introduction', 'number': '1'}"
"For this purpose, we construct GENA Treebank (GTB), a treebank on research abstracts in biomedical domain.","{'title': 'Introduction', 'number': '1'}"
"The base text of GTB is that of the GENIA cor pus constructed at University of Tokyo (Kim et al., 2003), which is a collection of research ab stracts selected from the search results of MEDLINE database with keywords (MeSH terms) human, blood cells and transcription factors.","{'title': 'Outline of the Corpus. ', 'number': '2'}"
"In the GENIA corpus, the abstracts are en coded in an XML scheme where each abstract is numbered with MEDLINE UID and contains title and abstract.","{'title': 'Outline of the Corpus. ', 'number': '2'}"
The text of title and abstract is segmented into sentences in which biological terms are annotated with their semantic classes.,"{'title': 'Outline of the Corpus. ', 'number': '2'}"
"The GENIA corpus is also annotated for part-of speech (POS) (Tateisi and Tsujii, 2004), and coreference is also annotated in a part of the GENIA corpus by MedCo project at Institute for Infocomm Research, Singapore (Yang et al 2004).","{'title': 'Outline of the Corpus. ', 'number': '2'}"
GTB is the addition of syntactic information to the GENIA corpus.,"{'title': 'Outline of the Corpus. ', 'number': '2'}"
"By annotating various linguistic information on a same set of text, the GENIA corpus will be a resource not only for individual purpose such as named entity extrac tion or training parsers but also for integrated systems such as information extraction using deep linguistic analysis.","{'title': 'Outline of the Corpus. ', 'number': '2'}"
"Similar attempt of con structing integrated corpora is being done in University of Pennsylvania, where a corpus of MEDLINE abstracts in CYP450 and oncology domains where annotated for named entities, POS, and tree structure of sentences (Kulick et al, 2004).","{'title': 'Outline of the Corpus. ', 'number': '2'}"
2.1 Annotation Scheme.,"{'title': 'Outline of the Corpus. ', 'number': '2'}"
"The annotation scheme basically follows the Penn Treebank II (PTB) scheme (Beis et al 1995), encoded in XML.","{'title': 'Outline of the Corpus. ', 'number': '2'}"
"A non-null constituent is marked as an element, with its syntactic cate gory (which may be combined with its function tags indicating grammatical roles such as -SBJ, -PRD, and -ADV) used as tags.","{'title': 'Outline of the Corpus. ', 'number': '2'}"
A null constitu ent is marked as a childless element whose tag corresponds to its categories.,"{'title': 'Outline of the Corpus. ', 'number': '2'}"
Other function tags are encoded as attributes.,"{'title': 'Outline of the Corpus. ', 'number': '2'}"
"Figure 1 shows an ex ample of annotated sentence in XML, and the corresponding PTB notation.","{'title': 'Outline of the Corpus. ', 'number': '2'}"
"The label ?S? means ?sentence?, ?NP?","{'title': 'Outline of the Corpus. ', 'number': '2'}"
"noun phrase, ?PP?","{'title': 'Outline of the Corpus. ', 'number': '2'}"
"prepositional phrase, and ?VP?","{'title': 'Outline of the Corpus. ', 'number': '2'}"
verb phrase.,"{'title': 'Outline of the Corpus. ', 'number': '2'}"
The label ?NP-SBJ?,"{'title': 'Outline of the Corpus. ', 'number': '2'}"
means that the element is an NP that serves as the subject of the sentence.,"{'title': 'Outline of the Corpus. ', 'number': '2'}"
"A null element, the trace of the object of ?stud ied?","{'title': 'Outline of the Corpus. ', 'number': '2'}"
"moved by passivization, is denoted by ? <NP NULL=""NONE"" ref=""i55""/>?","{'title': 'Outline of the Corpus. ', 'number': '2'}"
in XML and ?*-55?,"{'title': 'Outline of the Corpus. ', 'number': '2'}"
in PTB notation.,"{'title': 'Outline of the Corpus. ', 'number': '2'}"
The number ?55?,"{'title': 'Outline of the Corpus. ', 'number': '2'}"
"which refers to the identifier of the moved ele ment, is denoted by ?id? and ?ref?","{'title': 'Outline of the Corpus. ', 'number': '2'}"
"attributes in XML, and is denoted as a part of a label in PTB.","{'title': 'Outline of the Corpus. ', 'number': '2'}"
"In addition to changing the encoding, we made some modifications to the scheme.","{'title': 'Outline of the Corpus. ', 'number': '2'}"
"First, analysis within the noun phrase is simplified.","{'title': 'Outline of the Corpus. ', 'number': '2'}"
"Second, semantic division of adverbial phrases such as ??TMP?","{'title': 'Outline of the Corpus. ', 'number': '2'}"
(time) and ??MNR?,"{'title': 'Outline of the Corpus. ', 'number': '2'}"
(manner) are not used: adverbial constituents other than ?ADVP?,"{'title': 'Outline of the Corpus. ', 'number': '2'}"
(adverbial phrases) or ?PP?,"{'title': 'Outline of the Corpus. ', 'number': '2'}"
used ad verbially are marked with ?ADV tags but not with semantic tags.,"{'title': 'Outline of the Corpus. ', 'number': '2'}"
"Third, a coordination struc ture is explicitly marked with the attribute SYN=?COOD?","{'title': 'Outline of the Corpus. ', 'number': '2'}"
whereas in the original PTB scheme it is not marked as such.,"{'title': 'Outline of the Corpus. ', 'number': '2'}"
"In our GTB scheme, ?NX?","{'title': 'Outline of the Corpus. ', 'number': '2'}"
(head of a com plex noun phrase) and ?NAC?,"{'title': 'Outline of the Corpus. ', 'number': '2'}"
(a certain kind of nominal modifier within a noun phrase) of the PTB scheme are not used.,"{'title': 'Outline of the Corpus. ', 'number': '2'}"
A noun phrase is gen erally left unstructured.,"{'title': 'Outline of the Corpus. ', 'number': '2'}"
This is mainly in order to simplify the process of annotation.,"{'title': 'Outline of the Corpus. ', 'number': '2'}"
"In case of biomedical abstracts, long noun phrases often involve multi-word technical terms whose syn tactic structure is difficult to determine without deep domain knowledge.","{'title': 'Outline of the Corpus. ', 'number': '2'}"
"However, the structure of noun phrases are usually independent of the structure outside the phrase, so that it would be 221 easier to analyze the phrases involving such terms independently (e.g. by biologists) and later merge the two analysis together.","{'title': 'Outline of the Corpus. ', 'number': '2'}"
Thus we have decided that we leave noun phrases unstructured in GTB annotation unless their analy sis is necessary for determining the structure outside the phrase.,"{'title': 'Outline of the Corpus. ', 'number': '2'}"
One of the exception is the cases that involves coordination where it is nec essary to explicitly mark up the coordinated constituents.,"{'title': 'Outline of the Corpus. ', 'number': '2'}"
"In addition, we have added special attributes ?TXTERR?, ?UNSURE?, and ?COMMENT?","{'title': 'Outline of the Corpus. ', 'number': '2'}"
for later inspection.,"{'title': 'Outline of the Corpus. ', 'number': '2'}"
The ?TXTERR?,"{'title': 'Outline of the Corpus. ', 'number': '2'}"
is used when the annotator suspects that there is a grammatical error in the original text; the ?UNSURE?,"{'title': 'Outline of the Corpus. ', 'number': '2'}"
attribute is used when the annotator is not confident; and the ?COMMENT?,"{'title': 'Outline of the Corpus. ', 'number': '2'}"
is used for free comments (e.g. reason of using ?UNSURE?),"{'title': 'Outline of the Corpus. ', 'number': '2'}"
by the annotator.,"{'title': 'Outline of the Corpus. ', 'number': '2'}"
2.2 Annotation Process.,"{'title': 'Outline of the Corpus. ', 'number': '2'}"
The sentences in the titles and abstracts of the base text of GENIA corpus are annotated manu ally using an XML editor used for the Global Document Annotation project (Hasida 2000).,"{'title': 'Outline of the Corpus. ', 'number': '2'}"
"Although the sentence boundaries were adopted from the corpus, the tree structure annotation was done independently of POS- and term- an notation already done on the GENIA corpus.","{'title': 'Outline of the Corpus. ', 'number': '2'}"
The annotator was a Japanese non-biologist who has previously involved in the POS annotation of the GENIA corpus and accustomed to the style of research abstracts in English.,"{'title': 'Outline of the Corpus. ', 'number': '2'}"
"Manually annotated abstracts are automatically converted to the PTB format, merged with the POS annota tion of the GENIA corpus (version 3.02).","{'title': 'Outline of the Corpus. ', 'number': '2'}"
"So far, 500 abstracts are annotated and converted to the merged PTB format.","{'title': 'Annotation Results. ', 'number': '3'}"
"In the merg ing process, we found several annotation errors.","{'title': 'Annotation Results. ', 'number': '3'}"
The 500 abstracts with correction of these errors are made publicly available as ?The GENIA Treebank Beta Version?,"{'title': 'Annotation Results. ', 'number': '3'}"
(GTB-beta).,"{'title': 'Annotation Results. ', 'number': '3'}"
"For further clean-up, we also tried to parse the corpus by the Enju parser (Miyao and Tsujii 2004), and identify the error of the corpus by investigating into the parse errors.","{'title': 'Annotation Results. ', 'number': '3'}"
Enju is an HPSG parser that can be trained with PTB-type corpora which is reported to have 87% accuracy on Wall Street Journal portion of Penn Treebank corpus.,"{'title': 'Annotation Results. ', 'number': '3'}"
"Currently the accuracy of the parser drops down to 82% on GTB-beta, and although proper quantitative analysis is yet to be done, it was found that the mismatches between labels of the treebank and the GENIA POS corpus (e.g. an ?ing form labeled as noun in the POS corpus and as the head of a verb phrase in the tree corpus) are a major source of parse error.","{'title': 'Annotation Results. ', 'number': '3'}"
The cor rection is complicated because several errors in the GENIA POS corpus were found in this cleaning-up process.,"{'title': 'Annotation Results. ', 'number': '3'}"
"When the cleaning-up process is done, we will make the corpus pub licly available as the proper release.","{'title': 'Annotation Results. ', 'number': '3'}"
"<S><PP>In <NP>the present paper </NP></PP>, <NP-SBJ id=""i55""><NP>the binding </NP><PP>of <NP>a [125I]-labeled aldosterone derivative </NP></PP><PP>to <NP><NP>plasma membrane rich fractions </NP><PP>of HML </PP></NP></PP></NP-SBJ><VP>was <VP>studied <NP NULL=""NONE"" ref=""i55""/></VP> </VP>.</S>","{'title': 'Annotation Results. ', 'number': '3'}"
We have also checked inter-annotator agreement.,"{'title': 'Inter-Annotator Agreement. ', 'number': '4'}"
"Although the PTB scheme is popular among natural language processing society, applicabil ity of the scheme to highly specialized text such as research abstract is yet to be discussed.","{'title': 'Inter-Annotator Agreement. ', 'number': '4'}"
"Espe cially, when the annotation is done by linguists, lack of domain knowledge might decrease the stability and accuracy of annotation.","{'title': 'Inter-Annotator Agreement. ', 'number': '4'}"
A small part of the base text set (10 ab stracts) was annotated by another annotator.,"{'title': 'Inter-Annotator Agreement. ', 'number': '4'}"
"The 10 abstracts were chosen randomly, had 6 to 17 sentences per abstract (total 108 sentences).","{'title': 'Inter-Annotator Agreement. ', 'number': '4'}"
"The new annotator had a similar background as the first annotator that she is a Japanese non biologist who has experiences in translation of (S (PP In (NP the present paper)), (NP-SBJ-55 (NP the binding) (PP of (NP a [125I]-labeled aldosterone derivative)) (PP to (NP (NP plasma membrane rich fractions) (PP of HML)))) (VP was (VP studied * 55)).)","{'title': 'Inter-Annotator Agreement. ', 'number': '4'}"
Figure 1.,"{'title': 'Inter-Annotator Agreement. ', 'number': '4'}"
"The sentence ?In the present paper, the binding of a [125I]-labeled aldosterone derivative to plasma mem brane rich fractions of HML was studied?","{'title': 'Inter-Annotator Agreement. ', 'number': '4'}"
annotated in XML and PTB formats.,"{'title': 'Inter-Annotator Agreement. ', 'number': '4'}"
222 technical documents in English and in corpus annotation of English texts.,"{'title': 'Inter-Annotator Agreement. ', 'number': '4'}"
"The two results were examined manually, and there were 131 disagreements.","{'title': 'Inter-Annotator Agreement. ', 'number': '4'}"
Almost every sentence had at least one disagreement.,"{'title': 'Inter-Annotator Agreement. ', 'number': '4'}"
We have made the ?gold standard?,"{'title': 'Inter-Annotator Agreement. ', 'number': '4'}"
"from the two sets of abstracts by resolving the disagreements, and the accuracy of the annotators against this gold standard were 96.7% for the first annotator and 97.4% for the second annotator.","{'title': 'Inter-Annotator Agreement. ', 'number': '4'}"
"Of the disagreement, the most prominent were the cases involving coordination, espe cially the ones with ellipsis.","{'title': 'Inter-Annotator Agreement. ', 'number': '4'}"
"For example, one annotator annotated the phrase ?IL-1- and IL-18 mediated function?","{'title': 'Inter-Annotator Agreement. ', 'number': '4'}"
"as in Figure 2a, the other annotated as Figure 2b.","{'title': 'Inter-Annotator Agreement. ', 'number': '4'}"
Such problem is addressed in the PTB guideline and both formats are allowed as alter natives.,"{'title': 'Inter-Annotator Agreement. ', 'number': '4'}"
"As coordination with ellipsis occurs rather frequently in research abstracts, this kind of phenomena has higher effect on decrease of the agreement rate than in Penn Treebank.","{'title': 'Inter-Annotator Agreement. ', 'number': '4'}"
"Of the 131 disagreements, 25 were on this type of coordination.","{'title': 'Inter-Annotator Agreement. ', 'number': '4'}"
Another source of disagreement is the at tachment of modifiers such as prepositional phrases and pronominal adjectives.,"{'title': 'Inter-Annotator Agreement. ', 'number': '4'}"
"However, most are ?benign ambiguity?","{'title': 'Inter-Annotator Agreement. ', 'number': '4'}"
"where the difference of the structure does not affect on interpre tation, such as ?high expression of STAT in monocytes?","{'title': 'Inter-Annotator Agreement. ', 'number': '4'}"
where the prepositional phrase ?in monocytes?,"{'title': 'Inter-Annotator Agreement. ', 'number': '4'}"
can attach to ?expression?,"{'title': 'Inter-Annotator Agreement. ', 'number': '4'}"
or ?STAT?,"{'title': 'Inter-Annotator Agreement. ', 'number': '4'}"
"without much difference in meaning, and ?is augmented when the sensitizing tumor is a genetically modified variant?","{'title': 'Inter-Annotator Agreement. ', 'number': '4'}"
where the whclause can attach to ?is augmented?,"{'title': 'Inter-Annotator Agreement. ', 'number': '4'}"
or ?aug mented?,"{'title': 'Inter-Annotator Agreement. ', 'number': '4'}"
without changing the meaning.,"{'title': 'Inter-Annotator Agreement. ', 'number': '4'}"
The PTB guideline states that the modifier should be attached at the higher level in the former case and at the lower case in the latter.,"{'title': 'Inter-Annotator Agreement. ', 'number': '4'}"
"In the annota tion results, one annotator consistently attached the modifiers in both cases at the higher level, and the other consistently at the lower level, in dicating that the problem is in understanding the scheme rather than understanding the sentence.","{'title': 'Inter-Annotator Agreement. ', 'number': '4'}"
"Only 15 cases were true ambiguities that needed knowledge of biology to solve, in which 5 in volved coordination (e.g., the scope of ?various?","{'title': 'Inter-Annotator Agreement. ', 'number': '4'}"
in ?various T cell lines and peripheral blood cells?),"{'title': 'Inter-Annotator Agreement. ', 'number': '4'}"
"Although the number was small, there were disagreements on how to annotate a mathematical formula such as ?n=2?","{'title': 'Inter-Annotator Agreement. ', 'number': '4'}"
"embedded in the sen tence, since mathematical formulae were outside the scope of the original PTB scheme.","{'title': 'Inter-Annotator Agreement. ', 'number': '4'}"
One annotator annotated this kind of phrase consis tently as a phrase with ?=?,"{'title': 'Inter-Annotator Agreement. ', 'number': '4'}"
"as an adjective, the other annotated as phrase with ?=?","{'title': 'Inter-Annotator Agreement. ', 'number': '4'}"
as a verb.,"{'title': 'Inter-Annotator Agreement. ', 'number': '4'}"
There were 6 such cases.,"{'title': 'Inter-Annotator Agreement. ', 'number': '4'}"
Another disagreement particular to abstracts is a treatment of labeled sentences.,"{'title': 'Inter-Annotator Agreement. ', 'number': '4'}"
There were 8 sentences in two ab stracts where there is a label like ?Background:?.,"{'title': 'Inter-Annotator Agreement. ', 'number': '4'}"
One annotator included the colon (?:?),"{'title': 'Inter-Annotator Agreement. ', 'number': '4'}"
"in the la bel, while the other did not.","{'title': 'Inter-Annotator Agreement. ', 'number': '4'}"
"Yet another is that one regarded the phrase ?Author et al as coor dination, and the other regarded ?et al as a modifier.","{'title': 'Inter-Annotator Agreement. ', 'number': '4'}"
"<NP SYN=""COOD""> <NP><ADJP>IL-1- <ADJP NULL=""QSTN""/></ADJP> <NP NULL=""RNR"" ref=""i20""/></NP> and <NP>IL-18-mediated <NP NULL=""RNR"" ref=""i20""/></NP> <NP id=""i20"">function </NP> Other disagreements are more general type such as regarding ?-ed?","{'title': 'Inter-Annotator Agreement. ', 'number': '4'}"
"form of a verb as an ad jective or a participle, miscellaneous errors such as omission of a subtype of label (such as ? PRD?","{'title': 'Inter-Annotator Agreement. ', 'number': '4'}"
"or ?-SBJ) or the position of <PRN> tags <NP> <ADJP SYN=""COOD""> <ADJP>IL-1- <ADJP NULL=""QSTN""/></ADJP> and <ADJP>IL-18-mediated </ADJP></ADJP> function </NP> NP ADJP Function ADJP and ADJP IL-1 * IL-18 mediated Figure 2a.","{'title': 'Inter-Annotator Agreement. ', 'number': '4'}"
Annotation of a coordinated phrase by the first annotator.,"{'title': 'Inter-Annotator Agreement. ', 'number': '4'}"
A* denotes a null constituent.,"{'title': 'Inter-Annotator Agreement. ', 'number': '4'}"
</NP> NP NP And NP ADJP *20 IL-18 meidiated NP IL-1 * function20 Figure 2b.,"{'title': 'Inter-Annotator Agreement. ', 'number': '4'}"
Annotation of the same phrase as in Figure 2a by the second annotator.,"{'title': 'Inter-Annotator Agreement. ', 'number': '4'}"
A * denotes a null constituent and ?20?,"{'title': 'Inter-Annotator Agreement. ', 'number': '4'}"
denotes coindexing.,"{'title': 'Inter-Annotator Agreement. ', 'number': '4'}"
"223 with regards to ?,?","{'title': 'Inter-Annotator Agreement. ', 'number': '4'}"
"for the inserted phrase, or the errors which look like just ?careless?.","{'title': 'Inter-Annotator Agreement. ', 'number': '4'}"
Such dis agreements and mistakes are at least partially eliminated when reliable taggers and parsers are available for preprocessing,"{'title': 'Inter-Annotator Agreement. ', 'number': '4'}"
The result of the inter-annotator agreement test indicates that the writing style rather than the contents of the research abstracts is the source of the difficulty in tree annotation.,"{'title': 'Discussion. ', 'number': '5'}"
"Con trary to the expectation that the lack of domain knowledge causes a problem in annotation on attachments of modifiers, the number of cases where annotation of modifier attachment needs domain knowledge is small.","{'title': 'Discussion. ', 'number': '5'}"
This indicates that linguists can annotate most of syntactic structure without an expert level of domain knowledge.,"{'title': 'Discussion. ', 'number': '5'}"
"A major source of difficulty is coordination, especially the ones involving ellipsis.","{'title': 'Discussion. ', 'number': '5'}"
"Coordination is reported to be difficult phenomena in an notation of different levels in the GENIA corpus (Tateisi and Tsujii, 2004), (Kim et al, 2003).","{'title': 'Discussion. ', 'number': '5'}"
"In addition to the fact that this is the major source of inter-annotator agreement, the annotator often commented the coordinated structure as ?unsure?.","{'title': 'Discussion. ', 'number': '5'}"
"The problem of coordination can be divided into two with different nature: one is that the annota tion policy is still not well-established for the coordination involving ellipsis, and the other is an ambiguity when the coordinated phrase has modifiers.","{'title': 'Discussion. ', 'number': '5'}"
"Syntax annotation of coordination with ellipsis is difficult in general but the more so in an notation of abstracts than in the case of general texts, because in abstracts authors tend to pack information in limited number of words.","{'title': 'Discussion. ', 'number': '5'}"
"The PTB guideline dedicates a long section for this phenomena and allows alternatives in annotation, but there are still cases which are not well covered by the scheme.","{'title': 'Discussion. ', 'number': '5'}"
"For example, in addition to the disagreement, the phrase illustrated in Figure 2a and Figure 2b shows another problem of the annotation scheme.","{'title': 'Discussion. ', 'number': '5'}"
Both annotators fail to indicate that it is ?mediated?,"{'title': 'Discussion. ', 'number': '5'}"
that was to be after ?IL-1?,"{'title': 'Discussion. ', 'number': '5'}"
because there is no mechanism of coindexing a null element with a part of a token.,"{'title': 'Discussion. ', 'number': '5'}"
