col1,col2
"Often the pairs are restricted to noun-modifier pairs, but there are many interesting relations, such as antonymy, that do not occur in noun-modifier pairs.",Experiment/Discussion
"However, noun-modifier pairs are interesting due to their high frequency in English.",Experiment/Discussion
"For instance, WordNet 2.0 contains more than 26,000 noun-modifier pairs, although many common noun-modifiers are not in WordNet, especially technical terms.",Experiment/Discussion
"Rosario and Hearst (2001) and Rosario, Hearst, and Fillmore (2002) classify nounmodifier relations in the medical domain, using Medical Subject Headings (MeSH) and Unified Medical Language System (UMLS) as lexical resources for representing each noun-modifier pair with a feature vector.",Experiment/Discussion
They trained a neural network to distinguish 13 classes of semantic relations.,Experiment/Discussion
"Nastase and Szpakowicz (2003) explore a similar approach to classifying general noun-modifier pairs (i.e., not restricted to a particular domain, such as medicine), using WordNet and Roget’s Thesaurus as lexical resources.",Experiment/Discussion
"Vanderwende (1994) used hand-built rules, together with a lexical knowledge base, to classify noun-modifier pairs.",Experiment/Discussion
"None of these approaches explicitly involved measuring relational similarity, but any classification of semantic relations necessarily employs some implicit notion of relational similarity since members of the same class must be relationally similar to some extent.",Experiment/Discussion
"Barker and Szpakowicz (1998) tried a corpus-based approach that explicitly used a measure of relational similarity, but their measure was based on literal matching, which limited its ability to generalize.",Experiment/Discussion
Moldovan et al. (2004) also used a measure of relational similarity based on mapping each noun and modifier into semantic classes in WordNet.,Experiment/Discussion
"The noun-modifier pairs were taken from a corpus, and the surrounding context in the corpus was used in a word sense disambiguation algorithm to improve the mapping of the noun and modifier into WordNet.",Experiment/Discussion
Turney and Littman (2005) used the VSM (as a component in a single nearest neighbor learning algorithm) to measure relational similarity.,Experiment/Discussion
"We take the same approach here, substituting LRA for the VSM, in Section 7.",Experiment/Discussion
"Lauer (1995) used a corpus-based approach (using the BNC) to paraphrase noun– modifier pairs by inserting the prepositions of, for, in, at, on, from, with, and about.",Experiment/Discussion
"For example, reptile haven was paraphrased as haven for reptiles.",Experiment/Discussion
Lapata and Keller (2004) achieved improved results on this task by using the database of AltaVista’s search engine as a corpus.,Experiment/Discussion
We believe that the intended sense of a polysemous word is determined by its semantic relations with the other words in the surrounding text.,Experiment/Discussion
"If we can identify the semantic relations between the given word and its context, then we can disambiguate the given word.",Experiment/Discussion
Yarowsky’s (1993) observation that collocations are almost always monosemous is evidence for this view.,Experiment/Discussion
"Federici, Montemagni, and Pirrelli (1997) present an analogybased approach to word sense disambiguation.",Experiment/Discussion
"For example, consider the word plant.",Experiment/Discussion
"Out of context, plant could refer to an industrial plant or a living organism.",Experiment/Discussion
Suppose plant appears in some text near food.,Experiment/Discussion
A typical approach to disambiguating plant would compare the attributional similarity of food and industrial plant to the attributional similarity of food and living organism (Lesk 1986; Banerjee and Pedersen 2003).,Experiment/Discussion
"In this case, the decision may not be clear, since industrial plants often produce food and living organisms often serve as food.",Experiment/Discussion
It would be very helpful to know the relation between food and plant in this example.,Experiment/Discussion
"In the phrase “food for the plant,” the relation between food and plant strongly suggests that the plant is a living organism, since industrial plants do not need food.",Experiment/Discussion
"In the text “food at the plant,” the relation strongly suggests that the plant is an industrial plant, since living organisms are not usually considered as locations.",Experiment/Discussion
"Thus, an algorithm for classifying semantic relations (as in Section 7) should be helpful for word sense disambiguation.",Experiment/Discussion
"The problem of relation extraction is, given an input document and a specific relation R, to extract all pairs of entities (if any) that have the relation R in the document.",Experiment/Discussion
The problem was introduced as part of the Message Understanding Conferences (MUC) in 1998.,Experiment/Discussion
"Zelenko, Aone, and Richardella (2003) present a kernel method for extracting the relations person–affiliation and organization–location.",Experiment/Discussion
"For example, in the sentence John Smith is the chief scientist of the Hardcom Corporation, there is a person–affiliation relation between John Smith and Hardcom Corporation (Zelenko, Aone, and Richardella 2003).",Experiment/Discussion
"This is similar to the problem of classifying semantic relations (Section 3.4), except that information extraction focuses on the relation between a specific pair of entities in a specific document, rather than a general pair of words in general text.",Experiment/Discussion
Therefore an algorithm for classifying semantic relations should be useful for information extraction.,Experiment/Discussion
"In the VSM approach to classifying semantic relations (Turney and Littman 2005), we would have a training set of labeled examples of the relation person–affiliation, for instance.",Experiment/Discussion
Each example would be represented by a vector of pattern frequencies.,Experiment/Discussion
"Given a specific document discussing John Smith and Hardcom Corporation, we could construct a vector representing the relation between these two entities and then measure the relational similarity between this unlabeled vector and each of our labeled training vectors.",Experiment/Discussion
"It would seem that there is a problem here because the training vectors would be relatively dense, since they would presumably be derived from a large corpus, but the new unlabeled vector for John Smith and Hardcom Corporation would be very sparse, since these entities might be mentioned only once in the given document.",Experiment/Discussion
"However, this is not a new problem for the VSM; it is the standard situation when the VSM is used for information retrieval.",Experiment/Discussion
"A query to a search engine is represented by a very sparse vector, whereas a document is represented by a relatively dense vector.",Experiment/Discussion
"There are well-known techniques in information retrieval for coping with this disparity, such as weighting schemes for query vectors that are different from the weighting schemes for document vectors (Salton and Buckley 1988).",Experiment/Discussion
"In their article on classifying semantic relations, Moldovan et al. (2004) suggest that an important application of their work is question answering (QA).",Experiment/Discussion
"As defined in the Text Retrieval Conference (TREC) QA track, the task is to answer simple questions, such as “Where have nuclear incidents occurred?”, by retrieving a relevant document from a large corpus and then extracting a short string from the document, such as The Three Mile Island nuclear incident caused a DOE policy crisis.",Experiment/Discussion
Moldovan et al. (2004) propose to map a given question to a semantic relation and then search for that relation in a corpus of semantically tagged text.,Experiment/Discussion
They argue that the desired semantic relation can easily be inferred from the surface form of the question.,Experiment/Discussion
A question of the form “Where... ?” is likely to be looking for entities with a location relation and a question of the form “What did ... make?” is likely to be looking for entities with a product relation.,Experiment/Discussion
"In Section 7, we show how LRA can recognize relations such as location and product (see Table 19).",Experiment/Discussion
Hearst (1992) presents an algorithm for learning hyponym (type of) relations from a corpus and Berland and Charniak (1999) describe how to learn meronym (part of) relations from a corpus.,Experiment/Discussion
"These algorithms could be used to automatically generate a thesaurus or dictionary, but we would like to handle more relations than hyponymy and meronymy.",Experiment/Discussion
WordNet distinguishes more than a dozen semantic relations between words (Fellbaum 1998) and Nastase and Szpakowicz (2003) list 30 semantic relations for noun-modifier pairs.,Experiment/Discussion
Hearst and Berland and Charniak (1999) use manually generated rules to mine text for semantic relations.,Experiment/Discussion
Turney and Littman (2005) also use a manually generated set of 64 patterns.,Experiment/Discussion
LRA does not use a predefined set of patterns; it learns patterns from a large corpus.,Experiment/Discussion
"Instead of manually generating new rules or patterns for each new semantic relation, it is possible to automatically learn a measure of relational similarity that can handle arbitrary semantic relations.",Experiment/Discussion
"A nearest neighbor algorithm can then use this relational similarity measure to learn to classify according to any set of classes of relations, given the appropriate labeled training data.",Experiment/Discussion
"Girju, Badulescu, and Moldovan (2003) present an algorithm for learning meronym relations from a corpus.",Experiment/Discussion
"Like Hearst (1992) and Berland and Charniak (1999), they use manually generated rules to mine text for their desired relation.",Experiment/Discussion
"However, they supplement their manual rules with automatically learned constraints, to increase the precision of the rules.",Experiment/Discussion
"Veale (2003) has developed an algorithm for recognizing certain types of word analogies, based on information in WordNet.",Experiment/Discussion
He proposes to use the algorithm for analogical information retrieval.,Experiment/Discussion
"For example, the query Muslim church should return mosque and the query Hindu bible should return the Vedas.",Experiment/Discussion
"The algorithm was designed with a focus on analogies of the form adjective:noun::adjective:noun, such as Christian:church::Muslim:mosque.",Experiment/Discussion
A measure of relational similarity is applicable to this task.,Experiment/Discussion
"Given a pair of words, A and B, the task is to return another pair of words, X and Y, such that there is high relational similarity between the pair A:X and the pair Y:B.",Experiment/Discussion
"For example, given A = Muslim and B = church, return X = mosque and Y = Christian.",Experiment/Discussion
(The pair Muslim:mosque has a high relational similarity to the pair Christian:church.),Experiment/Discussion
Marx et al. (2002) developed an unsupervised algorithm for discovering analogies by clustering words from two different corpora.,Experiment/Discussion
Each cluster of words in one corpus is coupled one-to-one with a cluster in the other corpus.,Experiment/Discussion
"For example, one experiment used a corpus of Buddhist documents and a corpus of Christian documents.",Experiment/Discussion
"A cluster of words such as {Hindu, Mahayana, Zen, ...} from the Buddhist corpus was coupled with a cluster of words such as {Catholic, Protestant, ...} from the Christian corpus.",Experiment/Discussion
Thus the algorithm appears to have discovered an analogical mapping between Buddhist schools and traditions and Christian schools and traditions.,Experiment/Discussion
"This is interesting work, but it is not directly applicable to SAT analogies, because it discovers analogies between clusters of words rather than individual words.",Experiment/Discussion
"A semantic frame for an event such as judgement contains semantic roles such as judge, evaluee, and reason, whereas an event such as statement contains roles such as speaker, addressee, and message (Gildea and Jurafsky 2002).",Experiment/Discussion
The task of identifying semantic roles is to label the parts of a sentence according to their semantic roles.,Experiment/Discussion
"We believe that it may be helpful to view semantic frames and their semantic roles as sets of semantic relations; thus, a measure of relational similarity should help us to identify semantic roles.",Experiment/Discussion
"Moldovan et al. (2004) argue that semantic roles are merely a special case of semantic relations (Section 3.4), since semantic roles always involve verbs or predicates, but semantic relations can involve words of any part of speech.",Experiment/Discussion
This section examines past work on measuring attributional and relational similarity using the VSM.,Experiment/Discussion
The VSM was first developed for information retrieval (Salton and McGill 1983; Salton and Buckley 1988; Salton 1989) and it is at the core of most modern search engines (Baeza-Yates and Ribeiro-Neto 1999).,Experiment/Discussion
"In the VSM approach to information retrieval, queries and documents are represented by vectors.",Experiment/Discussion
Elements in these vectors are based on the frequencies of words in the corresponding queries and documents.,Experiment/Discussion
"The frequencies are usually transformed by various formulas and weights, tailored to improve the effectiveness of the search engine (Salton 1989).",Experiment/Discussion
The attributional similarity between a query and a document is measured by the cosine of the angle between their corresponding vectors.,Experiment/Discussion
"For a given query, the search engine sorts the matching documents in order of decreasing cosine.",Experiment/Discussion
The VSM approach has also been used to measure the attributional similarity of words (Lesk 1969; Ruge 1992; Pantel and Lin 2002).,Experiment/Discussion
"Pantel and Lin (2002) clustered words according to their attributional similarity, as measured by a VSM.",Experiment/Discussion
"Their algorithm is able to discover the different senses of polysemous words, using unsupervised learning.",Experiment/Discussion
"Latent Semantic Analysis enhances the VSM approach to information retrieval by using the Singular Value Decomposition (SVD) to smooth the vectors, which helps to handle noise and sparseness in the data (Deerwester et al. 1990; Dumais 1993; Landauer and Dumais 1997).",Experiment/Discussion
SVD improves both document-query attributional similarity measures (Deerwester et al. 1990; Dumais 1993) and word–word attributional similarity measures (Landauer and Dumais 1997).,Experiment/Discussion
"LRA also uses SVD to smooth vectors, as we discuss in Section 5.",Experiment/Discussion
"Let R1 be the semantic relation (or set of relations) between a pair of words, A and B, and let R2 be the semantic relation (or set of relations) between another pair, C and D. We wish to measure the relational similarity between R1 and R2.",Experiment/Discussion
The relations R1 and R2 are not given to us; our task is to infer these hidden (latent) relations and then compare them.,Experiment/Discussion
"In the VSM approach to relational similarity (Turney and Littman 2005), we create vectors, r1 and r2, that represent features of R1 and R2, and then measure the similarity of R1 and R2 by the cosine of the angle 0 between r1 and r2: We create a vector, r, to characterize the relationship between two words, X and Y, by counting the frequencies of various short phrases containing X and Y. Turney and Littman (2005) use a list of 64 joining terms, such as of, for, and to, to form 128 phrases that contain X and Y, such as X of Y, Y of X, X for Y, Y for X, X to Y, and Y to X.",Experiment/Discussion
These phrases are then used as queries for a search engine and the number of hits (matching documents) is recorded for each query.,Experiment/Discussion
This process yields a vector of 128 numbers.,Experiment/Discussion
"If the number of hits for a query is x, then the corresponding element in the vector r is log(x + 1).",Experiment/Discussion
Several authors report that the logarithmic transformation of frequencies improves cosine-based similarity measures (Salton and Buckley 1988; Ruge 1992; Lin 1998b).,Experiment/Discussion
"Turney and Littman (2005) evaluated the VSM approach by its performance on 374 SAT analogy questions, achieving a score of 47%.",Experiment/Discussion
"Since there are five choices for each question, the expected score for random guessing is 20%.",Experiment/Discussion
"To answer a multiple-choice analogy question, vectors are created for the stem pair and each choice pair, and then cosines are calculated for the angles between the stem pair and each choice pair.",Experiment/Discussion
The best guess is the choice pair with the highest cosine.,Experiment/Discussion
We use the same set of analogy questions to evaluate LRA in Secti on 6.,Experiment/Discussion
"Computational Linguistics Volume 32, Number 3 The VSM was also evaluated by its performance as a distance (nearness) measure in a supervised nearest neighbor classifier for noun-modifier semantic relations (Turney and Littman 2005).",Experiment/Discussion
The evaluation used 600 hand-labeled noun-modifier pairs from Nastase and Szpakowicz (2003).,Experiment/Discussion
A testing pair is classified by searching for its single nearest neighbor in the labeled training data.,Experiment/Discussion
The best guess is the label for the training pair with the highest cosine.,Experiment/Discussion
LRA is evaluated with the same set of noun-modifier pairs in Section 7.,Experiment/Discussion
Turney and Littman (2005) used the AltaVista search engine to obtain the frequency information required to build vectors for the VSM.,Experiment/Discussion
Thus their corpus was the set of all Web pages indexed by AltaVista.,Experiment/Discussion
"At the time, the English subset of this corpus consisted of about 5 × 1011 words.",Experiment/Discussion
"Around April 2004, AltaVista made substantial changes to their search engine, removing their advanced search operators.",Experiment/Discussion
"Their search engine no longer supports the asterisk operator, which was used by Turney and Littman (2005) for stemming and wild-card searching.",Experiment/Discussion
"AltaVista also changed their policy toward automated searching, which is now forbidden.3 Turney and Littman (2005) used AltaVista’s hit count, which is the number of documents (Web pages) matching a given query, but LRA uses the number of passages (strings) matching a query.",Experiment/Discussion
"In our experiments with LRA (Sections 6 and 7), we use a local copy of the Waterloo MultiText System (WMTS) (Clarke, Cormack, and Palmer 1998; Terra and Clarke 2003), running on a 16 CPU Beowulf Cluster, with a corpus of about 5 × 1010 English words.",Experiment/Discussion
"The WMTS is a distributed (multiprocessor) search engine, designed primarily for passage retrieval (although document retrieval is possible, as a special case of passage retrieval).",Experiment/Discussion
The text and index require approximately one terabyte of disk space.,Experiment/Discussion
"Although AltaVista only gives a rough estimate of the number of matching documents, the WMTS gives exact counts of the number of matching passages.",Experiment/Discussion
Turney et al. (2003) combine 13 independent modules to answer SAT questions.,Experiment/Discussion
"The performance of LRA significantly surpasses this combined system, but there is no real contest between these approaches, because we can simply add LRA to the combination, as a fourteenth module.",Experiment/Discussion
"Since the VSM module had the best performance of the 13 modules (Turney et al. 2003), the following experiments focus on comparing VSM and LRA.",Experiment/Discussion
LRA takes as input a set of word pairs and produces as output a measure of the relational similarity between any two of the input pairs.,Experiment/Discussion
"LRA relies on three resources, a search engine with a very large corpus of text, a broad-coverage thesaurus of synonyms, and an efficient implementation of SVD.",Experiment/Discussion
We first present a short description of the core algorithm.,Experiment/Discussion
"Later, in the following subsections, we will give a detailed description of the algorithm, as it is applied in the experiments in Sections 6 and 7. intended to form near analogies with the corresponding original pairs (see Section 2.3).",Experiment/Discussion
The motivation for the alternate pairs is to handle cases where the original pairs cooccur rarely in the corpus.,Experiment/Discussion
"The hope is that we can find near analogies for the original pairs, such that the near analogies co-occur more frequently in the corpus.",Experiment/Discussion
The danger is that the alternates may have different relations from the originals.,Experiment/Discussion
The filtering steps above aim to reduce this risk.,Experiment/Discussion
"In our experiments, the input set contains from 600 to 2,244 word pairs.",Experiment/Discussion
"The output similarity measure is based on cosines, so the degree of similarity can range from −1 (dissimilar; 0 = 180°) to +1 (similar; 0 = 0°).",Experiment/Discussion
"Before applying SVD, the vectors are completely non-negative, which implies that the cosine can only range from 0 to +1, but SVD introduces negative values, so it is possible for the cosine to be negative, although we have never observed this in our experiments.",Experiment/Discussion
"In the following experiments, we use a local copy of the WMTS (Clarke, Cormack, and Palmer 1998; Terra and Clarke 2003).4 The corpus consists of about 5 x 1010 English words, gathered by a Web crawler, mainly from US academic Web sites.",Experiment/Discussion
"The Web pages cover a very wide range of topics, styles, genres, quality, and writing skill.",Experiment/Discussion
"The WMTS is well suited to LRA, because the WMTS scales well to large corpora (one terabyte, in our case), it gives exact frequency counts (unlike most Web search engines), it is designed for passage retrieval (rather than document retrieval), and it has a powerful query syntax.",Experiment/Discussion
"As a source of synonyms, we use Lin’s (1998a) automatically generated thesaurus.",Experiment/Discussion
"This thesaurus is available through an on-line interactive demonstration or it can be downloaded.5 We used the on-line demonstration, since the downloadable version seems to contain fewer words.",Experiment/Discussion
"For each word in the input set of word pairs, we automatically query the on-line demonstration and fetch the resulting list of synonyms.",Experiment/Discussion
"As a courtesy to other users of Lin’s on-line system, we insert a 20-second delay between each two queries.",Experiment/Discussion
"Lin’s thesaurus was generated by parsing a corpus of about 5 x 107 English words, consisting of text from the Wall Street Journal, San Jose Mercury, and AP Newswire (Lin 1998a).",Experiment/Discussion
The parser was used to extract pairs of words and their grammatical relations.,Experiment/Discussion
"Words were then clustered into synonym sets, based on the similarity of their grammatical relations.",Experiment/Discussion
Two words were judged to be highly similar when they tended to have the same kinds of grammatical relations with the same sets of words.,Experiment/Discussion
"Given a word and its part of speech, Lin’s thesaurus provides a list of words, sorted in order of decreasing attributional similarity.",Experiment/Discussion
"This sorting is convenient for LRA, since it makes it possible to focus on words with higher attributional similarity and ignore the rest.",Experiment/Discussion
"WordNet, in contrast, given a word and its part of speech, provides a list of words grouped by the possible senses of the given word, with groups sorted by the frequencies of the senses.",Experiment/Discussion
"WordNet’s sorting does not directly correspond to sorting by degree of attributional similarity, although various algorithms have been proposed for deriving attributional similarity from WordNet (Resnik 1995; Jiang and Conrath 1997; Budanitsky and Hirst 2001; Banerjee and Pedersen 2003).",Experiment/Discussion
"We use Rohde’s SVDLIBC implementation of the SVD, which is based on SVDPACKC (Berry 1992).6 In LRA, SVD is used to reduce noise and compensate for sparseness.",Experiment/Discussion
"We will go through each step of LRA, using an example to illustrate the steps.",Experiment/Discussion
Assume that the input to LRA is the 374 multiple-choice SAT word analogy questions of Turney and Littman (2005).,Experiment/Discussion
"Since there are six word pairs per question (the stem and five choices), the input consists of 2,244 word pairs.",Experiment/Discussion
"Let’s suppose that we wish to calculate the relational similarity between the pair quart:volume and the pair mile:distance, taken from the SAT question in Table 6.",Experiment/Discussion
The LRA algorithm consists of the following 12 steps: alternates as follows.,Experiment/Discussion
"For each alternate pair, send a query to the WMTS, to find the frequency of phrases that begin with one member of the pair and end with the other.",Experiment/Discussion
The phrases cannot have more than max phrase words (we use max phrase = 5).,Experiment/Discussion
Sort the alternate pairs by the frequency of their phrases.,Experiment/Discussion
