col1,col2
An evaluation script is also distributed as part of the provided software for the shared task and can be used to evaluate systems on Propbank I data.,"{'title': '3.', 'number': '5'}"
"For papers published between 2000 and 2005, there are several details of the evaluation measures for semantic role labeling that make it difficult to compare results obtained by different researchers, because researchers use their own implementations of evaluation measures, without making all the exact details clear in their papers.","{'title': '3.', 'number': '5'}"
The first issue is the existence of arguments consisting of multiple constituents.,"{'title': '3.', 'number': '5'}"
In this case it is not clear whether partial credit is to be given for guessing only some of the constituents comprising the argument correctly.,"{'title': '3.', 'number': '5'}"
"The second issue is whether the bracketing of constituents should be required to be recovered correctly, in other words, whether pairs of labelings, such as [the]ARG0 [man]ARG0 and [the man]ARG0 are to be considered the same or not.","{'title': '3.', 'number': '5'}"
"If they are considered the same, there are multiple labelings of nodes in a parse tree that are equivalent.","{'title': '3.', 'number': '5'}"
"The third issue is that when using automatic parsers, some of the constituents that are fillers of semantic roles are not recovered by the parser.","{'title': '3.', 'number': '5'}"
"In this case it is not clear how various research groups have scored their systems (using headword match, ignoring these arguments altogether, or using exact match).","{'title': '3.', 'number': '5'}"
"If we vary the choice taken for these three issues, we can come up with many (at least eight) different evaluation measures, and these details are important, because different choices can lead to rather large differences in reported performance.","{'title': '3.', 'number': '5'}"
Here we describe in detail our evaluation measures for the results on the February 2004 data reported in this article.,"{'title': '3.', 'number': '5'}"
"The measures are similar to the CoNLL evaluation measure, but report a richer set of statistics; the exact differences are discussed at the end of this section.","{'title': '3.', 'number': '5'}"
"For both gold-standard and automatic parses we use one evaluation measure, which we call argument-based evaluation.","{'title': '3.', 'number': '5'}"
"To describe the evaluation measure, we will use as an example the correct and guessed semantic role labelings shown in Figures 2(a) and 2(b).","{'title': '3.', 'number': '5'}"
Both are shown as labelings on parse tree nodes with labels of the form ARGX and C-ARGX.,"{'title': '3.', 'number': '5'}"
The label C-ARGX is used to represent multi-constituent arguments.,"{'title': '3.', 'number': '5'}"
A constituent labeled C-ARGX is assumed to be a continuation of the closest constituent to the left labeled ARGX.,"{'title': '3.', 'number': '5'}"
Our semantic role labeling system produces labelings of this form and the gold standard Propbank annotations are converted to this form as well.4 The evaluation is carried out individually for each predicate and its associated argument frame.,"{'title': '3.', 'number': '5'}"
"If a sentence contains several clauses, the several argument frames are evaluated separately.","{'title': '3.', 'number': '5'}"
"Our argument-based measures do not require exact bracketing (if the set of words constituting an argument is correct, there is no need to know how this set is broken into constituents) and do not give partial credit for labeling correctly only some of several constituents in a multi-constituent argument.","{'title': '3.', 'number': '5'}"
They are illustrated in Figure 2.,"{'title': '3.', 'number': '5'}"
"For these measures, a semantic role labeling of a sentence is viewed as a labeling on sets of words.","{'title': '3.', 'number': '5'}"
These sets can encompass several non-contiguous spans.,"{'title': '3.', 'number': '5'}"
"Figure 2(c) gives the representation of the correct and guessed labelings shown in Figures 2(a) and 2(b), in the first and second rows of the table, respectively.","{'title': '3.', 'number': '5'}"
"To convert a labeling on parse tree nodes to this form, we create a labeled set for each possibly multi-constituent argument.","{'title': '3.', 'number': '5'}"
All remaining sets of words are implicitly labeled with NONE.,"{'title': '3.', 'number': '5'}"
"We can see that, in this way, exact bracketing is not necessary and also no partial credit is given when only some of several constituents in a multi-constituent argument are labeled correctly.","{'title': '3.', 'number': '5'}"
"We will refer to word sets as “spans.” To compute the measures, we are comparing a guessed set of labeled spans to a correct set of labeled spans.","{'title': '3.', 'number': '5'}"
"We briefly define the various measures of comparison used herein, using the example guessed and correct Argument-based scoring measures for the guessed labeling.","{'title': '3.', 'number': '5'}"
"Toutanova, Haghighi, and Manning A Global Joint Model for SRL labelings shown in Figure 2(c).","{'title': '3.', 'number': '5'}"
All spans not listed explicitly are assumed to have label NONE.,"{'title': '3.', 'number': '5'}"
The scoring measures are illustrated in Figure 2(d).,"{'title': '3.', 'number': '5'}"
The figure shows performance measures—F-Measure (F1) and Whole Frame Accuracy (Acc.,"{'title': '3.', 'number': '5'}"
)—across nine different conditions.,"{'title': '3.', 'number': '5'}"
"When the sets of labeled spans are compared directly, we obtain the complete task measures, corresponding to the ID&CLS row and ALL column in Figure 2(d).","{'title': '3.', 'number': '5'}"
We also define several other measures to understand the performance of the system on different types of labels.,"{'title': '3.', 'number': '5'}"
"We measure the performance on identification (ID), classification (CLS), and the complete task (ID&CLS), when considering only the core arguments (CORE), all arguments but with a single ARGM label for the modifier arguments (COARSEARGM), and all arguments (ALL).","{'title': '3.', 'number': '5'}"
"This defines nine sub-tasks, which we now describe.","{'title': '3.', 'number': '5'}"
"For each of them, we compute the Whole Frame Accuracy and F-Measure as follows: Whole Frame Accuracy (Acc.).","{'title': '3.', 'number': '5'}"
This is the percentage of propositions for which there is an exact match between the proposed and correct labelings.,"{'title': '3.', 'number': '5'}"
"For example, the whole frame accuracy for ID&CLS and ALL is 0, because the correct and guessed sets of labeled spans shown in Figure 2(c) do not match exactly.","{'title': '3.', 'number': '5'}"
"In the figures, “Acc.” is always an abbreviation for this whole frame accuracy.","{'title': '3.', 'number': '5'}"
"Even though this measure has not been used extensively in previous work, we find it useful to track.","{'title': '3.', 'number': '5'}"
"Most importantly, potential applications of role labeling may require correct labeling of all (or at least the core) arguments in a sentence in order to be effective, and partially correct labelings may not be very useful.","{'title': '3.', 'number': '5'}"
"Moreover, a joint model for semantic role labeling optimizes Whole Frame Accuracy more directly than a local model does.","{'title': '3.', 'number': '5'}"
F-Measure (F1).,"{'title': '3.', 'number': '5'}"
"Because there may be confusion about what we mean by F-Measure in this multi-class setting, we define it here.","{'title': '3.', 'number': '5'}"
"F-Measure is defined as the harmonic mean of precision and recall: f = 2×p×r• true positive r – true positive This formula uses the number of true positive, false positive, and false negative spans in a given guessed labeling.","{'title': '3.', 'number': '5'}"
True positive is the number of spans whose correct label is one of the core or modifier argument labels (not NONE) and whose guessed label is the same as the correct label.,"{'title': '3.', 'number': '5'}"
False positive is the number of spans whose guessed label is non-NONE and whose correct label is different from the guessed label (possibly NONE).,"{'title': '3.', 'number': '5'}"
False negative is the number of spans whose correct label is non-NONE and whose guessed label is not the same as the correct one (possibly NONE).,"{'title': '3.', 'number': '5'}"
In the figures in this paper we show F-Measure multiplied by 100 so that it is in the same range as Whole Frame Accuracy.,"{'title': '3.', 'number': '5'}"
Core Argument Measures (CORE).,"{'title': '3.', 'number': '5'}"
"These measures score the system on core arguments only, without regard to modifier arguments.","{'title': '3.', 'number': '5'}"
They can be obtained by first mapping all non-core argument labels in the guessed and correct labelings to NONE.,"{'title': '3.', 'number': '5'}"
Coarse Modifier Argument Measures (COARSEARGM).,"{'title': '3.', 'number': '5'}"
"Sometimes it is sufficient to know a given span has a modifier role, without knowledge of the specific role label.","{'title': '3.', 'number': '5'}"
"In addition, deciding exact modifier argument labels was one of the decisions with highest disagreement among annotators (Palmer, Gildea, and Kingsbury 2005).","{'title': '3.', 'number': '5'}"
"To estimate performance under this setting, we relabel all ARGM-X arguments to ARGM in the proposed and correct labeling.","{'title': '3.', 'number': '5'}"
Such a performance measure was also used by Xue and Palmer (2004).,"{'title': '3.', 'number': '5'}"
Note that these measures do not exclude the core arguments but instead consider the core plus a coarse version of the modifier arguments.,"{'title': '3.', 'number': '5'}"
"Thus for COARSEARGM ALL we count {0} as a true positive span, {1,2} , {3,4}, and {7,8,9} as false positive, and {1, 2, 3, 4} and {7, 8, 9} as false negative.","{'title': '3.', 'number': '5'}"
Identification Measures (ID).,"{'title': '3.', 'number': '5'}"
These measure how well we do on the ARG vs. NONE distinction.,"{'title': '3.', 'number': '5'}"
"For the purposes of this evaluation, all spans labeled with a non-NONE label are considered to have the generic label ARG.","{'title': '3.', 'number': '5'}"
"For example, to compute CORE ID, we compare the following sets of labeled spans: Classification Measures (CLS).","{'title': '3.', 'number': '5'}"
These are performance on argument spans which were also guessed to be argument spans (but possibly the exact label was wrong).,"{'title': '3.', 'number': '5'}"
"In other words, these measures ignore the ARG vs. NONE confusions.","{'title': '3.', 'number': '5'}"
"They ignore all spans, which were incorrectly labeled NONE, or incorrectly labeled with an argument label, when the correct label was NONE.","{'title': '3.', 'number': '5'}"
This is different from “classification accuracy” used in previous work to mean the accuracy of the system in classifying spans when the correct set of argument spans is given.,"{'title': '3.', 'number': '5'}"
"To compute CLS measures, we remove all spans from Sguessed and Scorrect that do not occur in both sets, and compare the resulting sets.","{'title': '3.', 'number': '5'}"
"For example, to compute the ALL CLS measures, we need to compare the following sets of labeled spans: The rest of the spans were removed from both sets because they were labeled NONE according to one of the labelings and non-NONE according to the other.","{'title': '3.', 'number': '5'}"
The F-Measure is .50 and the Whole Frame Accuracy is 0%.,"{'title': '3.', 'number': '5'}"
"As we mentioned before, we label and evaluate the semantic frame of every predicate in the sentence separately.","{'title': '3.', 'number': '5'}"
It is possible for a sentence to contain several propositions—annotations of predicates occurring in the sentence.,"{'title': '3.', 'number': '5'}"
"For example, in the sentence The spacecraft faces a six-year journey to explore Jupiter, there are two propositions, for the verbs faces and explore.","{'title': '3.', 'number': '5'}"
These are: [The spacecraft]ARG0 [faces]PRED [a six-year journey to explore Jupiter]ARG1.,"{'title': '3.', 'number': '5'}"
[The spacecraft]ARG0 faces a six-year journey to [explore]PRED [Jupiter]ARG1.,"{'title': '3.', 'number': '5'}"
Our evaluation measures compare the guessed and correct set of labeled spans for each proposition.,"{'title': '3.', 'number': '5'}"
"The CoNLL evaluation measure (Carreras and M`arquez 2004, 2005) is almost the same as our argument-based measure.","{'title': '3.', 'number': '5'}"
"The only difference is that the CoNLL measure introduces an additional label type for arguments, of the form R-ARGX, used for referring exToutanova, Haghighi, and Manning A Global Joint Model for SRL pressions.","{'title': '3.', 'number': '5'}"
The Propbank distribution contains a specification of which multi-constituent arguments are in a coreference chain.,"{'title': '3.', 'number': '5'}"
"The CoNLL evaluation script considers these multi-constituent arguments as several separate arguments having different labels, where one argument has an ARGX label and the others have R-ARGX labels.","{'title': '3.', 'number': '5'}"
The decision of which constituents were to be labeled with referring labels was made using a set of rules expressed with regular expressions.5 A script that converts Propbank annotations to CoNLL format is available as part of the shared task software.,"{'title': '3.', 'number': '5'}"
"For example, in the following sentence, the CoNLL specification annotates the arguments of began as follows: [The deregulation]ARG1 of railroads [that]R-ARG1 [began]PRED enabled shippers to bargain for transportation.","{'title': '3.', 'number': '5'}"
"In contrast, we treat all multi-constituent arguments in the same way, and do not distinguish coreferential versus non-coreferential split arguments.","{'title': '3.', 'number': '5'}"
"According to our argument-based evaluation, the annotation of the arguments of the verb began is: [The deregulation]ARG1 of railroads [that]C-ARG1 [began]PRED enabled shippers to bargain for transportation.","{'title': '3.', 'number': '5'}"
The difference between our argument based measure and the CoNLL evaluation measure is such that we cannot say that the value of one is always higher than the value of the other.,"{'title': '3.', 'number': '5'}"
Either measure could be higher depending on the kinds of errors made.,"{'title': '3.', 'number': '5'}"
"For example, if the guessed labeling is: [The deregulation]ARG0 of railroads [that]R-ARG1 [began]PRED enabled shippers to bargain for transportation, the CoNLL script would count the argument that as correct and report precision and recall of .5, whereas our argument-based measure would not count any argument correct and report precision and recall of 0.","{'title': '3.', 'number': '5'}"
"On the other hand, if the guessed labeling is [The deregulation]ARG1 of railroads [that]C-ARG1 [began]PRED enabled shippers to bargain for transportation, the CoNLL measure would report a precision and recall of 0, whereas our argument-based measure would report precision and recall of 1.","{'title': '3.', 'number': '5'}"
"If the guessed labeling is [The deregulation]ARG1 of railroads [that]R-ARG1 [began]PRED enabled shippers to bargain for transportation, both measures would report precision and recall of 1.","{'title': '3.', 'number': '5'}"
(For our argument-based measure it does not make sense to propose R-ARGX labels and we assume such labels would be converted to C-ARGX labels if they are after the phrase they refer to.),"{'title': '3.', 'number': '5'}"
"Nevertheless, overall we expect the two measures to yield very similar results.","{'title': '3.', 'number': '5'}"
A classifier is local if it assigns a probability (or score) to the label of an individual parse tree node ni independently of the labels of other nodes.,"{'title': '4.', 'number': '6'}"
"In defining our models, we use the standard separation of the task of semantic role labeling into identification and classification phases.","{'title': '4.', 'number': '6'}"
"Formally, let L denote a mapping of the nodes in a tree t to a label set of semantic roles (including NONE) with respect to a predicate v. Let Id(L) be the mapping which collapses L’s non-NONE values into ARG.","{'title': '4.', 'number': '6'}"
"5 The regular expressions look for phrases containing pronouns with part-of-speech tags WDT, WRB, WP, or WP$ (Xavier Carreras, personal communication).","{'title': '4.', 'number': '6'}"
"Then, like the Gildea and Jurafsky (2002) system, we decompose the probability of a labeling L into probabilities according to an identification model PID and a classification model PCLS.","{'title': '4.', 'number': '6'}"
"This decomposition does not encode any independence assumptions, but is a useful way of thinking about the problem.","{'title': '4.', 'number': '6'}"
Our local models for semantic role labeling use this decomposition.,"{'title': '4.', 'number': '6'}"
"We use the same features for local identification and classification models, but use the decomposition for efficiency of training.","{'title': '4.', 'number': '6'}"
"The identification models are trained to classify each node in a parse tree as ARG or NONE, and the classification models are trained to label each argument node in the training set with its specific label.","{'title': '4.', 'number': '6'}"
In this way the training set for the classification models is smaller.,"{'title': '4.', 'number': '6'}"
"Note that we do not do any hard pruning at the identification stage in testing and can find the exact labeling of the complete parse tree, which is the maximizer of Equation (1).","{'title': '4.', 'number': '6'}"
We use log-linear models for multi-class classification for the local models.,"{'title': '4.', 'number': '6'}"
"Because they produce probability distributions, identification and classification models can be chained in a principled way, as in Equation (1).","{'title': '4.', 'number': '6'}"
The baseline features we used for the local identification and classification models are outlined in Figure 3.,"{'title': '4.', 'number': '6'}"
These features are a subset of the features used in previous work.,"{'title': '4.', 'number': '6'}"
"The standard features at the top of the figure were defined by Gildea and Jurafsky (2002), and the rest are other useful lexical and structural features identified in more recent work (Surdeanu et al. 2003; Pradhan et al.","{'title': '4.', 'number': '6'}"
2004; Xue and Palmer 2004).,"{'title': '4.', 'number': '6'}"
We also incorporated several novel features which we describe next.,"{'title': '4.', 'number': '6'}"
Example of displaced arguments.,"{'title': '4.', 'number': '6'}"
"We found that a large source of errors for ARG0 and ARG1 stemmed from cases such as those illustrated in Figure 4, where arguments were dislocated by raising or control verbs.","{'title': '4.', 'number': '6'}"
"Here, the predicate, expected, does not have a subject in the typical position— indicated by the empty NP—because the auxiliary is has raised the subject to its current position.","{'title': '4.', 'number': '6'}"
"In order to capture this class of examples, we use a binary feature, MISSING SUBJECT, indicating whether the predicate is “missing” its subject, and use this feature in conjunction with the PATH feature, so that we learn typical paths to raised subjects conditioned on the absence of the subject in its typical position.6 In the particular case of Figure 4, there is another instance of an argument being quite far from its predicate.","{'title': '4.', 'number': '6'}"
The predicate widen shares the phrase the trade gap with expect as an ARG1 argument.,"{'title': '4.', 'number': '6'}"
"However, as expect is a raising verb, widen’s subject is not in its typical position either, and we should expect to find it in the same position as expected’s subject.","{'title': '4.', 'number': '6'}"
This indicates it may be useful to use the path relative to expected to find arguments for widen.,"{'title': '4.', 'number': '6'}"
"In general, to identify certain arguments of predicates embedded in auxiliary and infinitival VPs we expect it to be helpful to take the path from the maximum extended projection of the predicate—the highest VP in the chain of VPs dominating the predicate.","{'title': '4.', 'number': '6'}"
"We introduce a new path feature, PROJECTED PATH, which takes the path from the maximal extended projection to an argument node.","{'title': '4.', 'number': '6'}"
"This feature applies only when the argument is not dominated by the maximal projection (e.g., direct objects).","{'title': '4.', 'number': '6'}"
"These features also handle other cases of discontinuous and nonlocal dependencies, such as those arising due to control verbs.","{'title': '4.', 'number': '6'}"
"The performance gain from these new features was notable, especially in identification.","{'title': '4.', 'number': '6'}"
"The performance on ALL arguments for the model using only the features in Figure 3, and the model using the additional features as well, are shown in Figure 5.","{'title': '4.', 'number': '6'}"
"For these results, the constraint that argument phrases do not overlap was enforced using the algorithm presented in Section 4.2.","{'title': '4.', 'number': '6'}"
"The most direct way to use trained local identification and classification models in testing is to select a labeling L of the parse tree that maximizes the product of the Performance of local classifiers on ALL arguments, using the features in Figure 3 only and using the additional local features.","{'title': '4.', 'number': '6'}"
"Using gold standard parse trees on Section 23. probabilities according to the two models, as in Equation (1).","{'title': '4.', 'number': '6'}"
"Because these models are local, this is equivalent to independently maximizing the product of the probabilities of the two models for the label li of each parse tree node ni as shown below in Equation (2).","{'title': '4.', 'number': '6'}"
A problem with this approach is that a maximizing labeling of the nodes could possibly violate the constraint that argument nodes should not overlap with each other.,"{'title': '4.', 'number': '6'}"
"Therefore, to produce a consistent set of arguments with local classifiers, we must have a way of enforcing the non-overlapping constraint.","{'title': '4.', 'number': '6'}"
"When labeling parse tree nodes, previous work has either used greedy algorithms to find a non-overlapping assignment, or the general-purpose ILP approach of Punyakanok et al. (2004).","{'title': '4.', 'number': '6'}"
For labeling chunks an exact algorithm based on shortest paths was proposed in Punyakanok and Roth (2001).,"{'title': '4.', 'number': '6'}"
Its complexity is quadratic in the length of the sentence.,"{'title': '4.', 'number': '6'}"
"Here we describe a faster exact dynamic programming algorithm to find the most likely non-overlapping (consistent) labeling of all nodes in the parse tree, according to a product of probabilities from local models, as in Equation (2).","{'title': '4.', 'number': '6'}"
"For simplicity, we describe the dynamic program for the case where only two classes are possible: ARG and NONE.","{'title': '4.', 'number': '6'}"
The generalization to more classes is straightforward.,"{'title': '4.', 'number': '6'}"
"Intuitively, the algorithm is similar to the Viterbi algorithm for context-free grammars, because we can describe the non-overlapping constraint by a “grammar” that disallows ARG nodes having ARG descendants.","{'title': '4.', 'number': '6'}"
"Subsequently, we will talk about maximizing the sum of the logs of local probabilities rather than the product of local probabilities, which is equivalent.","{'title': '4.', 'number': '6'}"
"The dynamic program works from the leaves of the tree up and finds a best assignment for each subtree, using already computed assignments for its children.","{'title': '4.', 'number': '6'}"
"Suppose we want the most likely consistent assignment for subtree t with child trees t1, ... , tk each storing the most likely consistent assignment of its nodes, as well as the log-probability of the ALLNONE assignment: the assignment of NONE to all nodes in the tree.","{'title': '4.', 'number': '6'}"
The most likely assignment for t is the one that corresponds to the maximum of: Performance of local model on ALL arguments when enforcing the non-overlapping constraint or not.,"{'title': '4.', 'number': '6'}"
The log-probability of the ALLNONE assignment for a tree t is the log-probability of assigning the root node of t to NONE plus the sum of the log-probabilities of the ALLNONE assignments of the child subtrees of t. Propagating this procedure from the leaves to the root of t we have our most likely non-overlapping assignment.,"{'title': '4.', 'number': '6'}"
"By slightly modifying this procedure, we obtain the most likely assignment according to a product of local identification and classification models.","{'title': '4.', 'number': '6'}"
We use the local models in conjunction with this search procedure to select a most-likely labeling in testing.,"{'title': '4.', 'number': '6'}"
"The complexity of this algorithm is linear in the number of nodes in the parse tree, which is usually much less than the square of the number of words in the sentence (l2), the complexity of the Punyakanok and Roth (2001) algorithm.","{'title': '4.', 'number': '6'}"
"For example, for a binarybranching parse tree, the number of nodes is approximately 2l.","{'title': '4.', 'number': '6'}"
"The speedup is due to the fact that when we label parse tree nodes, we make use of the bracketing constraints imposed by the parse tree.","{'title': '4.', 'number': '6'}"
