col1,col2
"We present a model for semantic role labeling that effectively captures the linguistic intuition that a semantic argument frame is a joint structure, with strong dependencies among the arguments.",{}
We show how to incorporate these strong dependencies in a statistical joint model with a rich set of features over multiple argument phrases.,{}
The proposed model substantially outperforms a similar state-of-the-art local model that does not include dependencies among different arguments.,{}
"We evaluate the gains from incorporating this joint information on the Propbank corpus, when using correct syntactic parse trees as input, and when using automatically derived parse The gains amount to reduction on all arguments and core arguments for gold-standard parse trees on Propbank.",{}
"For automatic parse trees, the error reductions are all and core arguments, respectively.",{}
We also present results on the CoNLL 2005 shared task data set.,{}
"Additionally, we explore considering multiple syntactic analyses to cope with parser noise and uncertainty.",{}
"We present a model for semantic role labeling that effectively captures the linguistic intuition that a semantic argument frame is a joint structure, with strong dependencies among the arguments.","{'title': '', 'number': '1'}"
We show how to incorporate these strong dependencies in a statistical joint model with a rich set of features over multiple argument phrases.,"{'title': '', 'number': '1'}"
The proposed model substantially outperforms a similar state-of-the-art local model that does not include dependencies among different arguments.,"{'title': '', 'number': '1'}"
"We evaluate the gains from incorporating this joint information on the Propbank corpus, when using correct syntactic parse trees as input, and when using automatically derived parse trees.","{'title': '', 'number': '1'}"
The gains amount to 24.1% error reduction on all arguments and 36.8% on core arguments for gold-standard parse trees on Propbank.,"{'title': '', 'number': '1'}"
"For automatic parse trees, the error reductions are 8.3% and 10.3% on all and core arguments, respectively.","{'title': '', 'number': '1'}"
We also present results on the CoNLL 2005 shared task data set.,"{'title': '', 'number': '1'}"
"Additionally, we explore considering multiple syntactic analyses to cope with parser noise and uncertainty.","{'title': '', 'number': '1'}"
"Since the release of the FrameNet (Baker, Fillmore, and Lowe 1998) and Propbank (Palmer, Gildea, and Kingsbury 2005) corpora, there has been a large amount of work on statistical models for semantic role labeling.","{'title': '1.', 'number': '2'}"
Most of this work relies heavily on local classifiers: ones that decide the semantic role of each phrase independently of the roles of other phrases.,"{'title': '1.', 'number': '2'}"
"However, linguistic theory tells us that a core argument frame is a joint structure, with strong dependencies between arguments.","{'title': '1.', 'number': '2'}"
"For instance, in the sentence [Final-hour trading]THEME accelerated [to 108.1 million shares]TARGET [yesterday]ARGM-TMP, the first argument is the subject noun phrase final-hour trading of the active verb accelerated.","{'title': '1.', 'number': '2'}"
"If we did not consider the rest of the sentence, it would look more like an AGENT argument, but when we realize that there is no other good candidate for a THEME argument, because to 108.1 million shares must be a TARGET and yesterday is most likely ARGM-TMP, we can correctly label it THEME.","{'title': '1.', 'number': '2'}"
"Even though previous work has modeled some correlations between the labels of parse tree nodes (see Section 2), many important phenomena have not been modeled.","{'title': '1.', 'number': '2'}"
"The key properties needed to model this joint structure are: (1) no finite Markov horizon assumption for dependencies among node labels, (2) features looking at the labels of multiple argument nodes and internal features of these nodes, and (3) a statistical model capable of incorporating these long-distance dependencies and generalizing well.","{'title': '1.', 'number': '2'}"
"We show how to build a joint model of argument frames, incorporating novel features into a discriminative log-linear model.","{'title': '1.', 'number': '2'}"
This system achieves an error reduction of 24.1% on ALL arguments and 36.8% on CORE arguments over a state-of-the-art independent classifier for gold-standard parse trees on Propbank.,"{'title': '1.', 'number': '2'}"
"If we consider the linguistic basis for joint modeling of a verb’s arguments (including modifiers), there are at least three types of information to be captured.","{'title': '1.', 'number': '2'}"
The most basic is to limit occurrences of each kind of argument.,"{'title': '1.', 'number': '2'}"
"For instance, there is usually at most one argument of a verb that is an ARG0 (agent), and although some modifier roles such as ARGM-TMP can fairly easily be repeated, others such as ARGM-MNR also generally occur at most once.1 The remaining two types of information apply mainly to core arguments (the strongly selected arguments of a verb: ARG0–ARG5 in Propbank), which in most linguistic theories are modeled as belonging together in an argument frame (set of arguments).","{'title': '1.', 'number': '2'}"
"The information is only marginally useful for adjuncts (the ARGM arguments of Propbank), which are usually treated as independent realizational choices not included in the argument frame of a verb.","{'title': '1.', 'number': '2'}"
"Firstly, many verbs take a number of different argument frames.","{'title': '1.', 'number': '2'}"
Previous work has shown that these are strongly correlated with the word sense of the verb (Roland and Jurafsky 2002).,"{'title': '1.', 'number': '2'}"
"If verbs were disambiguated for sense, the semantic roles of phrases would be closer to independent given the sense of the verb.","{'title': '1.', 'number': '2'}"
"However, because in almost all semantic role labeling work (including ours), the word sense is unknown and the model conditions only on the lemma, there is much joint information between arguments when conditioning only on the verb lemma.","{'title': '1.', 'number': '2'}"
"For example, compare: In the first case the noun phrase after passed is an ARG1, whereas in the second case it is a ARGM-LOC, with the choice governed by the sense of the verb pass.","{'title': '1.', 'number': '2'}"
"Secondly, even with same sense of a verb, different patterns of argument realization lead to joint information between arguments.","{'title': '1.', 'number': '2'}"
Consider: (4) The meal that the ogre cooked the children is still remembered.,"{'title': '1.', 'number': '2'}"
"Despite both examples having an identical surface syntax, knowing that the ARG1 of cook is expressed by the initial noun meal in the second example gives evidence that the children is the ARG2 (beneficiary), not the ARG1 in this case.","{'title': '1.', 'number': '2'}"
"Let us think of a graphical model over a set of m variables, one for each node in the parse tree t, representing the labels of the nodes and the dependencies between them.","{'title': '1.', 'number': '2'}"
"In order for a model over these variables to capture, for example, the statistical tendency of some semantic roles to occur at most once (e.g., that there is usually at most one constituent labeled AGENT), there must be a dependency link between any two variables.","{'title': '1.', 'number': '2'}"
"To estimate the probability that a certain node gets the role AGENT, we need to know if any of the other nodes were labeled with this role.","{'title': '1.', 'number': '2'}"
"We propose such a model, with a very rich graphical model structure, which is globally conditioned on the observation (the parse tree).2 Such a model is formally a Conditional Random Field (CRF) (Lafferty, McCallum, and Pereira 2001).","{'title': '1.', 'number': '2'}"
"However, note that in practice this term has previously been used almost exclusively to describe the restricted case of linear chain Conditional Markov Random Fields (sequence models) (Lafferty, McCallum, and Pereira 2001; Sha and Pereira 2003), or at least models that have strong Markov properties, which allow efficient dynamic programming algorithms (Cohn and Blunsom 2005).","{'title': '1.', 'number': '2'}"
"Instead, we consider a densely connected CRF structure, with no Markov properties, and use approximate inference by re-ranking the n-best solutions of a simpler model with stronger independence assumptions (for which exact inference is possible).","{'title': '1.', 'number': '2'}"
"Such a rich graphical model can represent many dependencies but there are two dangers—one is that the computational complexity of training the model and searching for the most likely labeling given the tree can be prohibitive, and the other is that if too many dependencies are encoded, the model will over-fit the training data and will not generalize well.","{'title': '1.', 'number': '2'}"
We propose a model which circumvents these two dangers and achieves significant performance gains over a similar local model that does not add any dependency arcs among the random variables.,"{'title': '1.', 'number': '2'}"
"To tackle the efficiency problem, we adopt dynamic programming and re-ranking algorithms.","{'title': '1.', 'number': '2'}"
To avoid overfitting we encode only a small set of linguistically motivated dependencies in features over sets of the random variables.,"{'title': '1.', 'number': '2'}"
"Our re-ranking approach, like the approach to parse re-ranking of Collins (2000), employs a simpler model—a local semantic role labeling algorithm—as a first pass to generate a set of n likely complete assignments of labels to all parse tree nodes.","{'title': '1.', 'number': '2'}"
The joint model is restricted to these n assignments and does not have to search the exponentially large space of all possible joint labelings.,"{'title': '1.', 'number': '2'}"
"There has been a substantial amount of work on automatic semantic role labeling, starting with the statistical model of Gildea and Jurafsky (2002).","{'title': '2.', 'number': '3'}"
"Researchers have worked on defining new useful features, and different system architectures and models.","{'title': '2.', 'number': '3'}"
"Here we review the work most closely related to ours, concentrating on methods for incorporating joint information and for increasing robustness to parser error.","{'title': '2.', 'number': '3'}"
Gildea and Jurafsky (2002) propose a method to model global dependencies by including a probability distribution over multi-sets of semantic role labels given a predicate.,"{'title': '2.1 Methods for Incorporating Joint Information', 'number': '4'}"
In this way the model can consider the assignment of all nodes in the parse tree and evaluate whether the set of realized semantic roles is likely.,"{'title': '2.1 Methods for Incorporating Joint Information', 'number': '4'}"
"If a necessary role is missing or if an unusual set of arguments is assigned by the local model, this additional factor can correct some of the mistakes.","{'title': '2.1 Methods for Incorporating Joint Information', 'number': '4'}"
The distribution over label multi-sets is estimated using interpolation of a relative frequency and a back-off distribution.,"{'title': '2.1 Methods for Incorporating Joint Information', 'number': '4'}"
"The back-off distribution assumes each argument label is present or absent independently of the other labels, namely, it assumes a Bernoulli Naive Bayes model.","{'title': '2.1 Methods for Incorporating Joint Information', 'number': '4'}"
"The most likely assignment of labels according to such a joint model is found approximately using re-scoring of the top k = 10 assignments according to a local model, which does not include dependencies among arguments.","{'title': '2.1 Methods for Incorporating Joint Information', 'number': '4'}"
Using this model improves the performance of the system in F-measure from 59.2 to 62.85.,"{'title': '2.1 Methods for Incorporating Joint Information', 'number': '4'}"
This shows that adding global information improves the performance of a role labeling system considerably.,"{'title': '2.1 Methods for Incorporating Joint Information', 'number': '4'}"
"However, the type of global information in this model is limited to label multi-sets.","{'title': '2.1 Methods for Incorporating Joint Information', 'number': '4'}"
"We will show that much larger gains are possible from joint modeling, adding richer sources of joint information using a more flexible statistical model.","{'title': '2.1 Methods for Incorporating Joint Information', 'number': '4'}"
"The model of Pradhan, Hacioglu, et al. (2004, 2005) is a state-of-the-art model, based on Support Vector Machines, and incorporating a large set of structural and lexical features.","{'title': '2.1 Methods for Incorporating Joint Information', 'number': '4'}"
"At the heart of the model lies a local classifier, which labels each parse tree node with one of the possible argument labels or NONE.","{'title': '2.1 Methods for Incorporating Joint Information', 'number': '4'}"
Joint information is integrated into the model in two ways: Dynamic class context: Using the labels of the two nodes to the left as features for classifying the current node.,"{'title': '2.1 Methods for Incorporating Joint Information', 'number': '4'}"
"This is similar to the Conditional Markov Models (CMM) often used in information extraction (McCallum, Freitag, and Pereira 2000).","{'title': '2.1 Methods for Incorporating Joint Information', 'number': '4'}"
Notice that here the previous two nodes classified are not in general the previous two nodes assigned non-NONE labels.,"{'title': '2.1 Methods for Incorporating Joint Information', 'number': '4'}"
"If a linear order on all nodes is imposed, then the previous two nodes classified most likely bear the label NONE.","{'title': '2.1 Methods for Incorporating Joint Information', 'number': '4'}"
Language model lattice re-scoring: Re-scoring of an N-best lattice with a trigram language model over semantic role label sequences.,"{'title': '2.1 Methods for Incorporating Joint Information', 'number': '4'}"
The target predicate is also part of the sequence.,"{'title': '2.1 Methods for Incorporating Joint Information', 'number': '4'}"
These ways of incorporating joint information resulted in small gains over a baseline system using only the features of Gildea and Jurafsky (2002).,"{'title': '2.1 Methods for Incorporating Joint Information', 'number': '4'}"
The performance gain due to joint information over a system using all features was not reported.,"{'title': '2.1 Methods for Incorporating Joint Information', 'number': '4'}"
The joint information captured by this model is limited by the n-gram Markov assumption of the language model over labels.,"{'title': '2.1 Methods for Incorporating Joint Information', 'number': '4'}"
"In our work, we improve the modeling of joint dependencies by looking at longer-distance context, by defining richer features over the sequence of labels and input features, and by estimating the model parameters discriminatively.","{'title': '2.1 Methods for Incorporating Joint Information', 'number': '4'}"
"A system which can integrate longer-distance dependencies is that of Punyakanok et al. (2004) and Punyakanok, Roth, and Yih (2005).","{'title': '2.1 Methods for Incorporating Joint Information', 'number': '4'}"
The idea is to build a semantic role labeling system that is based on local classifiers but also uses a global component that ensures that several linguistically motivated global constraints on argument frames are satisfied.,"{'title': '2.1 Methods for Incorporating Joint Information', 'number': '4'}"
The constraints are categorical and specified by hand.,"{'title': '2.1 Methods for Incorporating Joint Information', 'number': '4'}"
"For example, one global constraint is that the argument phrases cannot overlap—that is, if a node is labeled with a non-NONE label, all of its descendants have to be labeled NONE.","{'title': '2.1 Methods for Incorporating Joint Information', 'number': '4'}"
"The proposed framework is integer linear programming (ILP), which makes it possible to find the most likely assignment of labels to all nodes of the parse tree subject to specified constraints.","{'title': '2.1 Methods for Incorporating Joint Information', 'number': '4'}"
Solving the ILP problem is NP-hard but it is very fast in practice (Punyakanok et al. 2004).,"{'title': '2.1 Methods for Incorporating Joint Information', 'number': '4'}"
The authors report substantial gains in performance due to these global consistency constraints.,"{'title': '2.1 Methods for Incorporating Joint Information', 'number': '4'}"
This method was applied to improve the performance both of a system based on labeling syntactic chunks and one based on labeling parse tree nodes.,"{'title': '2.1 Methods for Incorporating Joint Information', 'number': '4'}"
"Our work differs from that work in that our constraints are not categorical (either satisfied or not), but are rather statistical preferences, and that they are learned automatically based on features specified by the knowledge engineer.","{'title': '2.1 Methods for Incorporating Joint Information', 'number': '4'}"
"On the other hand, we solve the search/estimation problem through re-ranking and n-best search only approximately, not exactly.","{'title': '2.1 Methods for Incorporating Joint Information', 'number': '4'}"
So far we have mainly discussed systems which label nodes in a parse tree.,"{'title': '2.1 Methods for Incorporating Joint Information', 'number': '4'}"
Many systems that only use shallow syntactic information have also been presented (Hacioglu 2004; Punyakanok et al. 2004); using full syntactic parse information was not allowed in the CoNLL 2004 shared task on Semantic Role Labeling and description of such systems can be found in (Carreras and M`arquez 2004).,"{'title': '2.1 Methods for Incorporating Joint Information', 'number': '4'}"
"Most systems which use only shallow syntactic information represent the input sentence as a sequence of tokens (words or phrases), which they label with a BIO tagging representation (beginning, inside, and outside argument labels) (Hacioglu 2004).","{'title': '2.1 Methods for Incorporating Joint Information', 'number': '4'}"
"Limited joint information is used by such systems, provided as a fixed size context of tags on previous tokens; for example, a length five window is used in the chunk-based system in (Pradhan, Hacioglu et al. 2005).","{'title': '2.1 Methods for Incorporating Joint Information', 'number': '4'}"
A method that models joint information in a different way was proposed by Cohn and Blunsom (2005).,"{'title': '2.1 Methods for Incorporating Joint Information', 'number': '4'}"
"It uses a tree-structured CRF, where the statistical dependency structure is exactly defined by the edges in the syntactic parse tree.","{'title': '2.1 Methods for Incorporating Joint Information', 'number': '4'}"
The only dependencies captured are between the label of a node and the label of each of its children.,"{'title': '2.1 Methods for Incorporating Joint Information', 'number': '4'}"
"However, the arguments of a predicate can be arbitrarily far from each other in the syntactic parse tree and therefore a tree-CRF model is limited in its ability to model dependencies among different arguments.","{'title': '2.1 Methods for Incorporating Joint Information', 'number': '4'}"
"For instance, the dependency between the meal and the children for the sentence in example (4) will not be captured because these phrases are not in the same local tree according to Penn Treebank syntax.","{'title': '2.1 Methods for Incorporating Joint Information', 'number': '4'}"
There have been multiple approaches to reducing the sensitivity of semantic role labeling systems to syntactic parser error.,"{'title': '2.1 Methods for Incorporating Joint Information', 'number': '4'}"
"Promising approaches have been to consider multiple syntactic analyses—the top k parses from a single or multiple full parsers (Punyakanok, Roth, and Yih 2005), or a shallow parse and a full parse (M`arquez et al. 2005; Pradhan et al.","{'title': '2.1 Methods for Incorporating Joint Information', 'number': '4'}"
"2005), or several types of full syntactic parses (Pradhan, Ward et al. 2005).","{'title': '2.1 Methods for Incorporating Joint Information', 'number': '4'}"
Such techniques are important for achieving good performance: The top four systems in the CoNLL 2005 shared task competition all used multiple syntactic analyses (Carreras and M`arquez 2005).,"{'title': '2.1 Methods for Incorporating Joint Information', 'number': '4'}"
These previous methods develop special components to combine the labeling decisions obtained using different syntactic annotation.,"{'title': '2.1 Methods for Incorporating Joint Information', 'number': '4'}"
"The method of Punyakanok, Roth, and Yih (2005) uses ILP to derive a consistent set of arguments, each of which could be derived using a different parse tree.","{'title': '2.1 Methods for Incorporating Joint Information', 'number': '4'}"
"Pradhan, Ward et al. (2005) use stacking to train a classifier which combines decisions based on different annotations, and M`arquez et al.","{'title': '2.1 Methods for Incorporating Joint Information', 'number': '4'}"
(2005) use special-purpose filtering and inference stages which combine arguments proposed by systems using shallow and full analyses.,"{'title': '2.1 Methods for Incorporating Joint Information', 'number': '4'}"
Our approach to increasing robustness uses the top k parses from a single parser and is a simple general method to factor in the uncertainty of the parser by applying Bayesian inference.,"{'title': '2.1 Methods for Incorporating Joint Information', 'number': '4'}"
"It is most closely related to the method described in Finkel, Manning, and Ng (2006) and can be seen as an approximation of that method.","{'title': '2.1 Methods for Incorporating Joint Information', 'number': '4'}"
"We describe our system in detail by first introducing simpler local semantic role labeling models in Section 4, and later building on them to define joint models in Section 5.","{'title': '2.1 Methods for Incorporating Joint Information', 'number': '4'}"
"Before we start presenting models, we describe the data and evaluation measures used in Section 3.","{'title': '2.1 Methods for Incorporating Joint Information', 'number': '4'}"
Readers can skip the next section and continue on to Section 4 if they are not interested in the details of the evaluation.,"{'title': '2.1 Methods for Incorporating Joint Information', 'number': '4'}"
For most of our experiments we used the February 2004 release of Propbank.,"{'title': '3.', 'number': '5'}"
We also report results on the CoNLL 2005 shared task data (Propbank I) in Section 6.2.,"{'title': '3.', 'number': '5'}"
"For the latter, we used the standard CoNLL evaluation measures, and we refer readers to the description of that task for details of the evaluation (Carreras and M`arquez 2005).","{'title': '3.', 'number': '5'}"
In this section we describe the data and evaluation measures we used for the February 2004 data.,"{'title': '3.', 'number': '5'}"
We use our own set of measures on the February 2004 data for three reasons.,"{'title': '3.', 'number': '5'}"
"Firstly, we wish to present a richer set of measures, which can better illustrate the performance of the system on core arguments as against adjuncts and the performance on identifying versus classifying arguments.","{'title': '3.', 'number': '5'}"
"Secondly, we technically could not use the CoNLL measure on the February 2004 data, because this earlier data was not available in a format which specifies which arguments should have the additional R-ARGX labels used in the CoNLL evaluation.3 Finally, these measures are better for comparison with early papers, because most research before 2005 did not distinguish referring arguments.","{'title': '3.', 'number': '5'}"
We describe our argument-based measures in detail here in case researchers are interested in replicating our results for the February 2004 data.,"{'title': '3.', 'number': '5'}"
"For the February 2004 data, we used the standard split into training, development, and test sets—the annotations from sections 02–21 formed the training set, section 24 the development, and section 23 the test set.","{'title': '3.', 'number': '5'}"
The set of argument labels considered is the set of core argument labels (ARG0 through ARG5) plus the modifier labels (see Figure 1).,"{'title': '3.', 'number': '5'}"
"The training set contained 85,392 propositions, the test set 4,615, and the development set 2,626.","{'title': '3.', 'number': '5'}"
We evaluate semantic role labeling models on gold-standard parse trees and parse trees produced by Charniak’s automatic parser (Charniak 2000).,"{'title': '3.', 'number': '5'}"
"For gold-standard parse trees, we preprocess the trees to discard empty constituents and strip functional tags.","{'title': '3.', 'number': '5'}"
"Using the trace information provided by empty constituents is very useful for improving performance (Palmer, Gildea, and Kingsbury 2005; Pradhan, Ward et al. 2005), but we have not used this information so that we can compare our results to previous work and since automatic systems that recover it are not widely available.","{'title': '3.', 'number': '5'}"
"Since 2004, there has been a precise, standard evaluation measure for semantic role labeling, formulated by the organizers of the CoNLL shared tasks (Carreras and M`arquez 2004, 2005).","{'title': '3.', 'number': '5'}"
