col1,col2
The result of the phrase-based system is comparable to the nonmonotone single-word based search with the IBM constraints.,Experiment/Discussion
"With respect to the mPER, the PB system clearly outperforms all single-word based systems.",Experiment/Discussion
"If we compare the monotone phrase-based system with the nonmonotone alignment template system, we see that the mPERs are similar.",Experiment/Discussion
Thus the lexical choice of words is of the same quality.,Experiment/Discussion
"Regarding the other evaluation criteria, which take the word order into account, the nonmonotone search of the alignment templates has a clear advantage.",Experiment/Discussion
This was already indicated by the low degree of monotonicity on this task.,Experiment/Discussion
The rather free word order in German and the long range dependencies of the verb group make reorderings necessary.,Experiment/Discussion
The translation results for the Xerox task are shown in Table 7.,Experiment/Discussion
"Here, we see that both phrase-based systems clearly outperform the single-word based systems.",Experiment/Discussion
The PB system performs best on this task.,Experiment/Discussion
"Compared to the AT system, the BLEU score improves by 4.1% absolute.",Experiment/Discussion
The improvement of the PB system with respect to the AT system is statistically significant at the 99% level.,Experiment/Discussion
The translation results for the Canadian Hansards task are shown in Table 8.,Experiment/Discussion
"As on the Xerox task, the phrase-based systems perform better than the single-word based systems.",Experiment/Discussion
The monotone phrase-based system yields even better results than the alignment template system.,Experiment/Discussion
This improvement is consistent among all evaluation criteria and it is statistically significant at the 99% level.,Experiment/Discussion
"In this section, we analyze the translation speed of the phrase-based translation system.",Experiment/Discussion
All experiments were carried out on an AMD Athlon with 2.2GHz.,Experiment/Discussion
Note that the systems were not optimized for speed.,Experiment/Discussion
We used the best performing systems to measure the translation times.,Experiment/Discussion
The translation speed of the monotone phrase-based system for all three tasks is shown in Table 9.,Experiment/Discussion
"For the Xerox task, the translation process takes less than 7 seconds for the whole 10K words test set.",Experiment/Discussion
"For the Verbmobil task, the system is even slightly faster.",Experiment/Discussion
It takes about 1.6 seconds to translate the whole test set.,Experiment/Discussion
"For the Canadian Hansards task, the translation process is much slower, but the average time per sentence is still less than 1 second.",Experiment/Discussion
We think that this slowdown can be attributed to the large training corpus.,Experiment/Discussion
The system loads only phrase pairs into memory if the source phrase occurs in the test corpus.,Experiment/Discussion
"Therefore, the large test corpus size for this task also affects the translation speed.",Experiment/Discussion
In Fig.,Experiment/Discussion
"1, we see the average translation time per sentence as a function of the sentence length.",Experiment/Discussion
The translation times were measured for the translation of the 5432 test sentences of the Canadian Hansards task.,Experiment/Discussion
We see a clear linear dependency.,Experiment/Discussion
"Even for sentences of thirty words, the translation takes only about 1.5 seconds.",Experiment/Discussion
"Recently, phrase-based translation approaches became more and more popular.",Experiment/Discussion
"Some examples are the alignment template system in (Och et al., 1999; Och and Ney, 2002) that we used for comparison.",Experiment/Discussion
"In (Zens et al., 2002), a simple phrase-based approach is described that served as starting point for the system in this work.",Experiment/Discussion
"(Marcu and Wong, 2002) presents a joint probability model for phrase-based translation.",Experiment/Discussion
"It does not use the word alignment for extracting the phrases, but directly generates a phrase alignment.",Experiment/Discussion
"In (Koehn et al., 2003), various aspects of phrase-based systems are compared, e.g. the phrase extraction method, the underlying word alignment model, or the maximum phrase length.",Experiment/Discussion
"(Tomas and Casacuberta, 2003) describes a linear interpolation of a phrase-based and an alignment template-based approach.",Experiment/Discussion
We described a phrase-based translation approach.,Results/Conclusion
The basic idea of this approach is to remember all bilingual phrases that have been seen in the word-aligned training corpus.,Results/Conclusion
"As refinements of the baseline model, we described two simple heuristics: the word penalty feature and the phrase penalty feature.",Results/Conclusion
"Additionally, we presented a single-word based lexicon with two smoothing methods.",Results/Conclusion
The model scaling factors were optimized with respect to the mWER on the development corpus.,Results/Conclusion
We described a highly efficient monotone search algorithm.,Results/Conclusion
The worst-case complexity of this algorithm is linear in the sentence length.,Results/Conclusion
This leads to an impressive translation speed of more than 1000 words per second for the Verbmobil task and for the Xerox task.,Results/Conclusion
Even for the Canadian Hansards task the translation of sentences of length 30 takes only about 1.5 seconds.,Results/Conclusion
The described search is monotone at the phrase level.,Results/Conclusion
"Within the phrases, there are no constraints on the reorderings.",Results/Conclusion
"Therefore, this method is best suited for language pairs that have a similar order at the level of the phrases learned by the system.",Results/Conclusion
"Thus, the translation process should require only local reorderings.",Results/Conclusion
"As the experiments have shown, Spanish-English and French-English are examples of such language pairs.",Results/Conclusion
"For these pairs, the monotone search was found to be sufficient.",Results/Conclusion
The phrase-based approach clearly outperformed the singleword based systems.,Results/Conclusion
It showed even better performance than the alignment template system.,Results/Conclusion
The experiments on the German-English Verbmobil task outlined the limitations of the monotone search.,Results/Conclusion
"As the low degree of monotonicity indicated, reordering plays an important role on this task.",Results/Conclusion
The rather free word order in German as well as the verb group seems to be difficult to translate.,Results/Conclusion
"Nevertheless, when ignoring the word order and looking at the mPER only, the monotone search is competitive with the best performing system.",Results/Conclusion
"For further improvements, we will investigate the usefulness of additional models, e.g. modeling the segmentation probability.",Results/Conclusion
"Also, slightly relaxing the monotonicity constraint in a way that still allows an efficient search is of high interest.",Results/Conclusion
"In spirit of the IBM reordering constraints of the single-word based models, we could allow a phrase to be skipped and to be translated later.",Results/Conclusion
"This work has been partially funded by the EU project TransType 2, IST-2001-32091.",Results/Conclusion
