col1,col2
"h together with GF is locally complete and co herent with respect to a semantic form s for l rank resolution by P(s|l) ? P(p|t) The algorithm supports multiple, interacting TOPIC, TOPIC-REL and FOCUS LDDs.","{'title': 'Resolving LDDs in F-Structure. ', 'number': '7'}"
"We use P(s|l) ? P(p|t) to rank a solution, depending on how likely the PRED takes semantic frame s, and how likely the TOPIC, FOCUS or TOPIC-REL is resolved using path p. The algorithm also supports resolution of LDDs where no overt linguistic material introducesa source TOPIC-REL function (e.g. in reduced rela tive clause constructions).","{'title': 'Resolving LDDs in F-Structure. ', 'number': '7'}"
"We distinguish between passive and active constructions, using the relevant semantic frame type when resolving LDDs.","{'title': 'Resolving LDDs in F-Structure. ', 'number': '7'}"
We ran experiments with grammars in both the pipeline and the integrated parsing architectures.,"{'title': 'Experiments and Evaluation. ', 'number': '8'}"
"The first grammar is a basic PCFG, while A-PCFG includes the f-structure annotations.","{'title': 'Experiments and Evaluation. ', 'number': '8'}"
"We apply a parent transformation to each grammar (Johnson, 1999) to give P-PCFG and PA-PCFG.","{'title': 'Experiments and Evaluation. ', 'number': '8'}"
"We train on sections 02-21 (grammar, lexical extraction andLDD paths) of the Penn-II Treebank and test on sec tion 23.","{'title': 'Experiments and Evaluation. ', 'number': '8'}"
"The only pre-processing of the trees that wedo is to remove empty nodes, and remove all PennII functional tags in the integrated model.","{'title': 'Experiments and Evaluation. ', 'number': '8'}"
We evalu ate the parse trees using evalb.,"{'title': 'Experiments and Evaluation. ', 'number': '8'}"
"Following (Riezler et al., 2002), we convert f-structures into dependency triple format.","{'title': 'Experiments and Evaluation. ', 'number': '8'}"
Using their software we evaluate the f-structure parser output against: 1.,"{'title': 'Experiments and Evaluation. ', 'number': '8'}"
"The DCU 105 (Cahill et al, 2002).","{'title': 'Experiments and Evaluation. ', 'number': '8'}"
2.,"{'title': 'Experiments and Evaluation. ', 'number': '8'}"
"The full 2,416 f-structures automatically gen-.","{'title': 'Experiments and Evaluation. ', 'number': '8'}"
"erated by the f-structure annotation algorithm for the original Penn-II trees, in a CCG-style (Hockenmaier, 2003) evaluation experiment Pipeline Integrated PCFG P-PCFG A-PCFG PA-PCFG 2416 Section 23 trees.","{'title': 'Experiments and Evaluation. ', 'number': '8'}"
# Parses 2416 2416 2416 2414 Lab.,"{'title': 'Experiments and Evaluation. ', 'number': '8'}"
F-Score 75.83 80.80 79.17 81.32 Unlab.,"{'title': 'Experiments and Evaluation. ', 'number': '8'}"
"F-Score 78.28 82.70 81.49 83.28 DCU 105 F-Strs All GFs F-Score (before LDD resolution) 79.82 79.24 81.12 81.20 All GFs F-Score (after LDD resolution) 83.79 84.59 86.30 87.04 Preds only F-Score (before LDD resolution) 70.00 71.57 73.45 74.61 Preds only F-Score (after LDD resolution) 73.78 77.43 78.76 80.97 2416 F-Strs All GFs F-Score (before LDD resolution) 81.98 81.49 83.32 82.78 All GFs F-Score (after LDD resolution) 84.16 84.37 86.45 86.00 Preds only F-Score (before LDD resolution) 72.00 73.23 75.22 75.10 Preds only F-Score (after LDD resolution) 74.07 76.12 78.36 78.40 PARC 700 Dependency Bank Subset of GFs following (Kaplan et al, 2004) 77.86 80.24 77.68 78.60 Table 7: Parser Evaluation 3.","{'title': 'Experiments and Evaluation. ', 'number': '8'}"
"A subset of 560 dependency structures of thePARC 700 Dependency Bank following (Ka plan et al, 2004)The results are given in Table 7.","{'title': 'Experiments and Evaluation. ', 'number': '8'}"
The parenttransformed grammars perform best in both architectures.,"{'title': 'Experiments and Evaluation. ', 'number': '8'}"
"In all cases, there is a marked improvement (2.07-6.36%) in the f-structures after LDD res olution.","{'title': 'Experiments and Evaluation. ', 'number': '8'}"
"We achieve between 73.78% and 80.97% preds-only and 83.79% to 87.04% all GFs f-score, depending on gold-standard.","{'title': 'Experiments and Evaluation. ', 'number': '8'}"
"We achieve between77.68% and 80.24% against the PARC 700 follow ing the experiments in (Kaplan et al, 2004).","{'title': 'Experiments and Evaluation. ', 'number': '8'}"
"For details on how we map the f-structures produced by our parsers to a format similar to that of the PARC 700 Dependency Bank, see (Burke et al, 2004).","{'title': 'Experiments and Evaluation. ', 'number': '8'}"
Table 8 shows the evaluation result brokendown by individual GF (preds-only) for the inte grated model PA-PCFG against the DCU 105.,"{'title': 'Experiments and Evaluation. ', 'number': '8'}"
"Inorder to measure how many of the LDD reentran cies in the gold-standard f-structures are captured correctly by our parsers, we developed evaluation software for f-structure LDD reentrancies (similar to Johnson?s (2002) evaluation to capture traces and their antecedents in trees).","{'title': 'Experiments and Evaluation. ', 'number': '8'}"
Table 9 shows the results with the integrated model achieving more than 76% correct LDD reentrancies.,"{'title': 'Experiments and Evaluation. ', 'number': '8'}"
"(Collins, 1999)?s Model 3 is limited to wh-traces in relative clauses (it doesn?t treat topicalisation, focus etc.).","{'title': 'Related Work. ', 'number': '9'}"
Johnson?s (2002) work is closest toours in spirit.,"{'title': 'Related Work. ', 'number': '9'}"
Like our approach he provides a fi nite approximation of LDDs.,"{'title': 'Related Work. ', 'number': '9'}"
"Unlike our approach,however, he works with tree fragments in a post processing approach to add empty nodes and their DEP.","{'title': 'Related Work. ', 'number': '9'}"
"PRECISION RECALL F-SCORE adjunct 717/903 = 79 717/947 = 76 78 app 14/15 = 93 14/19 = 74 82 comp 35/43 = 81 35/65 = 54 65 coord 109/143 = 76 109/161 = 68 72 det 253/264 = 96 253/269 = 94 95 focus 1/1 = 100 1/1 = 100 100 obj 387/445 = 87 387/461 = 84 85 obj2 0/1 = 0 0/2 = 0 0 obl 27/56 = 48 27/61 = 44 46 obl2 1/3 = 33 1/2 = 50 40 obl ag 5/11 = 45 5/12 = 42 43 poss 69/73 = 95 69/81 = 85 90 quant 40/55 = 73 40/52 = 77 75 relmod 26/38 = 68 26/50 = 52 59 subj 330/361 = 91 330/414 = 80 85 topic 12/12 = 100 12/13 = 92 96 topicrel 35/42 = 83 35/52 = 67 74 xcomp 139/160 = 87 139/146 = 95 91 OVERALL 83.78 78.35 80.97 Table 8: Preds-only results of PA-PCFG against the DCU 105antecedents to parse trees, while we present an ap proach to LDD resolution on the level of f-structure.","{'title': 'Related Work. ', 'number': '9'}"
"It seems that the f-structure-based approach is more abstract (99 LDD path types against approximately 9,000 tree-fragment types in (Johnson, 2002)) andfine-grained in its use of lexical information (sub cat frames).","{'title': 'Related Work. ', 'number': '9'}"
"In contrast to Johnson?s approach, ourLDD resolution algorithm is not biased.","{'title': 'Related Work. ', 'number': '9'}"
It computes all possible complete resolutions and orderranks them using LDD path and subcat frame probabilities.,"{'title': 'Related Work. ', 'number': '9'}"
"It is difficult to provide a satisfactory comparison between the two methods, but we have car ried out an experiment that compares them at the f-structure level.","{'title': 'Related Work. ', 'number': '9'}"
We take the output of Charniak?s Pipeline Integrated PCFG P-PCFG A-PCFG PA-PCFG TOPIC Precision (11/14) (12/13) (12/13) (12/12) Recall (11/13) (12/13) (12/13) (12/13) F-Score 0.81 0.92 0.92 0.96 FOCUS Precision (0/1) (0/1) (0/1) (0/1) Recall (0/1) (0/1) (0/1) (0/1) F-Score 0 0 0 0 TOPIC-REL Precision (20/34) (27/36) (34/42) (34/42) Recall (20/52) (27/52) (34/52) (34/52) F-Score 0.47 0.613 0.72 0.72 OVERALL 0.54 0.67 0.75 0.76 Table 9: LDD Evaluation on the DCU 105 Charniak -LDD res.,"{'title': 'Related Work. ', 'number': '9'}"
+LDD res.,"{'title': 'Related Work. ', 'number': '9'}"
"(Johnson, 2002) All GFs 80.86 86.65 85.16 Preds Only 74.63 80.97 79.75 Table 10: Comparison at f-structure level of LDD resolution to (Johnson, 2002) on the DCU 105 parser (Charniak, 1999) and, using the pipeline f-structure annotation model, evaluate against the DCU 105, both before and after LDD resolution.","{'title': 'Related Work. ', 'number': '9'}"
"Using the software described in (Johnson, 2002) we add empty nodes to the output of Charniak?s parser,pass these trees to our automatic annotation algorithm and evaluate against the DCU 105.","{'title': 'Related Work. ', 'number': '9'}"
The results are given in Table 10.,"{'title': 'Related Work. ', 'number': '9'}"
Our method of resolv ing LDDs at f-structure level results in a preds-only f-score of 80.97%.,"{'title': 'Related Work. ', 'number': '9'}"
"Using (Johnson, 2002)?s method of adding empty nodes to the parse-trees results in an f-score of 79.75%.(Hockenmaier, 2003) provides CCG-based models of LDDs.","{'title': 'Related Work. ', 'number': '9'}"
Some of these involve extensive clean up of the underlying Penn-II treebank resource prior to grammar extraction.,"{'title': 'Related Work. ', 'number': '9'}"
"In contrast, in our approach we leave the treebank as is and only add (but never correct) annotations.","{'title': 'Related Work. ', 'number': '9'}"
"Earlier HPSG work (Tateisi et al, 1998) is based on independently constructedhand-crafted XTAG resources.","{'title': 'Related Work. ', 'number': '9'}"
"In contrast, we acquire our resources from treebanks and achieve sub stantially wider coverage.","{'title': 'Related Work. ', 'number': '9'}"
"Our approach provides wide-coverage, robust, and ? with the addition of LDD resolution ? ?deep?or ?full?, PCFG-based LFG approximations.","{'title': 'Related Work. ', 'number': '9'}"
"Crucially, we do not claim to provide fully adequate sta tistical models.","{'title': 'Related Work. ', 'number': '9'}"
"It is well known (Abney, 1997) that PCFG-type approximations to unification grammars can yield inconsistent probability models due toloss of probability mass: the parser successfully re turns the highest ranked parse tree but the constraint solver cannot resolve the f-equations (generated in the pipeline or ?hidden?","{'title': 'Related Work. ', 'number': '9'}"
in the integrated model) and the probability mass associated with that tree is lost.,"{'title': 'Related Work. ', 'number': '9'}"
"This case, however, is surprisingly rare for our grammars: only 0.0018% (85 out of 48424) of theoriginal Penn-II trees (without FRAGs) fail to pro duce an f-structure due to inconsistent annotations(Table 1), and for parsing section 23 with the in tegrated model (A-PCFG), only 9 sentences do notreceive a parse because no f-structure can be gen erated for the highest ranked tree (0.4%).","{'title': 'Related Work. ', 'number': '9'}"
"Parsing with the pipeline model, all sentences receive onecomplete f-structure.","{'title': 'Related Work. ', 'number': '9'}"
Research on adequate probability models for unification grammars is important.,"{'title': 'Related Work. ', 'number': '9'}"
"(Miyao et al, 2003) present a Penn-II treebank based HPSG with log-linear probability mod els.","{'title': 'Related Work. ', 'number': '9'}"
"They achieve coverage of 50.2% on section 23, as against 99% in our approach.","{'title': 'Related Work. ', 'number': '9'}"
"(Riezler etal., 2002; Kaplan et al, 2004) describe how a care fully hand-crafted LFG is scaled to the full Penn-II treebank with log-linear based probability models.","{'title': 'Related Work. ', 'number': '9'}"
They achieve 79% coverage (full parse) and 21% fragement/skimmed parses.,"{'title': 'Related Work. ', 'number': '9'}"
"By the same measure,full parse coverage is around 99% for our automat ically acquired PCFG-based LFG approximations.Against the PARC 700, the hand-crafted LFG grammar reported in (Kaplan et al, 2004) achieves an f score of 79.6%.","{'title': 'Related Work. ', 'number': '9'}"
"For the same experiment, our best automatically-induced grammar achieves an f-score of 80.24%.","{'title': 'Related Work. ', 'number': '9'}"
"We presented and extensively evaluated a finiteapproximation of LDD resolution in automatically constructed, wide-coverage, robust, PCFG based LFG approximations, effectively turning the ?half?(or ?shallow?)-grammars presented in (Cahill et al, 2002) into ?full?","{'title': 'Conclusions. ', 'number': '10'}"
or ?deep?,"{'title': 'Conclusions. ', 'number': '10'}"
grammars.,"{'title': 'Conclusions. ', 'number': '10'}"
"In our approach, LDDs are resolved in f-structure, not trees.","{'title': 'Conclusions. ', 'number': '10'}"
"The method achieves a preds-only f-score of 80.97% for f-structures with the PA-PCFG in the integrated architecture against the DCU 105and 78.4% against the 2,416 automatically gener ated f-structures for the original Penn-II treebanktrees.","{'title': 'Conclusions. ', 'number': '10'}"
"Evaluating against the PARC 700 Depen dency Bank, the P-PCFG achieves an f-score of 80.24%, an overall improvement of approximately 0.6% on the result reported for the best hand-crafted grammars in (Kaplan et al, 2004).","{'title': 'Conclusions. ', 'number': '10'}"
AcknowledgementsThis research was funded by Enterprise Ireland Ba sic Research Grant SC/2001/186 and IRCSET.,"{'title': 'Conclusions. ', 'number': '10'}"
