col1,col2
"If the two systems produce equal quality translations on We assume that sentences are drawn from some underlying distribution , and that the test set consists of independently, identically distributed (IID) sentences from this distribution.",Experiment/Discussion
We can define the following probabilities: where the probability is taken with respect to the distribution .,Experiment/Discussion
The sign test has the null hypothesis and the alternative hypothesis .,Experiment/Discussion
"Given a sample of test points ,the sign test depends on calculation of the following counts: , , and ,where is the cardinality of the set .",Experiment/Discussion
We now come to the definition of — how should we judge whether a translation from one system is better or worse than the translation from another system?,Experiment/Discussion
A critical problem with Bleu scores is that they are a function of an entire test corpus and do not give translation scores for single sentences.,Experiment/Discussion
"Ideally we would have some measure of the quality of the translation of sentence under the reordered system, and a corresponding function that measures the quality of the baseline translation.",Experiment/Discussion
"We could then define as follows: If If If Unfortunately Bleu scores do not give persentence measures and , and thus do not allow a definition of in this way.",Experiment/Discussion
"In general the lack of per-sentence scores makes it challenging to apply significance tests to Bleu scores.2 To get around this problem, we make the following approximation.",Experiment/Discussion
"For any test sentence , we calculate as follows.",Experiment/Discussion
"First, we define to be the Bleu score for the test corpus when translated by the baseline model.",Experiment/Discussion
"Next, we define to be the Bleu score when all sentences other than are translated by the baseline model, and where itself is translated by the reordered model.",Experiment/Discussion
"We then define If If If Note that strictly speaking, this definition of is not valid, as it depends on the entire set of sample points rather than alone.",Experiment/Discussion
"However, we believe it is a reasonable approximation to an ideal 2The lack of per-sentence scores means that it is not possible to apply standard statistical tests such as the sign test or the ttest (which would test the hypothesis , where is the expected value under ).",Experiment/Discussion
"Note that previous work (Koehn, 2004; Zhang and Vogel, 2004) has suggested the use of bootstrap tests (Efron and Tibshirani, 1993) for the calculation of confidence intervals for Bleu scores.",Experiment/Discussion
"(Koehn, 2004) gives empirical evidence that these give accurate estimates for Bleu statistics.",Experiment/Discussion
"However, correctness of the bootstrap method relies on some technical properties of the statistic (e.g., Bleu scores) being used (e.g., see (Wasserman, 2004) theorem 8.3); (Koehn, 2004; Zhang and Vogel, 2004) do not discuss whether Bleu scores meet any such criteria, which makes us uncertain of their correctness when applied to Bleu scores.",Experiment/Discussion
.,Experiment/Discussion
We can also calculate confidence intervals for the results.,Experiment/Discussion
"Define to be the probability that the reordered system improves on the baseline system, given that the two systems do not have equal performance.",Experiment/Discussion
The relative frequency estimate of is .,Experiment/Discussion
"Using a normal approximation (e.g., see Example 6.17 from (Wasserman, 2004)) a 95% confidence interval for a sample size of 1785 is , giving a 95% confidence interval of for .",Experiment/Discussion
We have demonstrated that adding knowledge about syntactic structure can significantly improve the performance of an existing state-of-the-art statistical machine translation system.,Results/Conclusion
"Our approach makes use of syntactic knowledge to overcome a weakness of tradition SMT systems, namely long-distance reordering.",Results/Conclusion
We pose clause restructuring as a problem for machine translation.,Results/Conclusion
"Our current approach is based on hand-crafted rules, which are based on our linguistic knowledge of how German and English syntax differs.",Results/Conclusion
"In the future we may investigate data-driven approaches, in an effort to learn reordering models automatically.",Results/Conclusion
"While our experiments are on German, other languages have word orders that are very different from English, so we believe our methods will be generally applicable.",Results/Conclusion
We would like to thank Amit Dubey for providing the German parser used in our experiments.,Results/Conclusion
Thanks to Brooke Cowan and Luke Zettlemoyer for providing the human judgements of translation performance.,Results/Conclusion
Thanks also to Regina Barzilay for many helpful comments on an earlier draft of this paper.,Results/Conclusion
Any remaining errors are of course our own.,Results/Conclusion
"Philipp Koehn was supported by a grant from NTT, Agmt. dtd.",Results/Conclusion
6/21/1998.,Results/Conclusion
Michael Collins was supported by NSF grants IIS-0347631 and IIS-0415030. function that indicates whether the translations have improved or not under the reordered system.,Results/Conclusion
"Given this definition of , we found that , , and .",Results/Conclusion
"(Thus 52.85% of all test sentences had improved translations under the baseline system, 36.4% of all sentences had worse translations, and 10.75% of all sentences had the same quality as before.)",Results/Conclusion
"If our definition of was correct, these values for and would be significant at the level R: the current difficulties should encourage us to redouble our efforts to promote cooperation in the euro-mediterranean framework.",Results/Conclusion
"C: the current problems should spur us to intensify our efforts to promote cooperation within the framework of the europamittelmeerprozesses. the current problems should spur us, our efforts to promote cooperation within the framework of the europamittelmeerprozesses to be intensified.",Results/Conclusion
R: propaganda of any sort will not get us anywhere. with any propaganda to lead to nothing. with any of the propaganda is nothing to do here.,Results/Conclusion
"R: yet we would point out again that it is absolutely vital to guarantee independent financial control. however, we would like once again refer to the absolute need for the independence of the financial control. however, we would like to once again to the absolute need for the independence of the financial control out.",Results/Conclusion
"R: i cannot go along with the aims mr brok hopes to achieve via his report. i cannot agree with the intentions of mr brok in his report persecuted. i can intentions, mr brok in his report is not agree with.",Results/Conclusion
"R: on method, i think the nice perspectives, from that point of view, are very interesting. what the method is concerned, i believe that the prospects of nice are on this point very interesting. what the method, i believe that the prospects of nice in this very interesting point.",Results/Conclusion
"R: secondly, without these guarantees, the fall in consumption will impact negatively upon the entire industry. and, secondly, the collapse of consumption without these guarantees will have a negative impact on the whole sector. and secondly, the collapse of the consumption of these guarantees without a negative impact on the whole sector.",Results/Conclusion
"R: awarding a diploma in this way does not contravene uk legislation and can thus be deemed legal. since the award of a diploms is not in this form contrary to the legislation of the united kingdom, it can be recognised as legitimate. since the award of a diploms in this form not contrary to the legislation of the united kingdom is, it can be recognised as legitimate.",Results/Conclusion
R: i should like to comment briefly on the directive concerning undesirable substances in products and animal nutrition. i would now like to comment briefly on the directive on undesirable substances and products of animal feed. i would now like to briefly to the directive on undesirable substances and products in the nutrition of them.,Results/Conclusion
"R: it was then clearly shown that we can in fact tackle enlargement successfully within the eu ’s budget. at that time was clear that we can cope with enlargement, in fact, within the framework drawn by the eu budget.",Results/Conclusion
"B: at that time was clear that we actually enlargement within the framework able to cope with the eu budget, the drawn.",Results/Conclusion
