col1,col2
"This paper presents an unsupervised opinanalysis method for clasi.e., recognizing which stance a person is taking in an online debate.",Introduction
"In order to handle the complexities of this genre, we mine the web to learn associations that are indicative of opinion stances in debates.",Introduction
"We combine this knowledge with discourse information, and formulate the debate side classification task as an Integer Linear Programming problem.",Introduction
Our results show that our method is substantially better than challenging baseline methods.,Introduction
"This paper presents a method for debate-side classification, i.e., recognizing which stance a person is taking in an online debate posting.",Experiment/Discussion
"In online debate forums, people debate issues, express their preferences, and argue why their viewpoint is right.",Experiment/Discussion
"In addition to expressing positive sentiments about one’s preference, a key strategy is also to express negative sentiments about the other side.",Experiment/Discussion
"For example, in the debate “which mobile phone is better: iPhone or Blackberry,” a participant on the iPhone side may explicitly assert and rationalize why the iPhone is better, and, alternatively, also argue why the Blackberry is worse.",Experiment/Discussion
"Thus, to recognize stances, we need to consider not only which opinions are positive and negative, but also what the opinions are about (their targets).",Experiment/Discussion
"Participants directly express their opinions, such as “The iPhone is cool,” but, more often, they mention associated aspects.",Experiment/Discussion
"Some aspects are particular to one topic (e.g., Active-X is part of IE but not Firefox), and so distinguish between them.",Experiment/Discussion
"But even an aspect the topics share may distinguish between them, because people who are positive toward one topic may value that aspect more.",Experiment/Discussion
"For example, both the iPhone and Blackberry have keyboards, but we observed in our corpus that positive opinions about the keyboard are associated with the pro Blackberry stance.",Experiment/Discussion
"Thus, we need to find distinguishing aspects, which the topics may or may not share.",Experiment/Discussion
"Complicating the picture further, participants may concede positive aspects of the opposing issue or topic, without coming out in favor of it, and they may concede negative aspects of the issue or topic they support.",Experiment/Discussion
"For example, in the following sentence, the speaker says positive things about the iPhone, even though he does not prefer it: “Yes, the iPhone may be cool to take it out and play with and show off, but past that, it offers nothing.” Thus, we need to consider discourse relations to sort out which sentiments in fact reveal the writer’s stance, and which are merely concessions.",Experiment/Discussion
"Many opinion mining approaches find negative and positive words in a document, and aggregate their counts to determine the final document polarity, ignoring the targets of the opinions.",Experiment/Discussion
"Some work in product review mining finds aspects of a central topic, and summarizes opinions with respect to these aspects.",Experiment/Discussion
"However, they do not find distinguishing factors associated with a preference for a stance.",Experiment/Discussion
"Finally, while other opinion analysis systems have considered discourse information, they have not distinguished between concessionary and non-concessionary opinions when determining the overall stance of a document.",Experiment/Discussion
This work proposes an unsupervised opinion analysis method to address the challenges described above.,Experiment/Discussion
"First, for each debate side, we mine the web for opinion-target pairs that are associated with a preference for that side.",Experiment/Discussion
"This information is employed, in conjunction with discourse information, in an Integer Linear Programming (ILP) framework.",Experiment/Discussion
This framework combines the individual pieces of information to arrive at debate-side classifications of posts in online debates.,Experiment/Discussion
The remainder of this paper is organized as follows.,Experiment/Discussion
We introduce our debate genre in Section 2 and describe our method in Section 3.,Experiment/Discussion
We present the experiments in Section 4 and analyze the results in Section 5.,Experiment/Discussion
"Related work is in Section 6, and the conclusions are in Section 7.",Experiment/Discussion
"In this section, we describe our debate data, and elaborate on characteristic ways of expressing opinions in this genre.",Experiment/Discussion
"For our current work, we use the online debates from the website http://www.convinceme.net.1 In this work, we deal only with dual-sided, dual-topic debates about named entities, for example iPhone vs. Blackberry, where topics = iPhone, topic2 =Blackberry, sides = pro-iPhone, and side2=pro-Blackberry.",Experiment/Discussion
"Our test data consists of posts of 4 debates: Windows vs. Mac, Firefox vs. Internet Explorer, Firefox vs. Opera, and Sony Ps3 vs. Nintendo Wii.",Experiment/Discussion
"The iPhone vs. Blackberry debate and two other debates, were used as development data.",Experiment/Discussion
Given below are examples of debate posts.,Experiment/Discussion
"Post 1 is taken from the iPhone vs. Blackberry debate, Post 2 is from the Firefox vs. Internet Explorer debate, and Post 3 is from the Windows vs. Mac debate: As described in Section 1, the debate genre poses significant challenges to opinion analysis.",Experiment/Discussion
This subsection elaborates upon some of the complexities.,Experiment/Discussion
Multiple polarities to argue for a side.,Experiment/Discussion
"Debate participants, in advocating their choice, switch back and forth between their opinions towards the sides.",Experiment/Discussion
This makes it difficult for approaches that use only positive and negative word counts to decide which side the post is on.,Experiment/Discussion
Posts 1 and 3 illustrate this phenomenon.,Experiment/Discussion
Sentiments towards both sides (topics) within a single post.,Experiment/Discussion
"The above phenomenon gives rise to an additional problem: often, conflicting sides (and topics) are addressed within the same post, sometimes within the same sentence.",Experiment/Discussion
"The second sentence of Post 3 illustrates this, as it has opinions about both Windows and Mac.",Experiment/Discussion
Differentiating aspects and personal preferences.,Experiment/Discussion
"People seldom repeatedly mention the topic/side; they show their evaluations indirectly, by evaluating aspects of each topic/side.",Experiment/Discussion
Differentiating aspects determine the debate-post’s side.,Experiment/Discussion
"Some aspects are unique to one side/topic or the other, e.g., “3g” in Example 1 and “inline spell check” in Example 2.",Experiment/Discussion
"However, the debates are about topics that belong to the same domain and which therefore share many aspects.",Experiment/Discussion
"Hence, a purely ontological approach of finding “has-a” and “is-a” relations, or an approach looking only for product specifications, would not be sufficient for finding differentiating features.",Experiment/Discussion
"When the two topics do share an aspect (e.g., a keyboard in the iPhone vs. Blackberry debate), the writer may perceive it to be more positive for one than the other.",Experiment/Discussion
"And, if the writer values that aspect, it will influence his or her overall stance.",Experiment/Discussion
"For example, many people prefer the Blackberry keyboard over the iPhone keyboard; people to whom phone keyboards are important are more likely to prefer the Blackberry.",Experiment/Discussion
Concessions.,Experiment/Discussion
"While debating, participants often refer to and acknowledge the viewpoints of the opposing side.",Experiment/Discussion
"However, they do not endorse this rival opinion.",Experiment/Discussion
Uniform treatment of all opinions in a post would obviously cause errors in such cases.,Experiment/Discussion
The first sentence of Example 1 is an instance of this phenomenon.,Experiment/Discussion
"The participant concedes that the iPhone appeals to young consumers, but this positive opinion is opposite to his overall stance.",Experiment/Discussion
We propose an unsupervised approach to classifying the stance of a post in a dual-topic debate.,Experiment/Discussion
"For this, we first use a web corpus to learn preferences that are likely to be associated with a side.",Experiment/Discussion
These learned preferences are then employed in conjunction with discourse constraints to identify the side for a given post.,Experiment/Discussion
"We need to find opinions and pair them with targets, both to mine the web for general preferences and to classify the stance of a debate post.",Experiment/Discussion
"We use straightforward methods, as these tasks are not the focus of this paper.",Experiment/Discussion
"To find opinions, we look up words in a subjectivity lexicon: all instances of those words are treated as opinions.",Experiment/Discussion
"An opinion is assigned the prior polarity that is listed for that word in the lexicon, except that, if the prior polarity is positive or negative, and the instance is modified by a negation word (e.g., “not”), then the polarity of that instance is reversed.",Experiment/Discussion
"We use the subjectivity lexicon of (Wilson et al., 2005),2 which contains approximately 8000 words which may be used to express opinions.",Experiment/Discussion
"Each entry consists of a subjective word, its prior polarity (positive (+), negative (−), neutral (*)), morphological information, and part of speech information.",Experiment/Discussion
"To pair opinions with targets, we built a rulebased system based on dependency parse information.",Experiment/Discussion
The dependency parses are obtained using the Stanford parser.3 We developed the syntactic rules on separate data that is not used elsewhere in this paper.,Experiment/Discussion
Table 1 illustrates some of these rules.,Experiment/Discussion
Note that the rules are constructed (and explained in Table 1) with respect to the grammatical relation notations of the Stanford parser.,Experiment/Discussion
"As illustrated in the table, it is possible for an opinion to have more than one target.",Experiment/Discussion
"In such cases, the single opinion results in multiple opinion-target pairs, one for each target.",Experiment/Discussion
"Once these opinion-target pairs are created, we mask the identity of the opinion word, replacing the word with its polarity.",Experiment/Discussion
"Thus, the opiniontarget pair is converted to a polarity-target pair.",Experiment/Discussion
"For instance, “pleasing-interface” is converted to interface+.",Experiment/Discussion
This abstraction is essential for handling the sparseness of the data.,Experiment/Discussion
"We observed in our development data that people highlight the aspects of topics that are the bases for their stances, both positive opinions toward aspects of the preferred topic, and negative opinions toward aspects of the dispreferred one.",Experiment/Discussion
"Thus, we decided to mine the web for aspects associated with a side in the debate, and then use that information to recognize the stances expressed in individual posts.",Experiment/Discussion
"Previous work mined web data for aspects associated with topics (Hu and Liu, 2004; Popescu et al., 2005).",Experiment/Discussion
"In our work, we search for aspects associated with a topic, but particularized to polarity.",Experiment/Discussion
"Not all aspects associated with a topic are discriminative with respect to stance; we hypothesized that, by including polarity, we would be more likely to find useful associations.",Experiment/Discussion
"An aspect may be associated with both of the debate topics, but not, by itself, be discriminative between stances toward the topics.",Experiment/Discussion
"However, opinions toward that aspect might discriminate between them.",Experiment/Discussion
"Thus, the basic unit in our web mining process is a polarity-target pair.",Experiment/Discussion
Polarity-target pairs which explicitly mention one of the topics are used to anchor the mining process.,Experiment/Discussion
Opinions about relevant aspects are gathered from the surrounding context.,Experiment/Discussion
"For each debate, we downloaded weblogs and forums that talk about the main topics (corresponding to the sides) of that debate.",Experiment/Discussion
"For example, for the iPhone vs. Blackberry debate, we search the web for pages containing “iPhone” and “Blackberry.” We used the Yahoo search API and imposed the search restriction that the pages should contain both topics in the http URL.",Experiment/Discussion
This ensured that we downloaded relevant pages.,Experiment/Discussion
An average of 3000 documents were downloaded per debate.,Experiment/Discussion
We apply the method described in Section 3.1 to the downloaded web pages.,Experiment/Discussion
"That is, we find all instances of words in the lexicon, extract their targets, and mask the words with their polarities, yielding polarity-target pairs.",Experiment/Discussion
"For example, suppose the sentence “The interface is pleasing” is in the corpus.",Experiment/Discussion
"The system extracts the pair “pleasing-interface,” which is masked to “positive-interface,” which we notate as interface+.",Experiment/Discussion
"If the target in a polarity-target pair happens to be one of the topics, we select the polarity-target pairs in its vicinity for further processing (the rest are discarded).",Experiment/Discussion
"The intuition behind this is that, if someone expresses an opinion about a topic, he or she is likely to follow it up with reasons for that opinion.",Experiment/Discussion
The sentiments in the surrounding context thus reveal factors that influence the preference or dislike towards the topic.,Experiment/Discussion
We define the vicinity as the same sentence plus the following 5 sentences.,Experiment/Discussion
"Each unique target word targeti in the web corpus, i.e., each word used as the target of an opinion one or more times, is processed to generate the following conditional probabilities. where p = {+,− ,* } and q = {+,− ,* } denote the polarities of the target and the topic, respectively; j = {1, 2}; and i = {1...M}, where M is the number of unique targets in the corpus.",Experiment/Discussion
"For example, P(Mac+|interface+) is the probability that “interface” is the target of a positive opinion that is in the vicinity of a positive opinion toward “Mac.” Table 2 lists some of the probabilities learned by this approach.",Experiment/Discussion
(Note that the neutral cases are not shown.),Experiment/Discussion
Table 2 contains examples of the learned probabilities.,Experiment/Discussion
These probabilities align with what we qualitatively found in our development data.,Experiment/Discussion
"For example, the opinions towards “Storm” essentially follow the opinions towards “Blackberry;” that is, positive opinions toward “Storm” are usually found in the vicinity of positive opinions toward “Blackberry,” and negative opinions toward “Storm” are usually found in the vicinity of negative opinions toward “Blackberry” (for example, in the row for storm+, P(blackberry+|storm+) is much higher than the other probabilities).",Experiment/Discussion
"Thus, an opinion expressed about “Storm” is usually the opinion one has toward “Blackberry.” This is expected, as Storm is a type of Blackberry.",Experiment/Discussion
"A similar example is ipod+, which follows the opinion toward the iPhone.",Experiment/Discussion
This is interesting because an iPod is not a phone; the association is due to preference for the brand.,Experiment/Discussion
"In contrast, the probability distribution for “phone” does not show a preference for any one side, even though both iPhone and Blackberry are phones.",Experiment/Discussion
This indicates that opinions towards phones in general will not be able to distinguish between the debate sides.,Experiment/Discussion
"Another interesting case is illustrated by the probabilities for “e-mail.” People who like e-mail capability are more likely to praise the Blackberry, or even criticize the iPhone — they would thus belong to the pro-Blackberry camp.",Experiment/Discussion
"While we noted earlier that positive evaluations of keyboards are associated with positive evaluations of the Blackberry (by far the highest probability in that row), negative evaluations of keyboards, are, however, not a strong discriminating factor.",Experiment/Discussion
"For the other entries in the table, we see that criticisms of batteries and the phone network are more associated with negative sentiments towards the iPhones.",Experiment/Discussion
"The possibility of these various cases motivates our approach, in which opinions and their polarities are considered when searching for associations between debate topics and their aspects.",Experiment/Discussion
"Once we have the probabilities collected from the web, we can build our classifier to classify the debate posts.",Experiment/Discussion
"Here again, we use the process described in Section 3.1 to extract polarity-target pairs for each opinion expressed in the post.",Experiment/Discussion
Let N be the number of instances of polarity-target pairs in the post.,Experiment/Discussion
"For each instance Ij (j = {1...N}), we look up the learned probabilities of Section 3.2 to create two scores, wj and uj: where target� � is the polarity-target type of which Ij is an instance.",Experiment/Discussion
Score wj corresponds to side1 and uj corresponds to side2.,Experiment/Discussion
"A point to note is that, if a target word is repeated, and it occurs in different polarity-target instances, it is counted as a separate instance each time — that is, here we account for tokens, not types.",Experiment/Discussion
"Via Equations 2 and 3, we interpret the observed polarity-target instance Ij in terms of debate sides.",Experiment/Discussion
We formulate the problem of finding the overall side of the post as an Integer Linear Programming (ILP) problem.,Experiment/Discussion
"The side that maximizes the overall side-score for the post, given all the N instances Ij, is chosen by maximizing the objective function Equations 5 and 6 implement binary constraints.",Experiment/Discussion
Equation 7 enforces the constraint that each Ij can belong to exactly one side.,Experiment/Discussion
"Finally, Equations 8 and 9 ensure that a single side is chosen for the entire post.",Experiment/Discussion
"As described in Section 2, debate participants often acknowledge the opinions held by the opposing side.",Experiment/Discussion
"We recognize such discourse constructs using the Penn Discourse Treebank (Prasad et al., 2007) list of discourse connectives.",Experiment/Discussion
"In particular, we use the list of connectives from the Concession and Contra-expectation category.",Experiment/Discussion
"Examples of connectives in these categories are “while,” “nonetheless,” “however,” and “even if.” We use approximations to finding the arguments to the discourse connectives (ARG1 and ARG2 in Penn Discourse Treebank terms).",Experiment/Discussion
"If the connective is mid-sentence, the part of the sentence prior to the connective is considered conceded, and the part that follows the connective is considered nonconceded.",Experiment/Discussion
An example is the second sentence of Example 3.,Experiment/Discussion
"If, on the other hand, the connective is sentence-initial, the sentence is split at the first comma that occurs mid sentence.",Experiment/Discussion
"The first part is considered conceded, and the second part is considered non-conceded.",Experiment/Discussion
An example is the first sentence of Example 1.,Experiment/Discussion
The opinions occurring in the conceded part are interpreted in reverse.,Experiment/Discussion
"That is, the weights corresponding to the sides wj and uj are interchanged in equation 4.",Experiment/Discussion
"Thus, conceded opinions are effectively made to count towards the opposing side.",Experiment/Discussion
"On http://www.convinceme.net, the html page for each debate contains side information for each post (side1 is blue in color and side2 is green).",Experiment/Discussion
This gives us automatically labeled data for our evaluations.,Experiment/Discussion
"For each of the 4 debates in our test set, we use posts with at least 5 sentences for evaluation.",Experiment/Discussion
"We implemented two baselines: the OpTopic system that uses topic information only, and the OpPMI system that uses topic as well as related word (noun) information.",Experiment/Discussion
"All systems use the same lexicon, as well as exactly the same processes for opinion finding and opinion-target pairing.",Experiment/Discussion
The OpTopic system This system considers only explicit mentions of the topic for the opinion analysis.,Experiment/Discussion
"Thus, for this system, the step of opinion-target pairing only finds all topic+1 , topic= , topic+2 , topic2 instances in the post (where, for example, an instance of topic+1 is a positive opinion whose target is explicitly topic1).",Experiment/Discussion
The polarity-topic pairs are counted for each debate side according to the following equations.,Experiment/Discussion
The post is assigned the side with the higher score.,Experiment/Discussion
"The OpPMI system This system finds opiniontarget pairs for not only the topics, but also for the words in the debate that are significantly related to either of the topics.",Experiment/Discussion
We find semantic relatedness of each noun in the post with the two main topics of the debate by calculating the Pointwise Mutual Information (PMI) between the term and each topic over the entire web corpus.,Experiment/Discussion
We use the API provided by the Measures of Semantic Relatedness (MSR)4 engine for this purpose.,Experiment/Discussion
The MSR engine issues Google queries to retrieve documents and finds the PMI between any two given words.,Experiment/Discussion
Table 3 lists PMIs between the topics and the words from Table 2.,Experiment/Discussion
Each noun k is assigned to the topic with the higher PMI score.,Experiment/Discussion
"That is, if Next, the polarity-target pairs are found for the post, as before, and Equations 10 and 11 are used to assign a side to the post as in the OpTopic system, except that here, related nouns are also counted as instances of their associated topics.",Experiment/Discussion
"In our task, it is desirable to make a prediction for all the posts; hence #relevant = #Total posts.",Experiment/Discussion
This results in Recall and Accuracy being the same.,Experiment/Discussion
"However, all of the systems do not classify a post if the post does not contain the information it needs.",Experiment/Discussion
"Thus, #guessed < #Total posts, and Precision is not the same as Accuracy.",Experiment/Discussion
"Table 4 reports the performance of four systems on the test data: the two baselines, our method using the preferences learned from the web corpus (OpPr) and the method additionally using discourse information to reverse conceded opinions.",Experiment/Discussion
The OpTopic has low recall.,Experiment/Discussion
"This is expected, because it relies only on opinions explicitly toward the topics.",Experiment/Discussion
"The OpPMI has better recall than OpTopic; however, the precision drops for some debates.",Experiment/Discussion
We believe this is due to the addition of noise.,Experiment/Discussion
This result suggests that not all terms that are relevant to a topic are useful for determining the debate side.,Experiment/Discussion
"Finally, both of the OpPr systems are better than both baselines in Accuracy as well as F-measure for all four debates.",Experiment/Discussion
"The accuracy of the full OpPr system improves, on average, by 35 percentage points over the OpTopic system, and by 20 percentage points over the OpPMI system.",Experiment/Discussion
"The F-measure improves, on average, by 25 percentage points over the OpTopic system, and by 17 percentage points over the OpPMI system.",Experiment/Discussion
"Note that in 3 out of 4 of the debates, the full system is able to make a guess for all of the posts (hence, the metrics all have the same values).",Experiment/Discussion
"In three of the four debates, the system using concession handling described in Section 3.4 outperforms the system without it, providing evidence that our treatment of concessions is effective.",Experiment/Discussion
"On average, there is a 3 percentage point improvement in Accuracy, 5 percentage point improvement in Precision and 5 percentage point improvement in F-measure due to the added concession information.",Experiment/Discussion
"In this section, we discuss the results from the previous section and describe the sources of errors.",Experiment/Discussion
"As reported in the previous section, the OpPr system outperforms both the OpTopic and the OpPMI systems.",Experiment/Discussion
"In order to analyze why OpPr outperforms OpPMI, we need to compare Tables 2 and 3.",Experiment/Discussion
"Table 2 reports the conditional probabilities learned from the web corpus for polaritytarget pairs used in OpPr, and Table 3 reports the PMI of these same targets with the debate topics used in OpPMI.",Experiment/Discussion
"First, we observe that the PMI numbers are intuitive, in that all the words, except for “e-mail,” show a high PMI relatedness to both topics.",Experiment/Discussion
