col1,col2
All of them are indeed semantically related to the domain.,Experiment/Discussion
"Additionally, we see that some conclusions of the OpPMI system are similar to those of the OpPr system, for example, that “Storm” is more closely related to the Blackberry than the iPhone.",Experiment/Discussion
"However, notice two cases: the PMI values for “phone” and “e-mail” are intuitive, but they may cause errors in debate analysis.",Experiment/Discussion
"Because the iPhone and the Blackberry are both phones, the word “phone” does not have any distinguishing power in debates.",Experiment/Discussion
"On the other hand, the PMI measure of “e-mail” suggests that it is not closely related to the debate topics, though it is, in fact, a desirable feature for smart phone users, even more so with Blackberry users.",Experiment/Discussion
The PMI measure does not reflect this.,Experiment/Discussion
The “network” aspect shows a comparatively greater relatedness to the blackberry than to the iPhone.,Experiment/Discussion
"Thus, OpPMI uses it as a proxy for the Blackberry.",Experiment/Discussion
"This may be erroneous, however, because negative opinions towards “network” are more indicative of negative opinions towards iPhones, a fact revealed by Table 2.",Experiment/Discussion
"In general, even if the OpPMI system knows what topic the given word is more related to, it still does not know what the opinion towards that word means in the debate scenario.",Experiment/Discussion
"The OpPr system, on the other hand, is able to map it to a debate side.",Experiment/Discussion
False lexicon hits.,Experiment/Discussion
"The lexicon is word based, but, as shown by (Wiebe and Mihalcea, 2006; Su and Markert, 2008), many subjective words have both objective and subjective senses.",Experiment/Discussion
"Thus, one major source of errors is a false hit of a word in the lexicon.",Experiment/Discussion
Opinion-target pairing.,Experiment/Discussion
The syntactic rulebased opinion-target pairing system is a large source of errors in the OpPr as well as the baseline systems.,Experiment/Discussion
"Product review mining work has explored finding opinions with respect to, or in conjunction with, aspects (Hu and Liu, 2004; Popescu et al., 2005); however, in our work, we need to find information in the other direction – that is, given the opinion, what is the opinion about.",Experiment/Discussion
"Stoyanov and Cardie (2008) work on opinion co-reference; however, we need to identify the specific target.",Experiment/Discussion
Pragmatic opinions.,Experiment/Discussion
Some of the errors are due to the fact that the opinions expressed in the post are pragmatic.,Experiment/Discussion
"This becomes a problem especially when the debate post is small, and we have few other lexical clues in the post.",Experiment/Discussion
The following post is an example: (4) The blackberry is something like $150 and the iPhone is $500.,Experiment/Discussion
I don’t think it’s worth it.,Experiment/Discussion
You could buy a iPod separate and have a boatload of extra money left over.,Experiment/Discussion
"In this example, the participant mentions the difference in the prices in the first sentence.",Experiment/Discussion
This sentence implies a negative opinion towards the iPhone.,Experiment/Discussion
"However, recognizing this would require a system to have extensive world knowledge.",Experiment/Discussion
"In the second sentence, the lexicon does hit the word “worth,” and, using syntactic rules, we can determine it is negated.",Experiment/Discussion
"However, the opinion-target pairing system only tells us that the opinion is tied to the “it.” A co-reference system would be needed to tie the “it” to “iPhone” in the first sentence.",Experiment/Discussion
Several researchers have worked on similar tasks.,Experiment/Discussion
Kim and Hovy (2007) predict the results of an election by analyzing forums discussing the elections.,Experiment/Discussion
"Theirs is a supervised bag-of-words system using unigrams, bigrams, and trigrams as features.",Experiment/Discussion
"In contrast, our approach is unsupervised, and exploits different types of information.",Experiment/Discussion
Bansal et al. (2008) predict the vote from congressional floor debates using agreement/disagreement features.,Experiment/Discussion
"We do not model inter-personal exchanges; instead, we model factors that influence stance taking.",Experiment/Discussion
Lin at al (2006) identify opposing perspectives.,Experiment/Discussion
"Though apparently related at the task level, perspectives as they define them are not the same as opinions.",Experiment/Discussion
Their approach does not involve any opinion analysis.,Experiment/Discussion
Fujii and Ishikawa (2006) also work with arguments.,Experiment/Discussion
"However, their focus is on argument visualization rather than on recognizing stances.",Experiment/Discussion
Other researchers have also mined data to learn associations among products and features.,Experiment/Discussion
"In their work on mining opinions in comparative sentences, Ganapathibhotla and Liu (2008) look for user preferences for one product’s features over another’s.",Experiment/Discussion
"We do not exploit comparative constructs, but rather probabilistic associations.",Experiment/Discussion
"Thus, our approach and theirs are complementary.",Experiment/Discussion
"A number of works in product review mining (Hu and Liu, 2004; Popescu et al., 2005; Kobayashi et al., 2005; Bloom et al., 2007) automatically find features of the reviewed products.",Experiment/Discussion
"However, our approach is novel in that it learns and exploits associations among opinion/polarity, topics, and aspects.",Experiment/Discussion
"Several researchers have recognized the important role discourse plays in opinion analysis (Polanyi and Zaenen, 2005; Snyder and Barzilay, 2007; Somasundaran et al., 2008; Asher et al., 2008; Sadamitsu et al., 2008).",Experiment/Discussion
"However, previous work did not account for concessions in determining whether an opinion supports one side or the other.",Experiment/Discussion
"More sophisticated approaches to identifying opinions and recognizing their contextual polarity have been published (e.g., (Wilson et al., 2005; Ikeda et al., 2008; Sadamitsu et al., 2008)).",Experiment/Discussion
Those components are not the focus of our work.,Experiment/Discussion
This paper addresses challenges faced by opinion analysis in the debate genre.,Results/Conclusion
"In our method, factors that influence the choice of a debate side are learned by mining a web corpus for opinions.",Results/Conclusion
"This knowledge is exploited in an unsupervised method for classifying the side taken by a post, which also accounts for concessionary opinions.",Results/Conclusion
"Our results corroborate our hypothesis that finding relations between aspects associated with a topic, but particularized to polarity, is more effective than finding relations between topics and aspects alone.",Results/Conclusion
"The system that implements this information, mined from the web, outperforms the web PMI-based baseline.",Results/Conclusion
Our hypothesis that addressing concessionary opinions is useful is also corroborated by improved performance.,Results/Conclusion
This research was supported in part by the Department of Homeland Security under grant N000140710152.,Results/Conclusion
"We would also like to thank Vladislav D. Veksler for help with the MSR engine, and the anonymous reviewers for their helpful comments.",Results/Conclusion
