col1,col2
The reward r(h) is -1 if h ends in a state where the puzzle cannot be completed.,"{'title': '6 Applying the Model', 'number': '6'}"
"For solved puzzles, the reward is a positive value proportional to the percentage of words assigned to non-null commands.","{'title': '6 Applying the Model', 'number': '6'}"
"Datasets For the Windows domain, our dataset consists of 128 documents, divided into 70 for training, 18 for development, and 40 for test.","{'title': '7 Experimental Setup', 'number': '7'}"
"In the puzzle game domain, we use 50 tutorials, divided into 40 for training and 10 for test.9 Statistics for the datasets are shown below.","{'title': '7 Experimental Setup', 'number': '7'}"
The data exhibits certain qualities that make for a challenging learning problem.,"{'title': '7 Experimental Setup', 'number': '7'}"
"For instance, there are a surprising variety of linguistic constructs — as Figure 4 shows, in the Windows domain even a simple command is expressed in at least six different ways.","{'title': '7 Experimental Setup', 'number': '7'}"
"Experimental Framework To apply our algorithm to the Windows domain, we use the Win32 application programming interface to simulate human interactions with the user interface, and to gather environment state information.","{'title': '7 Experimental Setup', 'number': '7'}"
"The operating system environment is hosted within a virtual machine,10 allowing us to rapidly save and reset system state snapshots.","{'title': '7 Experimental Setup', 'number': '7'}"
"For the puzzle game domain, we replicated the game with an implementation that facilitates automatic play.","{'title': '7 Experimental Setup', 'number': '7'}"
"As is commonly done in reinforcement learning, we use a softmax temperature parameter to smooth the policy distribution (Sutton and Barto, 1998), set to 0.1 in our experiments.","{'title': '7 Experimental Setup', 'number': '7'}"
"For Windows, the development set is used to select the best parameters.","{'title': '7 Experimental Setup', 'number': '7'}"
"For Crossblock, we choose the parameters that produce the highest reward during training.","{'title': '7 Experimental Setup', 'number': '7'}"
"During evaluation, we use these parameters to predict mappings for the test documents.","{'title': '7 Experimental Setup', 'number': '7'}"
"Evaluation Metrics For evaluation, we compare the results to manually constructed sequences of actions.","{'title': '7 Experimental Setup', 'number': '7'}"
"We measure the number of correct actions, sentences, and documents.","{'title': '7 Experimental Setup', 'number': '7'}"
An action is correct if it matches the annotations in terms of command and parameters.,"{'title': '7 Experimental Setup', 'number': '7'}"
"A sentence is correct if all of its actions are correctly identified, and analogously for documents.11 Statistical significance is measured with the sign test.","{'title': '7 Experimental Setup', 'number': '7'}"
"Additionally, we compute a word alignment score to investigate the extent to which the input text is used to construct correct analyses.","{'title': '7 Experimental Setup', 'number': '7'}"
This score measures the percentage of words that are aligned to the corresponding annotated actions in correctly analyzed documents.,"{'title': '7 Experimental Setup', 'number': '7'}"
Baselines We consider the following baselines to characterize the performance of our approach. lems like ours are typically addressed using supervised techniques.,"{'title': '7 Experimental Setup', 'number': '7'}"
"We measure how a standard supervised approach would perform on this task by using a reward signal based on manual annotations of output action sequences, as defined in Section 5.2.","{'title': '7 Experimental Setup', 'number': '7'}"
"As shown there, policy gradient with this reward is equivalent to stochastic gradient ascent with a maximum likelihood objective. when only a subset of training documents is annotated, and environment reward is used for the remainder.","{'title': '7 Experimental Setup', 'number': '7'}"
Our method seamlessly combines these two kinds of rewards. sider two naive baselines.,"{'title': '7 Experimental Setup', 'number': '7'}"
Both scan through each sentence from left to right.,"{'title': '7 Experimental Setup', 'number': '7'}"
A command c is executed on the object whose name is encountered first in the sentence.,"{'title': '7 Experimental Setup', 'number': '7'}"
"This command c is either selected randomly, or set to the majority command, which is leftclick.","{'title': '7 Experimental Setup', 'number': '7'}"
This procedure is repeated until no more words match environment objects.,"{'title': '7 Experimental Setup', 'number': '7'}"
Table 2 presents evaluation results on the test sets.,"{'title': '8 Results', 'number': '8'}"
There are several indicators of the difficulty of this task.,"{'title': '8 Results', 'number': '8'}"
The random and majority baselines’ poor performance in both domains indicates that naive approaches are inadequate for these tasks.,"{'title': '8 Results', 'number': '8'}"
The performance of the fully supervised approach provides further evidence that the task is challenging.,"{'title': '8 Results', 'number': '8'}"
"This difficulty can be attributed in part to the large branching factor of possible actions at each step — on average, there are 27.14 choices per action in the Windows domain, and 9.78 in the Crossblock domain.","{'title': '8 Results', 'number': '8'}"
"In both domains, the learners relying only on environment reward perform well.","{'title': '8 Results', 'number': '8'}"
"Although the fully supervised approach performs the best, adding just a few annotated training examples to the environment-based learner significantly reduces the performance gap.","{'title': '8 Results', 'number': '8'}"
Figure 5 shows the overall tradeoff between annotation effort and system performance for the two domains.,"{'title': '8 Results', 'number': '8'}"
The ability to make this tradeoff is one of the advantages of our approach.,"{'title': '8 Results', 'number': '8'}"
The figure also shows that augmenting annotated documents with additional environment-reward documents invariably improves performance.,"{'title': '8 Results', 'number': '8'}"
The word alignment results from Table 2 indicate that the learners are mapping the correct words to actions for documents that are successfully completed.,"{'title': '8 Results', 'number': '8'}"
"For example, the models that perform best in the Windows domain achieve nearly perfect word alignment scores.","{'title': '8 Results', 'number': '8'}"
"To further assess the contribution of the instruction text, we train a variant of our model without access to text features.","{'title': '8 Results', 'number': '8'}"
"This is possible in the game domain, where all of the puzzles share a single goal state that is independent of the instructions.","{'title': '8 Results', 'number': '8'}"
"This variant solves 34% of the puzzles, suggesting that access to the instructions significantly improves performance.","{'title': '8 Results', 'number': '8'}"
"In this paper, we presented a reinforcement learning approach for inducing a mapping between instructions and actions.","{'title': '9 Conclusions', 'number': '9'}"
"This approach is able to use environment-based rewards, such as task completion, to learn to analyze text.","{'title': '9 Conclusions', 'number': '9'}"
We showed that having access to a suitable reward function can significantly reduce the need for annotations.,"{'title': '9 Conclusions', 'number': '9'}"
"The authors acknowledge the support of the NSF (CAREER grant IIS-0448168, grant IIS-0835445, grant IIS-0835652, and a Graduate Research Fellowship) and the ONR.","{'title': 'Acknowledgments', 'number': '10'}"
"Thanks to Michael Collins, Amir Globerson, Tommi Jaakkola, Leslie Pack Kaelbling, Dina Katabi, Martin Rinard, and members of the MIT NLP group for their suggestions and comments.","{'title': 'Acknowledgments', 'number': '10'}"
"Any opinions, findings, conclusions, or recommendations expressed in this paper are those of the authors, and do not necessarily reflect the views of the funding organizations.","{'title': 'Acknowledgments', 'number': '10'}"
Jeffrey Mark Siskind.,"{'title': 'Acknowledgments', 'number': '10'}"
2001.,"{'title': 'Acknowledgments', 'number': '10'}"
Grounding the lexical semantics of verbs in visual perception using force dynamics and event logic.,"{'title': 'Acknowledgments', 'number': '10'}"
J. Artif.,"{'title': 'Acknowledgments', 'number': '10'}"
Intell.,"{'title': 'Acknowledgments', 'number': '10'}"
Res.,"{'title': 'Acknowledgments', 'number': '10'}"
"(JAIR), 15:31–90.","{'title': 'Acknowledgments', 'number': '10'}"
