col1,col2
Precision (percent right of ones learned): 90% Recall (percent of OALD ones learned): 43% some unquestionable omissions from the dictionary.,"{'title': 'OKINF OKTHAT OKTV', 'number': '7'}"
"For example, Cobuild does not list that forbid takes from-marked participial complements, but this is very well attested in the New York Times newswire, as the examples in (7) show: (7) a.","{'title': 'OKINF OKTHAT OKTV', 'number': '7'}"
"The Constitution appears to forbid the general, as a former president who came to power through a coup, from taking office. b.","{'title': 'OKINF OKTHAT OKTV', 'number': '7'}"
"Parents and teachers are forbidden from taking a lead in the project, and ...","{'title': 'OKINF OKTHAT OKTV', 'number': '7'}"
"Unfortunately, for several reasons the results presented here are not directly comparable with those of Brent's systems.17 However, they seems to represent at least a comparable level of performance.","{'title': 'OKINF OKTHAT OKTV', 'number': '7'}"
"This paper presented one method of learning subcategorizations, but there are other approaches one might try.","{'title': 'FUTURE DIRECTIONS', 'number': '8'}"
"For disambiguating whether a PP is subcategorized by a verb in the V NP PP environment, Hindle and Rooth (1991) used a t-score to determine whether the PP has a stronger association with the verb or the preceding NP.","{'title': 'FUTURE DIRECTIONS', 'number': '8'}"
"This method could be usefully incorporated into my parser, but it remains a special-purpose technique for one particular case.","{'title': 'FUTURE DIRECTIONS', 'number': '8'}"
"Another research direction would be making the parser stochastic as well, rather than it being a categorical finite state device that runs on the output of a stochastic tagger.","{'title': 'FUTURE DIRECTIONS', 'number': '8'}"
There are also some linguistic issues that remain.,"{'title': 'FUTURE DIRECTIONS', 'number': '8'}"
The most troublesome case for any English subcategorization learner is dealing with prepositional complements.,"{'title': 'FUTURE DIRECTIONS', 'number': '8'}"
"As well as the issues discussed above, another question is how to represent the subcategorization frames of verbs that take a range of prepositional complements (but not all).","{'title': 'FUTURE DIRECTIONS', 'number': '8'}"
"For example, put can take virtually any locative or directional PP complement, while lean is more choosy (due to facts about the world): 17My system tries to learn many more subcategorization frames, most of which are more difficult to detect accurately than the ones considered in Brent's work, so overall figures are not comparable.","{'title': 'FUTURE DIRECTIONS', 'number': '8'}"
The recall figures presented in Brent (1992) gave the rate of recall out of those verbs which generated at least one cue of a given subcategorization rather than out of all verbs that have that subcategorization (pp.,"{'title': 'FUTURE DIRECTIONS', 'number': '8'}"
"1719), and are thus higher than the true recall rates from the corpus (observe in Table 3 that no cues were generated for infrequent verbs or subcategorization patterns).","{'title': 'FUTURE DIRECTIONS', 'number': '8'}"
"In Brent's earlier work (Brent 1991), the error rates reported were for learning from tagged text.","{'title': 'FUTURE DIRECTIONS', 'number': '8'}"
No error rates for running the system on untagged text were given and no recall figures were given for either system.,"{'title': 'FUTURE DIRECTIONS', 'number': '8'}"
The program doesn't yet have a good way of representing classes of prepositions.,"{'title': 'FUTURE DIRECTIONS', 'number': '8'}"
The applications of this system are fairly obvious.,"{'title': 'FUTURE DIRECTIONS', 'number': '8'}"
"For a parsing system, the current subcategorization dictionary could probably be incorporated as is, since the utility of the increase in coverage would almost undoubtedly outweigh problems arising from the incorrect subcategorization frames in the dictionary.","{'title': 'FUTURE DIRECTIONS', 'number': '8'}"
A lexicographer would want to review the results by hand.,"{'title': 'FUTURE DIRECTIONS', 'number': '8'}"
"Nevertheless, the program clearly finds gaps in printed dictionaries (even ones prepared from machine-readable corpora, like Cobuild), as the above example with forbid showed.","{'title': 'FUTURE DIRECTIONS', 'number': '8'}"
"A lexicographer using this program might prefer it adjusted for higher recall, even at the expense of lower precision.","{'title': 'FUTURE DIRECTIONS', 'number': '8'}"
"When a seemingly incorrect subcategorization frame is listed, the lexicographer could then ask for the cues that led to the postulation of this frame, and proceed to verify or dismiss the examples presented.","{'title': 'FUTURE DIRECTIONS', 'number': '8'}"
A final question is the applicability of the methods presented here to other languages.,"{'title': 'FUTURE DIRECTIONS', 'number': '8'}"
"Assuming the existence of a part-of-speech lexicon for another language, Kupiec's tagger can be trivially modified to tag other languages (Kupiec 1992).","{'title': 'FUTURE DIRECTIONS', 'number': '8'}"
"The finite state parser described here depends heavily on the fairly fixed word order of English, and so precisely the same technique could only be employed with other fixed word order languages.","{'title': 'FUTURE DIRECTIONS', 'number': '8'}"
"However, while it is quite unclear how Brent's methods could be applied to a free word order language, with the method presented here, there is a clear path forward.","{'title': 'FUTURE DIRECTIONS', 'number': '8'}"
Languages that have free word order employ either case markers or agreement affixes on the head to mark arguments.,"{'title': 'FUTURE DIRECTIONS', 'number': '8'}"
"Since the tagger provides this kind of morphological knowledge, it would be straightforward to write a similar program that determines the arguments of a verb using any combination of word order, case marking and head agreement markers, as appropriate for the language at hand.","{'title': 'FUTURE DIRECTIONS', 'number': '8'}"
"Indeed, since case-marking is in some ways more reliable than word order, the results for other languages might even be better than those reported here.","{'title': 'FUTURE DIRECTIONS', 'number': '8'}"
"After establishing that it is desirable to be able to automatically induce the subcategorization frames of verbs, this paper examined a new technique for doing this.","{'title': 'CONCLUSION', 'number': '9'}"
"The paper showed that the technique of trying to learn from easily analyzable pieces of data is not extendable to all subcategorization frames, and, at any rate, the sparseness of appropriate cues in unrestricted texts suggests that a better strategy is to try and extract as much (noisy) information as possible from as much of the data as possible, and then to use statistical techniques to filter the results.","{'title': 'CONCLUSION', 'number': '9'}"
"Initial experiments suggest that this technique works at least as well as previously tried techniques, and yields a method that can learn all the possible subcategorization frames of verbs.","{'title': 'CONCLUSION', 'number': '9'}"
