col1,col2
"As one might expect, this move only sweeps the problem under the rug.",Results/Conclusion
"If type-raising is lexical, then the definitions of this paper do not recognize (19) as a spurious ambiguity, because the two parses are now, technically speaking, analyses of different sentences.",Results/Conclusion
"Nor do they recognize the redundancy in (20), because—just as for the example &quot;softly knock twice&quot; in §4.1—it is contingent on a kind of lexical coincidence, namely that a type-raised subject commutes with a (generically) type-raised object.",Results/Conclusion
Such ambiguities are left to future work.,Results/Conclusion
The main contribution of this work has been formal: to establish a normal form for parses of &quot;pure&quot; Cornbinatory Categorial Grammar.,Results/Conclusion
"Given a sentence, every reading that is available to the grammar has exactly one normal-form parse, no matter how many parses it has in toto.",Results/Conclusion
"A result worth remembering is that, although TAG-equivalent CCG allows free interaction among forward, backward, and crossed composition rules of any degree, two simple constraints serve to eliminate all spurious ambiguity.",Results/Conclusion
It turns out that all spurious ambiguity arises from associative &quot;chains&quot; such as A/B B/C C or A/B/C C/D D/E\F/G G/H.,Results/Conclusion
"(Wit8 5 tenburg, 1987; Hepple & Morrill, 1989) anticipate this result, at least for some fragments of CCG, but leave the proof to future work.",Results/Conclusion
"These normal-form results for pure CCG lead directly to useful parsers for real, restricted CCG grammars.",Results/Conclusion
Two parsing algorithms have been presented for practical use.,Results/Conclusion
One algorithm finds only normal forms; this simply and safely eliminates spurious ambiguity under most real CCG grammars.,Results/Conclusion
"The other, more complex algorithm solves the spurious ambiguity problem for any CCG grammar, by using normal forms as an efficient tool for grouping semantically equivalent parses.",Results/Conclusion
"Both algorithms are safe, complete, and efficient.",Results/Conclusion
"In closing, it should be repeated that the results provided are for the TAG-equivalent Bn (generalized composition) formalism of (Joshi et al., 1991), optionally extended with the S (substitution) rules of (Szabolcsi, 1989).",Results/Conclusion
The technique eliminates all spurious ambiguities resulting from the interaction of these rules.,Results/Conclusion
Future work should continue by eliminating the spurious ambiguities that arise from grammatical or lexical type-raising.,Results/Conclusion
