col1,col2
"Under categorial grammars that have powerful rules like composition, a simple n-word sentence can have exponentially many parses.",Introduction
Generating all parses is inefficient and obscures whatever true semantic ambiguities are in the input.,Introduction
"This paper addresses the problem for a fairly general form of Combinatory Categorial Grammar, by means of an efficient, correct, and easy to implement normal-form parsing tech- The parser is proved to find exone in each semantic equivalence class of allowable parses; that is, spurious ambiguity (as carefully defined) is shown to be both safely and completely eliminated.",Introduction
"Combinatory Categorial Grammar (Steedman, 1990), like other &quot;flexible&quot; categorial grammars, suffers from spurious ambiguity (Wittenburg, 1986).",Experiment/Discussion
"The non-standard constituents that are so crucial to CCG's analyses in (1), and in its account of intonational focus (Prevost & Steedman, 1994), remain available even in simpler sentences.",Experiment/Discussion
This renders (2) syntactically ambiguous.,Experiment/Discussion
"The practical problem of &quot;extra&quot; parses in (2) becomes exponentially worse for longer strings, which can have up to a Catalan number of parses.",Experiment/Discussion
"An exhaustive parser serves up 252 CCG parses of (3), which must be sifted through, at considerable cost, in order to identify the two distinct meanings for further processing.'",Experiment/Discussion
This paper presents a simple and flexible CCG parsing technique that prevents any such explosion of redundant CCG derivations.,Experiment/Discussion
"In particular, it is proved in §4.2 that the method constructs exactly one syntactic structure per semantic reading—e.g., just two parses for (3).",Experiment/Discussion
All other parses are suppressed by simple normal-form constraints that are enforced throughout the parsing process.,Experiment/Discussion
This approach works because CCG's spurious ambiguities arise (as is shown) in only a small set of circumstances.,Experiment/Discussion
"Although similar work has been attempted in the past, with varying degrees of success (Karttunen, 1986; Wittenburg, 1986; Pareschi & Steedman, 1987; Bouma, 1989; Hepple & Morrill, 1989; Ki5nig, 1989; Vijay-Shanker & Weir, 1990; Hepple, 1990; Moortgat, 1990; Hendriks, 1993; Niv, 1994), this appears to be the first full normal-form result for a categorial formalism having more than contextfree power.",Experiment/Discussion
CCG may be regarded as a generalization of contextfree grammar (CFG)—one where a grammar has infinitely many nonterminals and phrase-structure rules.,Experiment/Discussion
"In addition to the familiar atomic nonterminal categories (typically S for sentences, N for nouns, NP for noun phrases, etc.",Experiment/Discussion
"), CCG allows in- signs different types to &quot;John likes&quot; and &quot;Mary prefinitely many slashed categories.",Experiment/Discussion
"If x and y are tends to like,&quot; thus losing the ability to conjoin such categories, then x/y (respectively x\y) is the cat- constituents or subcategorize for them as a class. egory of an incomplete x that is missing a y at its (Pareschi & Steedman, 1987) do tackle the CCG right (respectively left).",Experiment/Discussion
"Thus verb phrases are an- case, but (Hepple, 1987) shows their algorithm to alyzed as subjectless sentences S \NP, while &quot;John be incomplete. likes&quot; is an objectless sentence or S/NP.",Experiment/Discussion
"A complex 3 Overview of the Parsing Strategy category like ( (S \NP) \ (S \NP))/N may be written as As is well known, general CFG parsing methods S \NP \ (S \NP)/N, under a convention that slashes are can be applied directly to CCG.",Experiment/Discussion
Any sort of chart left-associative. parser or non-deterministic shift-reduce parser will The results herein apply to the TAG-equivalent do.,Experiment/Discussion
"Such a parser repeatedly decides whether two CCG formalization given in (Joshi et al., 1991).2 adjacent constituents, such as S/NP and NP/N, should In this variety of CCG, every (non-lexical) phrase- be combined into a larger constituent such as S/N. structure rule is an instance of one of the following The role of the grammar is to state which combibinary-rule templates (where n 0): nations are allowed.",Experiment/Discussion
"The key to efficiency, we will (4) Forward generalized composition >Bn: see, is for the parser to be less permissive than the xly Y Inzn • • • 12z2 lizi Inn • • • I2z2 lizi grammar—for it to say &quot;no, redundant&quot; in some Backward generalized composition <Bn: cases where the grammar says &quot;yes, grammatical.&quot; Y Inzn • • I2z2 lizi \Y x Inzn • • • I I (5) shows the constituents that untrammeled ,2z2 ,izi CCG will find in the course of parsing &quot;John likes Instances with n = 0 are called application rules, and Mary.&quot; The spurious ambiguity problem is not that instances with n > 1 are called composition rules.",Experiment/Discussion
"In the grammar allows (5c), but that the grammar ala given rule, x,y,z1...zn would be instantiated as lows both (5f) and (5g)—distinct parses of the same categories like NP, S/NP, or S \NP \ (S\NP)/N.",Experiment/Discussion
"Each of string, with the same meaning.",Experiment/Discussion
11 through ln would be instantiated as either / or \ (5) a.,Experiment/Discussion
[John]si(s\Np) A fixed CCG grammar need not include every b.,Experiment/Discussion
[likes](swp)/Np phrase-structure rule matching these templates.,Experiment/Discussion
"In- c. [John likes]siNp deed, (Joshi et al., 1991) place certain restrictions d. [Mary]Np on the rule set of a CCG grammar, including a re- e. [likes Mary]s \Np quirement that the rule degree n is bounded over the f. [[John likes] Mary]s to be disallowed set.",Experiment/Discussion
"The results of the present paper apply to such g. [John [likes Mary]]s restricted grammars and also more generally, to any The proposal is to construct all constituents CCG-style grammar with a decidable rule set. shown in (5) except for (5f).",Experiment/Discussion
"If we slightly conEven as restricted by (Joshi et al., 1991), CCGs strain the use of the grammar rules, the parser will have the &quot;mildly context-sensitive&quot; expressive power still produce (5c) and (5d)—constituents that are of Tree Adjoining Grammars (TAGs).",Experiment/Discussion
Most work indispensable in contexts like (1)—while refusing to on spurious ambiguity has focused on categorial for- combine those constituents into (51).,Experiment/Discussion
The relevant malisms with substantially less power.,Experiment/Discussion
"(Hepple, rule S/NP NP S will actually be blocked when it 1990) and (Hendriks, 1993), the most rigorous pieces attempts to construct (5f).",Experiment/Discussion
"Although rule-blocking of work, each establish a normal form for the syn- may eliminate an analysis of the sentence, as it does tactic calculus of (Lambek, 1958), which is weakly here, a semantically equivalent analysis such as (5g) context-free.",Experiment/Discussion
"(Konig, 1989; Moortgat, 1990) have will always be derivable along some other route. also studied the Lambek calculus case.",Experiment/Discussion
"(Hepple In general, our goal is to discover exactly one analMorrill, 1989), who introduced the idea of normal- ysis for each <substring, meaning> pair.",Experiment/Discussion
"By pracform parsing, consider only a small CCG frag- ticing &quot;birth control&quot; for each bottom-up generation ment that lacks backward or order-changing com- of constituents in this way, we avoid a population position; (Niv, 1994) extends this result but does explosion of parsing options.",Experiment/Discussion
&quot;John likes Mary&quot; has not show completeness.,Experiment/Discussion
"(Wittenburg, 1987) assumes only one reading semantically, so just one of its anala CCG fragment lacking order-changing or higher- yses (5f)–(5g) is discovered while parsing (6).",Experiment/Discussion
"Only order composition; furthermore, his revision of the that analysis, and not the other, is allowed to concombinators creates new, conjoinable constituents tinue on and be built into the final parse of (6). that conventional CCG rejects.",Experiment/Discussion
"(Bouma, 1989) pro- (6) that galoot in the corner that thinks [John poses to replace composition with a new combina- likes MarAs tor, but the resulting product-grammar scheme as- For a chart parser, where each chart cell stores the analyses of some substring, this strategy says that 2This formalization sweeps any type-raising into the 80 lexicon, as has been proposed on linguistic grounds (Dowty, 1988; Steedman, 1991, and others).",Experiment/Discussion
"It also treats conjunction lexically, by giving &quot;and&quot; the generalized category x\x/x and barring it from composition. all analyses in a cell are to be semantically distinct.",Experiment/Discussion
"(Karttunen, 1986) suggests enforcing that property directly—by comparing each new analysis semantically with existing analyses in the cell, and refusing to add it if redundant—but (Hepple & Morrill, 1989) observe briefly that this is inefficient for large charts.3 The following sections show how to obtain effectively the same result without doing any semantic interpretation or comparison at all.",Experiment/Discussion
It is convenient to begin with a special case.,Experiment/Discussion
Suppose the CCG grammar includes not some but all instances of the binary rule templates in (4).,Experiment/Discussion
"(As always, a separate lexicon specifies the possible categories of each word.)",Experiment/Discussion
"If we group a sentence's parses into semantic equivalence classes, it always turns out that exactly one parse in each class satisfies the following simple declarative constraints: The notation here is from (4).",Experiment/Discussion
"More colloquially, (7) says that the output of rightward (leftward) composition may not compose or apply over anything to is right (left).",Experiment/Discussion
A parse tree or subtree that satisfies (7) is said to be in normal form (NF).,Experiment/Discussion
"As an example, consider the effect of these restrictions on the simple sentence &quot;John likes Mary.&quot; Ignoring the tags —OT, —FC, and —BC for the moment, (8a) is a normal-form parse.",Experiment/Discussion
"Its competitor (813) is not, nor is any larger tree containing (8b).",Experiment/Discussion
But non3How inefficient?,Experiment/Discussion
"(i) has exponentially many semantically distinct parses: n = 10 yields 82,756,612 parses in (2°) = 48,620 equivalence classes.",Experiment/Discussion
"Karttunen's io method must therefore add 48,620 representative parses to the appropriate chart cell, first comparing each one against all the previously added parses—of which there are 48,620/2 on average—to ensure it is not semantically redundant.",Experiment/Discussion
"(Additional comparisons are needed to reject parses other than the lucky 48,620.)",Experiment/Discussion
Adding a parse can therefore take exponential time.,Experiment/Discussion
"Structure sharing does not appear to help: parses that are grouped in a parse forest have only their syntactic category in common, not their meaning.",Experiment/Discussion
Karttunen's approach must tease such parses apart and compare their various meanings individually against each new candidate.,Experiment/Discussion
"By contrast, the method proposed below is purely syntactic—just like any &quot;ordinary&quot; parser—so it never needs to unpack a subforest, and can run in polynomial time. standard constituents are allowed when necessary: (8c) is in normal form (cf.",Experiment/Discussion
(1)).,Experiment/Discussion
"It is not hard to see that (7a) eliminates all but right-branching parses of &quot;forward chains&quot; like A/B B/C C or A/B/C C/D D/E/F/G G/H, and that (7b) eliminates all but left-branching parses of &quot;backward chains.&quot; (Thus every functor will get its arguments, if possible, before it becomes an argument itself.)",Experiment/Discussion
But it is hardly obvious that (7) eliminates all of CCG 's spurious ambiguity.,Experiment/Discussion
"One might worry about unexpected interactions involving crossing composition rules like A/B B \C –4- A \ C. Significantly, it turns out that (7) really does suffice; the proof is in §4.2.",Experiment/Discussion
It is trivial to modify any sort of CCG parser to find only the normal-form parses.,Experiment/Discussion
No semantics is necessary; simply block any rule use that would violate (7).,Experiment/Discussion
"In general, detecting violations will not hurt performance by more than a constant factor.",Experiment/Discussion
"Indeed, one might implement (7) by modifying CCG's phrase-structure grammar.",Experiment/Discussion
Each ordinary CCG category is split into three categories that bear the respective tags from (9).,Experiment/Discussion
The 24 templates schematized in (10) replace the two templates of (4).,Experiment/Discussion
"Any CFG-style method can still parse the resulting spuriosity-free grammar, with tagged parses as in (8).",Experiment/Discussion
"In particular, the polynomial-time, polynomialspace CCG chart parser of (Vijay-Shanker & Weir, 1993) can be trivially adapted to respect the constraints by tagging chart entries.",Experiment/Discussion
"It is interesting to note a rough resemblance between the tagged version of CCG in (10) and the tagged Lambek calculus L*, which (Hendriks, 1993) developed to eliminate spurious ambiguity from the Lambek calculus L. Although differences between CCG and L mean that the details are quite different, each system works by marking the output of certain rules, to prevent such output from serving as input to certain other rules.",Results/Conclusion
We wish to establish that each semantic equivalence class contains exactly one NF parse.,Results/Conclusion
But what does &quot;semantically equivalent&quot; mean?,Results/Conclusion
Let us adopt a standard model-theoretic view.,Results/Conclusion
"For each leaf (i.e., lexeme) of a given syntax tree, the lexicon specifies a lexical interpretation from the model.",Results/Conclusion
CCG then provides a derived interpretation in the model for the complete tree.,Results/Conclusion
"The standard CCG theory builds the semantics compositionally, guided by the syntax, according to (11).",Results/Conclusion
We may therefore regard a syntax tree as a static &quot;recipe&quot; for combining word meanings into a phrase meaning.,Results/Conclusion
One might choose to say that two parses are semantically equivalent if they derive the same phrase meaning.,Results/Conclusion
"However, such a definition would make spurious ambiguity sensitive to the fine-grained semantics of the lexicon.",Results/Conclusion
Are the two analyses of VP/VP VP VP \VP semantically equivalent?,Results/Conclusion
"If the lexemes involved are &quot;softly knock twice,&quot; then yes, as softly(twice(knock)) and twice(softly(knock)) arguably denote a common function in the semantic model.",Results/Conclusion
"Yet for &quot;intentionally knock twice&quot; this is not the case: these adverbs do not commute, and the semantics are distinct.",Results/Conclusion
It would be difficult to make such subtle distinctions rapidly.,Results/Conclusion
"Let us instead use a narrower, &quot;intensional&quot; definition of spurious ambiguity.",Results/Conclusion
"The trees in (12a—b) will be considered equivalent because they specify the same &quot;recipe,&quot; shown in (12c).",Results/Conclusion
"No matter what lexical interpretations f,g,h,k are fed into the leaves A/B, B/C/D, D/E, E/F, both the trees end up with the same derived interpretation, namely a model element that can be determined from f,g,h,k by calculating AxAy.f(g(h(k(x)))(y)).",Results/Conclusion
"By contrast, the two readings of &quot;softly knock twice&quot; are considered to be distinct, since the parses -+ specify different recipes.",Results/Conclusion
"That is, given a suitably Q fit NF T NF(a) free choice of meanings for the words, the two parses 131 /32 132 7 can be made to pick out two different VP-type func- This construction resembles a well-known normaltions in the model.",Results/Conclusion
"The parser is therefore conser- form reduction procedure that (Hepple 8.6 Morrill, vative and keeps both parses.'",Results/Conclusion
1989) propose (without proving completeness) for a 4.2 Normal-form parsing is safe Sz complete small fragment of CCG.,Results/Conclusion
The motivation for producing only NF parses (as The proof of theorem 2 (completeness) is longer defined by (7)) lies in the following existence and and more subtle.,Results/Conclusion
"First it shows, by a simple inducuniqueness theorems for CCG. tion, that since a and a' disagree they must disagree Theorem 1 Assuming &quot;pure CCG,&quot; where all pos- in at least one of these ways: sible rules are in the grammar, any parse tree a is se- (a) There are trees /3, -y and rules R R' such that mantically equivalent to some NF parse tree NF(a).",Results/Conclusion
"<R, #,7> is a subtree of a and <R', 0,7> is a (This says the NF parser is safe for pure CCG: we subtree of a'.",Results/Conclusion
"(For example, S/S S \ S may form will not lose any readings by generating just normal a constituent by either <Blx or >Bix.) forms.)",Results/Conclusion
"(b) There is a tree 7 that appears as a subtree of Theorem 2 Given distinct NF trees a 0 a' (on the both a and a', but combines to the left in one same sequence of leaves).",Results/Conclusion
Then a and a' are not case and to the right in the other. semantically equivalent.,Results/Conclusion
"Either condition, the proof shows, leads to different (This says that the NF parser is complete: generat- &quot;immediate scope&quot; relations in the full trees a and a' ing only normal forms eliminates all spurious ambi- (in the sense in which f takes immediate scope over guity.) g in f(g(x)) but not in f(h(g(x))) or g(f(x))).",Results/Conclusion
ConDetailed proofs of these theorems are available on dition (a) is straightforward.,Results/Conclusion
"Condition (b) splits the al-T-1g archive, but can only be sketched here. into a case where -y serves as a secondary argument Theorem 1 is proved by a constructive induction on inside both a and a', and a case where it is a primary the order of a, given below and illustrated in (13): argument in a or a'.",Results/Conclusion
"The latter case requires consid• For a a leaf, put NF(a) = a. eration of 7's ancestors; the NF properties crucially • (<R, 0,7> denotes the parse tree formed by com- rule out counterexamples here. bining subtrees 13, 7 via rule R.) The notion of scope is relevant because semantic If a = <R,/3,7>, then take NF(a) = interpretations for CCG constituents can be written <R, NF(#),NF(-y)>, which exists by inductive as restricted lambda terms, in such a way that conhypothesis, unless this is not an NF tree.",Results/Conclusion
"In stituents having distinct terms must have different the latter case, WLOG, R is a forward rule and interpretations in the model (for suitable interpretaNF(#) = <Q, 13i, /32> for some forward com- tions of the words, as in §4.1).",Results/Conclusion
Theorem 2 is proved position rule Q.,Results/Conclusion
"Pure CCG turns out to pro- by showing that the terms for a and a' differ somevide forward rules S and T such that a' = where, so correspond to different semantic recipes.",Results/Conclusion
"<S, , NF(<T, , 7>)> is a constituent and Similar theorems for the Lambek calculus were is semantically equivalent to a.",Results/Conclusion
"Moreover, since previously shown by (Hepple, 1990; Hendriks, 1993).",Results/Conclusion
"131 serves as the primary subtree of the NF tree The present proofs for CCG establish a result that NF(#), fi1. cannot be the output of forward com- has long been suspected: the spurious ambiguity position, and is NF besides.",Results/Conclusion
Therefore a' is NF: problem is not actually very widespread in CCG. take NF(a) = a'.,Results/Conclusion
Theorem 2 says all cases of spurious ambiguity Theorem 2 remains true (< 1 NF per reading). that their NFs have been previously computed.,Results/Conclusion
Whether theorem 1 (> 1 NF per reading) remains Figure (1) gives an efficient CKY-style algorithm true depends on what set of rules is removed.,Results/Conclusion
For based on this insight.,Results/Conclusion
"(Parsing strategies besides most linguistically reasonable choices, the proof of CKY would also work, in particular (Vijay-Shanker theorem 1 will go through,' so that the normal-form Si Weir, 1993)) The management of cached NFs in parser of §4 remains safe.",Results/Conclusion
"But imagine removing steps 9, 12, and especially 16 ensures that duplicate only the rule B/C C B: this leaves the string A/B NFs never enter the oldNFs array: thus any alterB/C C with a left-branching parse that has no (legal) native copy of a.nf has the same array coordinates NF equivalent. used for a.nf itself, because it was built from identiIn the sort of restricted grammar where theorem 1 cal subtrees. does not obtain, can we still find one (possibly non- The function PreferableTo(c, r) (step 15) proNF) parse per equivalence class?",Results/Conclusion
Yes: a different vides flexibility about which parse represents its kind of efficient parser can be built for this case. class.,Results/Conclusion
"PreferableTo may be defined at whim to Since the new parser must be able to generate a choose the parse discovered first, the more leftnon-NF parse when no equivalent NF parse is avail- branching parse, or the parse with fewer nonable, its method of controlling spurious ambiguity standard constituents.",Results/Conclusion
"Alternatively, PreferableTo cannot be to enforce the constraints (7).",Results/Conclusion
The old may call an intonation or discourse module to pick parser refused to build non-NF constituents; the new the parse that better reflects the topic-focus diviparser will refuse to build constituents that are se- sion of the sentence.,Results/Conclusion
(A variant algorithm ignores mantically equivalent to already-built constituents.,Results/Conclusion
"PreferableTo and constructs one parse forest per This idea originates with (Karttunen, 1986). reading.",Results/Conclusion
"Each forest can later be unpacked into inHowever, we can take advantage of the core result dividual equivalent parse trees, if desired.) of this paper, theorems 1 and 2, to do Karttunen's (Vijay-Shanker Sz Weir, 1990) also give a method redundancy check in 0(1) time—no worse than the for removing &quot;one well-known source&quot; of spurious normal-form parser's check for —FC and –BC tags. ambiguity from restricted CCGs; §4.2 above shows (Karttunen's version takes worst-case exponential that this is in fact the only source.",Results/Conclusion
"However, their time for each redundancy check: see footnote §3.) method relies on the grammaticality of certain interThe insight is that theorems 1 and 2 estab- mediate forms, and so can fail if the CCG rules can lish a one-to-one map between semantic equivalence be arbitrarily restricted.",Results/Conclusion
"In addition, their method classes and normal forms of the pure (unrestricted) is less efficient than the present one: it considers CCG: parses in pairs, not singly, and does not remove any (15) Two parses a, a' of the pure CCG are parse until the entire parse forest has been built. semantically equivalent if they have the 6 Extensions to the CCG Formalism same normal form: NF(a)= NF(a').",Results/Conclusion
"In addition to the Bn (&quot;generalized composition&quot;) The NF function is defined recursively by §4.2's rules given in §2, which give CCG power equivalent proof of theorem 1; semantic equivalence is also to TAG, rules based on the S (&quot;substitution&quot;) and defined independently of the grammar.",Results/Conclusion
"So (15) is T (&quot;type-raising&quot;) combinators can be linguistically meaningful and true even if a, a' are produced by useful.",Results/Conclusion
"S provides another rule template, used in a restricted CCG.",Results/Conclusion
"The tree NF(a) may not be a the analysis of parasitic gaps (Steedman, 1987; Szlegal parse under the restricted grammar.",Results/Conclusion
"How- abolcsi, 1989): ever, it is still a perfectly good data structure that (16) a.",Results/Conclusion
">s: x/y liz y liz --+ x liz can be maintained outside the parse chart, to serve 11 f g Az. f(z)(g(z)) b.",Results/Conclusion
"<S: y liz x\Y liz –+ x liz Although S interacts with Bn to produce another source of spurious ambiguity, illustrated in (17), the additional ambiguity is not hard to remove.",Results/Conclusion
"It can be shown that when the restriction (18) is used together with (7), the system again finds exactly one 84 'For the proof to work, the rules S and T must be available in the restricted grammar, given that R and Q are.",Results/Conclusion
"This is usually true: since (7) favors standard constituents and prefers application to composition, most grammars will not block the NF derivation while allowing a non-NF one.",Results/Conclusion
"(On the other hand, the NF parse of A/B B/C C/D/E uses >B2 twice, while the non-NF parse gets by with >B2 and >B1.)",Results/Conclusion
Type-raising presents a greater problem.,Results/Conclusion
Various new spurious ambiguities arise if it is permitted freely in the grammar.,Results/Conclusion
"In principle one could proceed without grammatical type-raising: (Dowty, 1988; Steedman, 1991) have argued on linguistic grounds that type-raising should be treated as a mere lexical redundancy property.",Results/Conclusion
"That is, whenever the lexicon contains an entry of a certain category X, with semantics x, it also contains one with (say) category T/ (T \X) and interpretation Ap.p(x).",Results/Conclusion
