col1,col2
"Promising features for classification include part of speech, frequency of co-occurrence, relative word position, and translational entropy (Melamed, 1997).",Results/Conclusion
"Another interesting extension is to broaden the definition of a &quot;word&quot; to include multi-word lexical units (Smadja, 1992).",Results/Conclusion
"If such units can be identified a priori, their translations can be estimated without modifying the word-to-word model.",Results/Conclusion
"In this manner, the model can account for a wider range of translation phenomena.",Results/Conclusion
The French/English software manuals were provided by Gary Adams of Sun MicroSystems Laboratories.,Results/Conclusion
"The weather bitext was prepared at the University of Montreal, under the direction of Richard Kittredge.",Results/Conclusion
Thanks to Alexis Nasr for hand-evaluating the weather translation lexicon.,Results/Conclusion
"Thanks also to Mike Collins, George Foster, Mitch Marcus, Lyle Ungar, and three anonymous reviewers for helpful comments.",Results/Conclusion
This research was supported by an equipment grant from Sun MicroSystems and by ARPA Contract #N66001-94C-6043.,Results/Conclusion
