col1,col2
"Many multilingual NLP applications need to translate words between different languages, but cannot afford the computational expense of inducing or applying a full translation model.",Introduction
"For these applications, we have designed a fast algorithm for estimating a partial translation model, which accounts for translational equivalence only at the word level .",Introduction
The model's precision/recall trade-off can be directly controlled via one threshold parameter.,Introduction
This feature makes the model more suitable for applications that are not fully statistical.,Introduction
"The model's hidden parameters can be easily conditioned on information extrinsic to the model, providing an easy way to integrate pre-existing knowledge such as partof-speech, dictionaries, word order, etc.. Our model can link word tokens in parallel texts as well as other translation models in the literature.",Introduction
"Unlike other translation models, it can automatically produce dictionary-sized translation lexicons, and it can do so with over 99% accuracy.",Introduction
"Over the past decade, researchers at IBM have developed a series of increasingly sophisticated statistical models for machine translation (Brown et al., 1988; Brown et al., 1990; Brown et al., 1993a).",Experiment/Discussion
"However, the IBM models, which attempt to capture a broad range of translation phenomena, are computationally expensive to apply.",Experiment/Discussion
"Table look-up using an explicit translation lexicon is sufficient and preferable for many multilingual NLP applications, including &quot;crummy&quot; MT on the World Wide Web (Church & Hovy, 1993), certain machine-assisted translation tools (e.g.",Experiment/Discussion
"(Macklovitch, 1994; Melamed, 1996b)), concordancing for bilingual lexicography (Catizone et al., 1993; Gale & Church, 1991), computerassisted language learning, corpus linguistics (Melby.",Experiment/Discussion
"1981), and cross-lingual information retrieval (Oard & Dorr, 1996).",Experiment/Discussion
"In this paper, we present a fast method for inducing accurate translation lexicons.",Experiment/Discussion
The method assumes that words are translated one-to-one.,Experiment/Discussion
"This assumption reduces the explanatory power of our model in comparison to the IBM models, but, as shown in Section 3.1, it helps us to avoid what we call indirect associations, a major source of errors in other models.",Experiment/Discussion
"Section 3.1 also shows how the oneto-one assumption enables us to use a new greedy competitive linking algorithm for re-estimating the model's parameters, instead of more expensive algorithms that consider a much larger set of word correspondence possibilities.",Experiment/Discussion
The model uses two hidden parameters to estimate the confidence of its own predictions.,Experiment/Discussion
The confidence estimates enable direct control of the balance between the model's precision and recall via a simple threshold.,Experiment/Discussion
The hidden parameters can be conditioned on prior knowledge about the bitext to improve the model's accuracy.,Experiment/Discussion
"With the exception of (Fung, 1995b), previous methods for automatically constructing statistical translation models begin by looking at word cooccurrence frequencies in bitexts (Gale & Church, 1991; Kumano & Hirakawa, 1994; Fung, 1995a; Melamed, 1995).",Experiment/Discussion
"A bitext comprises a pair of texts in two languages, where each text is a translation of the other.",Experiment/Discussion
Word co-occurrence can be defined in various ways.,Experiment/Discussion
"The most common way is to divide each half of the bitext into an equal number of segments and to align the segments so that each pair of segments Si and Ti are translations of each other (Gale & Church, 1991; Melamed, 1996a).",Experiment/Discussion
"Then, two word tokens (u, v) are said to co-occur in the",Experiment/Discussion
"Our translation model consists of the hidden parameters A+ and )c, and likelihood ratios L(u, v).",Experiment/Discussion
The two hidden parameters are the probabilities of the model generating true and false positives in the data.,Experiment/Discussion
"L(u, v) represents the likelihood that u and v can be mutual translations.",Experiment/Discussion
"For each co-occurring pair of word types u and v, these likelihoods are initially set proportional to their co-occurrence frequency („,v) and inversely proportional to their marginal frequencies n(u) and n(v) 1, following (Dunning, 1993)2.",Experiment/Discussion
"When the L(u, v) are re-estimated, the model's hidden parameters come into play.",Experiment/Discussion
"After initialization, the model induction algorithm iterates: The competitive linking algorithm and its one-to-one assumption are detailed in Section 3.1.",Experiment/Discussion
Section 3.1 explains how to re-estimate the model parameters.,Experiment/Discussion
"The competitive linking algorithm is designed to overcome the problem of indirect associations, illustrated in Figure 1.",Experiment/Discussion
The sequences of u's and v's represent corresponding regions of a bitext.,Experiment/Discussion
"If uk and vk co-occur much more often than expected by chance, then any reasonable model will deem them likely to be mutual translations.",Experiment/Discussion
"If uk and vk are indeed mutual translations, then their tendency to 'The co-occurrence frequency of a word type pair is simply the number of times the pair co-occurs in the corpus.",Experiment/Discussion
"However, n(u) = Ev n(u,v), which is not the same as the frequency of u, because each token of u can co-occur with several differentv's.",Experiment/Discussion
"2We could just as easily use other symmetric &quot;association&quot; measures, such as 02 (Gale & Church, 1991) or the Dice coefficient (Smadja, 1992). co-occur is called a direct association.",Experiment/Discussion
"Now, suppose that uk and uk±i often co-occur within their language.",Experiment/Discussion
Then vk and uk+i will also co-occur more often than expected by chance.,Experiment/Discussion
"The arrow connecting vk and uk±i in Figure 1 represents an indirect association, since the association between vk and uk±i arises only by virtue of the association between each of them and uk .",Experiment/Discussion
"Models of translational equivalence that are ignorant of indirect associations have &quot;a tendency ... to be confused by collocates&quot; (Dagan et al., 1993).",Experiment/Discussion
"Fortunately, indirect associations are usually not difficult to identify, because they tend to be weaker than the direct associations on which they are based (Melamed, 1996c).",Experiment/Discussion
"The majority of indirect associations can be filtered out by a simple competition heuristic: Whenever several word tokens ui in one half of the bitext co-occur with a particular word token v in the other half of the bitext, the word that is most likely to be v's translation is the one for which the likelihood L(u, v) of translational equivalence is highest.",Experiment/Discussion
The competitive linking algorithm implements this heuristic: N.B.,Experiment/Discussion
": A and A- need not sum to 1, because they are conditioned on different events. would be the winners in any competitions involving u or v. The competitive linking algorithm is more greedy than algorithms that try to find a set of link types that are jointly most probable over some segment of the bitext.",Experiment/Discussion
"In practice, our linking algorithm can be implemented so that its worst-case running time is 0(/m), where 1 and m are the lengths of the aligned segments.",Experiment/Discussion
The simplicity of the competitive linking algorithm depends on the one-to-one assumption: Each word translates to at most one other word.,Experiment/Discussion
"Certainly, there are cases where this assumption is false.",Experiment/Discussion
"We prefer not to model those cases, in order to achieve higher accuracy with less effort on the cases where the assumption is true.",Experiment/Discussion
The purpose of the competitive linking algorithm is to help us re-estimate the model parameters.,Experiment/Discussion
The variables that we use in our estimation are summarized in Figure 2.,Experiment/Discussion
The linking algorithm produces a set of links between word tokens in the bitext.,Experiment/Discussion
"We define a link token to be an ordered pair of word tokens, one from each half of the bitext.",Experiment/Discussion
A link type is an ordered pair of word types.,Experiment/Discussion
"Let n(,,v) be the co-occurrence frequency of u and v and k(u,v) be the number of links between tokens of u and v3.",Experiment/Discussion
"An 'Note that k(u,„) depends on the linking algorithm, but n(„,„.) is a constant property of the bitext. important property of the competitive linking algorithm is that the ratio k(uv)/n(u) tends to be very high if u and v are mutual translations, and quite low if they are not.",Experiment/Discussion
"The bimodality of this ratio for several values of n(u,v) is illustrated in Figure 3.",Experiment/Discussion
This figure was plotted after the model's first iteration over 300000 aligned sentence pairs from the Canadian Hansard bitext.,Experiment/Discussion
Note that the frequencies are plotted on a log scale — the bimodality is quite sharp.,Experiment/Discussion
"The linking algorithm creates all the links of a given type independently of each other, so the number k(„,„) of links connecting word types u and v has a binomial distribution with parameters n(„,v) and p(„,v).",Experiment/Discussion
"If u and v are mutual translations, then P(u,v) tends to a relatively high probability, which we will call A+.",Experiment/Discussion
"If u and v are not mutual translations, then p(u,„) tends to a very low probability, which we will call A. A+ and A- correspond to the two peaks in the frequency distribution of k(„,,)/n(u,v) in Figure 2.",Experiment/Discussion
The two parameters can also be interpreted as the percentage of true and false positives.,Experiment/Discussion
If the translation in the bitext is consistent and the model is accurate; then A+ should be near 1 and Ashould be near 0.,Experiment/Discussion
"To find the most probable values of the hidden model parameters A+ and A-, we adopt the standard method of maximum likelihood estimation, and find the values that maximize the probability of the link frequency distributions.",Experiment/Discussion
"The one-to-one assumption implies independence between different link types, so that The factors on the right-hand side of Equation 1 can be written explicitly with the help of a mixture coefficient.",Experiment/Discussion
Let r be the probability that an arbitrary co-occurring pair of word types are mutual translations.,Experiment/Discussion
"Let B(kin,p) denote the probability that k links are observed out of n co-occurrences, where k has a binomial distribution with parameters n and p. Then the probability that u and v are linked k(u,v) times out of n(u,v) co-occurrences is a mixture of two binomials: One more variable allows us to express T in terms of A+ and A- : Let A be the probability that an arbitrary co-occuring pair of word tokens will be linked, regardless of whether they are mutual translations.",Experiment/Discussion
"Since T is constant over all word types, it also represents the probability that an arbitrary co-occurring pair of word tokens are mutual translations.",Experiment/Discussion
"Therefore, A can also be estimated empirically.",Experiment/Discussion
"Let K be the total number of links in the bitext and let N be the total number of co-occuring word token pairs: K = Equating the right-hand sides of Equations (3) and (4) and rearranging the terms, we get: Since r is now a function of A+ and A-, only the latter two variables represent degrees of freedom in the model.",Experiment/Discussion
The probability function expressed by Equations 1 and 2 has many local maxima.,Experiment/Discussion
"In practice, these local maxima are like pebbles on a mountain, invisible at low resolution.",Experiment/Discussion
We computed Equation 1 over various combinations of A+ and A- after the model's first iteration over 300000 aligned sentence pairs from the Canadian Hansard bitext.,Experiment/Discussion
"Figure 4 shows that the region of interest in the parameter space, where 1 > A+ > A > A- > 0, has only one clearly visible global maximum.",Experiment/Discussion
"This global maximum can be found by standard hill-climbing methods, as long as the step size is large enough to avoid getting stuck on the pebbles.",Experiment/Discussion
"Given estimates for A+ and A- , we can compute B(ku,v Inu,v, A+) and B(ku,vin„,v, A- ).",Experiment/Discussion
"These are probabilities that ku,v) links were generated by an algorithm that generates correct links and by an algorithm that generates incorrect links, respectively, out of n(„,,v) co-occurrences.",Experiment/Discussion
"The ratio of these probabilities is the likelihood ratio in favor of u and v being mutual translations, for all u and v:",Experiment/Discussion
"In the basic word-to-word model, the hidden parameters A+ and A- depend only on the distributions of link frequencies generated by the competitive linking algorithm.",Experiment/Discussion
More accurate models can be induced by taking into account various features of the linked tokens.,Experiment/Discussion
"For example, frequent words are translated less consistently than rare words (Melamed, 1997).",Experiment/Discussion
"To account for this difference, we can estimate separate values of A+ and A- for different ranges of n(„,v).",Experiment/Discussion
"Similarly, the hidden parameters can be conditioned on the linked parts of speech.",Experiment/Discussion
Word order can be taken into account by conditioning the hidden parameters on the relative positions of linked word tokens in their respective sentences.,Experiment/Discussion
"Just as easily, we can model links that coincide with entries in a pre-existing translation lexicon separately from those that do not.",Experiment/Discussion
"This method of incorporating dictionary information seems simpler than the method proposed by Brown et al. for their models (Brown et al., 1993b).",Experiment/Discussion
"When the hidden parameters are conditioned on different link classes, the estimation method does not change; it is just repeated for each link class.",Experiment/Discussion
A word-to-word model of translational equivalence can be evaluated either over types or over tokens.,Experiment/Discussion
"It is impossible to replicate the experiments used to evaluate other translation models in the literature, because neither the models nor the programs that induce them are generally available.",Experiment/Discussion
"For each kind of evaluation, we have found one case where we can come close.",Experiment/Discussion
"We induced a two-class word-to-word model of translational equivalence from 13 million words of the Canadian Hansards, aligned using the method in (Gale & Church, 1991).",Experiment/Discussion
One class represented content-word links and the other represented function-word links4.,Experiment/Discussion
Link types with negative log-likelihood were discarded after each iteration.,Experiment/Discussion
Both classes' parameters converged after six iterations.,Experiment/Discussion
The value of class-based models was demonstrated by the differences between the hidden parameters for the two classes.,Experiment/Discussion
"(),)c) converged at (.78,.00016) for content-class links and at (.43,.000094) for function-class links.",Experiment/Discussion
"The most direct way to evaluate the link types in a word-level model of translational equivalence is to treat each link type as a candidate translation lexicon entry, and to measure precision and recall.",Experiment/Discussion
"This evaluation criterion carries much practical import, because many of the applications mentioned in Section 1 depend on accurate broad-coverage translation lexicons.",Experiment/Discussion
"Machine readable bilingual dictionaries, even when they are available, have only limited coverage and rarely include domain-specific terms (Resnik & Melamed, 1997).",Experiment/Discussion
We define the recall of a word-to-word translation model as the fraction of the bitext vocabulary represented in the model.,Experiment/Discussion
"Translation model precision is a more thorny issue, because people disagree about the degree to which context should play a role in judgements of translational equivalence.",Experiment/Discussion
"We handevaluated the precision of the link types in our model in the context of the bitext from which the model 4Since function words can be identified by table lookup, no POS-tagger was involved. was induced, using a simple bilingual concordancer.",Experiment/Discussion
"A link type (u, v) was considered correct if u and v ever co-occurred as direct translations of each other.",Experiment/Discussion
"Where the one-to-one assumption failed, but a link type captured part of a correct translation, it was judged &quot;incomplete.&quot; Whether incomplete links are correct or incorrect depends on the application.",Experiment/Discussion
We evaluated five random samples of 100 link types each at three levels of recall.,Experiment/Discussion
"For our bitext, recall of 36%, 46% and 90% corresponded to translation lexicons containing 32274, 43075 and 88633 words, respectively.",Experiment/Discussion
Figure 5 shows the precision of the model with 95% confidence intervals.,Experiment/Discussion
"The upper curve represents precision when incomplete links are considered correct, and the lower when they are considered incorrect.",Experiment/Discussion
"On the former metric, our model can generate translation lexicons with precision and recall both exceeding 90%, as well as dictionarysized translation lexicons that are over 99% correct.",Experiment/Discussion
"Though some have tried, it is not clear how to extract such accurate lexicons from other published translation models.",Experiment/Discussion
Part of the difficulty stems from the implicit assumption in other models that each word has only one sense.,Experiment/Discussion
"Each word is assigned the same unit of probability mass, which the model distributes over all candidate translations.",Experiment/Discussion
The correct translations of a word that has several correct translations will be assigned a lower probability than the correct translation of a word that has only one correct translation.,Experiment/Discussion
"This imbalance foils thresholding strategies, clever as they might be (Gale & Church, 1991; Wu & Xia, 1994; Chen, 1996).",Experiment/Discussion
"The likelihoods in the word-to-word model remain unnormalized, so they do not compete.",Experiment/Discussion
The word-to-word model maintains high precision even given much less training data.,Experiment/Discussion
"Resnik & Melamed (1997) report that the model produced translation lexicons with 94% precision and 30% recall, when trained on French/English software manuals totaling about 400,000 words.",Experiment/Discussion
The model was also used to induce a translation lexicon from a 6200-word corpus of French/English weather reports.,Experiment/Discussion
Nasr (1997) reported that the translation lexicon that our model induced from this tiny bitext accounted for 30% of the word types with precision between 84% and 90%.,Experiment/Discussion
"Recall drops when there is less training data, because the model refuses to make predictions that it cannot make with confidence.",Experiment/Discussion
"For many applications, this is the desired behavior.",Experiment/Discussion
"The most detailed evaluation of link tokens to date was performed by (Macklovitch & Hannan, 1996), who trained Brown et al. 's Model 2 on 74 million words of the Canadian Hansards.",Experiment/Discussion
These authors kindly provided us with the links generated by that model in 51 aligned sentences from a heldout test set.,Experiment/Discussion
"We generated links in the same 51 sentences using our two-class word-to-word model, and manually evaluated the content-word links from both models.",Experiment/Discussion
"The IBM models are directional; i.e. they posit the English words that gave rise to each French word, but ignore the distribution of the English words.",Experiment/Discussion
"Therefore, we ignored English words that were linked to nothing.",Experiment/Discussion
The errors are classified in Table 1.,Experiment/Discussion
The &quot;wrong link&quot; and &quot;missing link&quot; error categories should be self-explanatory.,Experiment/Discussion
"&quot;Partial links&quot; are those where one French word resulted from multiple English words, but the model only links the French word to one of its English sources.",Experiment/Discussion
&quot;Class conflict&quot; errors resulted from our model's refusal to link content words with function words.,Experiment/Discussion
"Usually, this is the desired behavior, but words like English auxiliary verbs are sometimes used as content words, giving rise to content words in French.",Experiment/Discussion
"Such errors could be overcome by a model that classifies each word token, for example using a part-of-speech tagger, instead of assigning the same class to all tokens of a given type.",Experiment/Discussion
"The bitext preprocessor for our word-to-word model split hyphenated words, but Macklovitch & Hannan's preprocessor did not.",Experiment/Discussion
"In some cases, hyphenated words were easier to link correctly; in other cases they were more difficult.",Experiment/Discussion
"Both models made some errors because of this tokenization problem, albeit in different places.",Experiment/Discussion
The &quot;paraphrase&quot; category covers all link errors that resulted from paraphrases in the translation.,Experiment/Discussion
"Neither IBM's Model 2 nor our model is capable of linking multi-word sequences to multi-word sequences, and this was the biggest source of error for both models.",Experiment/Discussion
"The test sample contained only about 400 content words5, and the links for both models were evaluated post-hoc by only one evaluator.",Experiment/Discussion
"Nevertheless, it appears that our word-to-word model with only two link classes does not perform any worse than IBM's Model 2, even though the word-to-word model was trained on less than one fifth the amount of data that was used to train the IBM model.",Experiment/Discussion
"Since it doesn't store indirect associations, our word-to-word model contained an average of 4.5 French words for every English word.",Experiment/Discussion
Such a compact model requires relatively little computational effort to induce and to apply.,Experiment/Discussion
"In addition to the quantitative differences between the word-to-word model and the IBM model, there is an important qualitative difference, illustrated in Figure 6.",Experiment/Discussion
"As shown in Table 1, the most common kind of error for the word-to-word model was a missing link, whereas the most common error for IBM's Model 2 was a wrong link.",Experiment/Discussion
Missing links are more informative: they indicate where the model has failed.,Experiment/Discussion
The level at which the model trusts its own judgement can be varied directly by changing the likelihood cutoff in Step 1 of the competitive linking algorithm.,Experiment/Discussion
Each application of the word-to-word model can choose its own balance between link token precision and recall.,Experiment/Discussion
"An application that calls on the word-to-word model to link words in a bitext could treat unlinked words differently from linked words, and avoid basing subsequent decisions on uncertain inputs.",Experiment/Discussion
It is not clear how the precision/recall tradeoff can be controlled in the IBM models.,Experiment/Discussion
One advantage that Brown et al. 's Model 1 has over our word-to-word model is that their objective function has no local maxima.,Experiment/Discussion
"By using the EM algorithm (Dempster et al., 1977), they can guarantee convergence towards the globally optimum parameter set.",Experiment/Discussion
"In contrast, the dynamic nature of the competitive linking algorithm changes the Pr(datalmodel) in a non-monotonic fashion.",Experiment/Discussion
We have adopted the simple heuristic that the model &quot;has converged&quot; when this probability stops increasing.,Experiment/Discussion
"Many multilingual NLP applications need to translate words between different languages, but cannot afford the computational expense of modeling the full range of translation phenomena.",Results/Conclusion
"For these applications, we have designed a fast algorithm for estimating word-to-word models of translational equivalence.",Results/Conclusion
"The estimation method uses a pair of hidden parameters to measure the model's uncertainty, and avoids making decisions that it's not likely to make correctly.",Results/Conclusion
"The hidden parameters can be conditioned on information extrinsic to the model, providing an easy way to integrate pre-existing knowledge.",Results/Conclusion
"So far we have only implemented a two-class model, to exploit the differences in translation consistency between content words and function words.",Results/Conclusion
"This relatively simple two-class model linked word tokens in parallel texts as accurately as other translation models in the literature, despite being trained on only one fifth as much data.",Results/Conclusion
"Unlike other translation models, the word-to-word model can automatically produce dictionary-sized translation lexicons, and it can do so with over 99% accuracy.",Results/Conclusion
Even better accuracy can be achieved with a more fine-grained link class structure.,Results/Conclusion
