col1,col2
"In cases, where the C1 (U_1) contains more than one possible antecedent for the pronoun, several ambiguous readings with the same transitions are generated.","{'title': '4 Some Empirical Data', 'number': '5'}"
An examplem: There is no Cb(4a) because no element of the preceding utterance is realized in (4a).,"{'title': '4 Some Empirical Data', 'number': '5'}"
The pronoun &quot;them&quot; in (4b) co-specifies &quot;deer&quot; but the BFP-algorithm generates two readings both of which are marked by a RETAIN transition.,"{'title': '4 Some Empirical Data', 'number': '5'}"
(4) a. Jim pulled the burlap sacks off the deer b. and Liz looked at them.,"{'title': '4 Some Empirical Data', 'number': '5'}"
"In general, the strength of the centering model is that it is possible to use the Cb(U1) as the most preferred antecedent for a pronoun in U.","{'title': '4 Some Empirical Data', 'number': '5'}"
In my model this effect is achieved by the preference for hearer-old discourse entities.,"{'title': '4 Some Empirical Data', 'number': '5'}"
Whenever this preference is misleading both approaches give wrong results.,"{'title': '4 Some Empirical Data', 'number': '5'}"
"Since the Cb is defined strictly local while hearer-old discourse entities are defined global, my model produces less errors.","{'title': '4 Some Empirical Data', 'number': '5'}"
In my model the preference is available immediately while the BFPalgorithm can use its preference not before the second utterance has been processed.,"{'title': '4 Some Empirical Data', 'number': '5'}"
The more global definition of hearer-old discourse entities leads also to shorter error chains.,"{'title': '4 Some Empirical Data', 'number': '5'}"
"— However, the test set is too small to draw final conclusions, but at least for the texts analyzed the preference for hearer-old discourse entities is more appropriate than the preference given by the BFP- algorithm.","{'title': '4 Some Empirical Data', 'number': '5'}"
Kameyama's (1998) version of centering also omits the centering transitions.,"{'title': '5 Comparison to Related Approaches', 'number': '6'}"
But she uses the Cb and a ranking over simplified transitions preventing the incremental application of her model.,"{'title': '5 Comparison to Related Approaches', 'number': '6'}"
"The focus model (Sidner, 1983; Suri & McCoy, 1994) accounts for evoked discourse entities explicitly because it uses the discourse focus, which is determined by a successful anaphora resolution.","{'title': '5 Comparison to Related Approaches', 'number': '6'}"
Incremental processing is not a topic of these papers.,"{'title': '5 Comparison to Related Approaches', 'number': '6'}"
Even models which use salience measures for determining the antecedents of pronoun use the concept of evoked discourse entities.,"{'title': '5 Comparison to Related Approaches', 'number': '6'}"
Hajieova et al. (1992) assign the highest value to an evoked discourse entity.,"{'title': '5 Comparison to Related Approaches', 'number': '6'}"
"Also Lappin & Leass (1994), who give the subject of the current sentence the highest weight, have an implicit notion of evokedness.","{'title': '5 Comparison to Related Approaches', 'number': '6'}"
The salience weight degrades from one sentence to another by a factor of two which implies that a repeatedly mentioned discourse entity gets a higher weight than a brand-new subject.,"{'title': '5 Comparison to Related Approaches', 'number': '6'}"
"In this paper, I proposed a model for determining the hearer's attentional state which is based on the distinction between hearer-old and hearer-new discourse entities.","{'title': '6 Conclusions', 'number': '7'}"
"I showed that my model, though it omits the backward-looking center and the centering transitions, does not lose any of the predictive power of the centering model with respect to anaphora resolution.","{'title': '6 Conclusions', 'number': '7'}"
"In contrast to the centering model, my model includes a treatment for intrasentential anaphora and is sufficiently well specified to be applied to real texts.","{'title': '6 Conclusions', 'number': '7'}"
Its incremental character seems to be an answer to the question Kehler (1997) recently raised.,"{'title': '6 Conclusions', 'number': '7'}"
"Furthermore, it neither has the problem of inconsistency Kehler mentioned with respect to the BFP-algorithm nor does it generate unnecessary ambiguities.","{'title': '6 Conclusions', 'number': '7'}"
"Future work will address whether the text position, which is the weakest grammatical concept, is sufficient for the order of the elements of the S-list at the second layer of my ranking constraints.","{'title': '6 Conclusions', 'number': '7'}"
I will also try to extend my model for the analysis of definite noun phrases for which it is necessary to integrate it into a more global model of discourse processing.,"{'title': '6 Conclusions', 'number': '7'}"
Acknowledgments: This work has been funded by a post-doctoral grant from DFG (Str 545/1-1) and is supported by a post-doctoral fellowship award from IRCS.,"{'title': '6 Conclusions', 'number': '7'}"
"I would like to thank Nobo Komagata, Rashmi Prasad, and Matthew Stone who commented on earlier drafts of this paper.","{'title': '6 Conclusions', 'number': '7'}"
"I am grateful for valuable comments by Barbara Grosz, Udo Hahn, Aravind Joshi, Lauri Karttunen, Andrew Kehler, Ellen Prince, and Bonnie Webber.","{'title': '6 Conclusions', 'number': '7'}"
