col1,col2
"Finally, the manual effort needed to develop test beds and to judge systern output is far more extensive than for single document summarization; consider that a human judge would have to read many input articles (our largest test set contained 27 input articles) to rate the validity of a summary.",Experiment/Discussion
"Consequently, the evaluation that we performed to date is limited.",Experiment/Discussion
We performed a quantitative evaluation of our content-selection component.,Experiment/Discussion
"In order to prevent noisy input from the theme construction component from skewing the evaluation, we manually constructed 26 themes, each containing 4 sentences on average.",Experiment/Discussion
Far more training data is needed to tune the generation portion.,Experiment/Discussion
"While we have tuned the system to perform with minor errors on the manual set of themes we have created (the missing article in the fourth sentence of the summary in Figure 1 is an example), we need more robust input data from the theme construction component, which is still under development, to train the generator before beginning large scale testing.",Experiment/Discussion
"One problem in improving output is determining how to recover from errors in tools used in early stages of the process, such as the tagger and the parser.",Experiment/Discussion
The evaluation task for the content selection stage is to measure how well we identify common phrases throughout multiple sentences.,Experiment/Discussion
"Our algorithm was compared against intersections extracted by human judges from each theme, producing 39 sentence-level predicateargument structures.",Experiment/Discussion
"Our intersection algorithm identified 29 (74%) predicate-argument structures and was able to identify correctly 69% of the subjects, 74% of the main verbs, and 65% of the other constituents in our list of model predicate-argument structures.",Experiment/Discussion
"We present system accuracy separately for each category, since identifying a verb or a subject is, in most cases, more important than identifying other sentence constituents.",Experiment/Discussion
"In this paper, we presented an implemented algorithm for multi-document summarization which moves beyond the sentence extraction paradigm.",Results/Conclusion
"Assuming a set of similar sentences as input extracted from multiple documents on the same event (McKeown et al., 1999; Eskin et al., 1999), our system identifies common phrases across sentences and uses language generation to reformulate them as a coherent summary.",Results/Conclusion
"The use of generation to merge similar information is a new approach that significantly improves the quality of the resulting summaries, reducing repetition and increasing fluency.",Results/Conclusion
The system we have developed serves as a point of departure for research in a variety of directions.,Results/Conclusion
First is the need to use learning techniques to identify paraphrasing patterns in corpus data.,Results/Conclusion
"As a first pass, we found paraphrasing rules manually.",Results/Conclusion
This initial set might allow us to automatically identify more rules and increase the performance of our comparison algorithm.,Results/Conclusion
"From the generation side, our main goal is to make the generated summary more concise, primarily by combining clauses together.",Results/Conclusion
We will be investigating what factors influence the combination process and how they can be computed from input articles.,Results/Conclusion
"Part of combination will involve increasing coherence of the generated text through the use of connectives, anaphora or lexical relations (Jing, 1999).",Results/Conclusion
One interesting problem for future work is the question of how much context to include from a sentence from which an intersected phrase is drawn.,Results/Conclusion
"Currently, we include no context, but in some cases context is crucial even though it is not a part of the intersection.",Results/Conclusion
"This is the case, for example, when the context negates, or denies, the embedded sub-clause which matches a sub-clause in another negating context.",Results/Conclusion
"In such cases, the resulting summary is actually false.",Results/Conclusion
"This occurs just once in our test cases, but it is a serious error.",Results/Conclusion
"Our work will characterize the types of contextual information that should be retained and will develop algorithms for the case of negation, among others.",Results/Conclusion
We would like to thank Ya.el Dahan-Netzer for her help with SURGE.,Results/Conclusion
This material is based upon work supported by the National Science Foundation under grant No.,Results/Conclusion
IRI-96-1879.,Results/Conclusion
"Any opinions, findings, and conclusions or recommendations expressed in this material are those of the authors and do not necessarily reflect the views of the National Science Foundation.",Results/Conclusion
