col1,col2
"These two halfpaths can subsequently be joined into an accepting path if they have the same flip state s, i.e., one path starts where the other ends.","{'title': '6 Multiple word senses', 'number': '6'}"
Annotating our left half-constituents with s makes this check possible.,"{'title': '6 Multiple word senses', 'number': '6'}"
"We have formally described, and given faster parsing algorithms for, three practical grammatical rewriting systems that capture dependencies between pairs of words.","{'title': '9 Final remarks', 'number': '7'}"
All three systems admit naive 0(n5) algorithms.,"{'title': '9 Final remarks', 'number': '7'}"
"We give the first 0(n4) results for the natural formalism of bilexical context-free grammar, and for Alshawi's (1996) head automaton grammars.","{'title': '9 Final remarks', 'number': '7'}"
"For the usual case, split head automaton grammars or equivalent bilexical CFGs, we replace the 0(n3) algorithm of (Eisner, 1997) by one with a smaller grammar constant.","{'title': '9 Final remarks', 'number': '7'}"
"Note that, e.g., all senses would restore the g 2 factor.","{'title': '9 Final remarks', 'number': '7'}"
"Indeed, this approach gives added flexibility: a word's sense, unlike its choice of flip state, is visible to the HA that reads it. three models in (Collins, 1997) are susceptible to the 0(n3) method (cf.","{'title': '9 Final remarks', 'number': '7'}"
Collins's 0(n5)).,"{'title': '9 Final remarks', 'number': '7'}"
Our dynamic programming techniques for cheaply attaching head information to derivations can also be exploited in parsing formalisms other than rewriting systems.,"{'title': '9 Final remarks', 'number': '7'}"
"The authors have developed an 0(n7)-time parsing algorithm for bilexicalized tree adjoining grammars (Schabes, 1992), improving the naive 0(n8) method.","{'title': '9 Final remarks', 'number': '7'}"
"The results mentioned in §6 are related to the closure property of CFGs under generalized sequential machine mapping (Hoperoft and Ullman, 1979).","{'title': '9 Final remarks', 'number': '7'}"
This property also holds for our class of bilexical CFGs.,"{'title': '9 Final remarks', 'number': '7'}"
