col1,col2
We also used the 2496 manual abstracts for the DUC2003 10-word summarization task as reference translations for the 624 test documents of that task.,"{'title': '5 Evaluation', 'number': '10'}"
"We used two variants of HMM Hedge, one which selects headline words from the first 60 words of the story, and one which selects words from the first sentence of the story.","{'title': '5 Evaluation', 'number': '10'}"
"Table 1 shows the BLEU score using trigrams, and the 95% confidence interval for the score.","{'title': '5 Evaluation', 'number': '10'}"
"These results show that although Hedge Trimmer scores slightly higher than HMM Hedge on both data sets, the results are not statistically significant.","{'title': '5 Evaluation', 'number': '10'}"
"However, we believe that the difference in the quality of the systems is not adequately reflected by this automatic evaluation.","{'title': '5 Evaluation', 'number': '10'}"
Human evaluation indicates significantly higher scores than might be guessed from the automatic evaluation.,"{'title': '5 Evaluation', 'number': '10'}"
"For the 100 AP stories from the TIPSTER corpus for August 6, 1990, the output of Hedge Trimmer and HMM Hedge was evaluated by one human.","{'title': '5 Evaluation', 'number': '10'}"
"Each headline was given a subjective score from 1 to 5, with 1 being the worst and 5 being the best.","{'title': '5 Evaluation', 'number': '10'}"
The average score of HMM Hedge was 3.01 with standard deviation of 1.11.,"{'title': '5 Evaluation', 'number': '10'}"
The average score of Hedge Trimmer was 3.72 with standard deviation of 1.26.,"{'title': '5 Evaluation', 'number': '10'}"
"Using a t-score, the difference is significant with greater than 99.9% confidence.","{'title': '5 Evaluation', 'number': '10'}"
The types of problems exhibited by the two systems are qualitatively different.,"{'title': '5 Evaluation', 'number': '10'}"
"The probabilistic system is more likely to produce an ungrammatical result or omit a necessary argument, as in the examples below.","{'title': '5 Evaluation', 'number': '10'}"
"In contrast, the parser-based system is more likely to fail by producing a grammatical but semantically useless headline.","{'title': '5 Evaluation', 'number': '10'}"
"Finally, even when both systems produce acceptable output, Hedge Trimmer usually produces headlines which are more fluent or include more useful information. demanding that Chinese authorities respect culture.","{'title': '5 Evaluation', 'number': '10'}"
We have shown the effectiveness of constructing headlines by selecting words in order from a newspaper story.,"{'title': '6 Conclusions and Future Work', 'number': '11'}"
"The practice of selecting words from the early part of the document has been justified by analyzing the behavior of humans doing the task, and by automatic evaluation of a system operating on a similar principle.","{'title': '6 Conclusions and Future Work', 'number': '11'}"
"We have compared two systems that use this basic technique, one taking a statistical approach and the other a linguistic approach.","{'title': '6 Conclusions and Future Work', 'number': '11'}"
The results of the linguistically motivated approach show that we can build a working system with minimal linguistic knowledge and circumvent the need for large amounts of training data.,"{'title': '6 Conclusions and Future Work', 'number': '11'}"
"We should be able to quickly produce a comparable system for other languages, especially in light of current multi-lingual initiatives that include automatic parser induction for new languages, e.g. the TIDES initiative.","{'title': '6 Conclusions and Future Work', 'number': '11'}"
"We plan to enhance Hedge Trimmer by using a language model of Headlinese, the language of newspaper headlines (Mårdh 1980) to guide the system in which constituents to remove.","{'title': '6 Conclusions and Future Work', 'number': '11'}"
We Also we plan to allow for morphological variation in verbs to produce the present tense headlines typical of Headlinese.,"{'title': '6 Conclusions and Future Work', 'number': '11'}"
Hedge Trimmer will be installed in a translingual detection system for enhanced display of document surrogates for cross-language question answering.,"{'title': '6 Conclusions and Future Work', 'number': '11'}"
This system will be evaluated in upcoming iCLEF conferences.,"{'title': '6 Conclusions and Future Work', 'number': '11'}"
"The University of Maryland authors are supported, in part, by BBNT Contract 020124-7157, DARPA/ITO Contract N66001-97-C-8540, and NSF CISE Research Infrastructure Award EIA0130422.","{'title': '7 Acknowledgements', 'number': '12'}"
We would like to thank Naomi Chang and Jon Teske for generating reference headlines.,"{'title': '7 Acknowledgements', 'number': '12'}"
