col1,col2
"In contrast, Figure 3 shows that when we apply Bootstrapping to the EM lexical learner, the bilingual lexicon extraction accuracy is improved by 20% on the average, evaluated on top-N translation candidates of the same source words, showing that our proposed method can boost a weak EM lexical learner even on data from very-non-parallel corpus.","{'title': '7.', 'number': '6'}"
"In addition, we compare and contrast a number of bilingual corpora, ranging from the parallel, to comparable, and to very-non-parallel corpora.","{'title': '7.', 'number': '6'}"
The parallel-ness of each type of corpus is quantified by a lexical matching score calculated for the bi-lexicon pair distributed in the aligned bilingual sentence pairs.,"{'title': '7.', 'number': '6'}"
We show that this scores increases as the parallel-ness or comparability of the corpus increases.,"{'title': '7.', 'number': '6'}"
"Finally, we would like to suggest that Bootstrapping can in the future be used in conjunction with other sentence or word alignment learning methods to provide better mining results.","{'title': '7.', 'number': '6'}"
"For example, methods for learning a classifier to determine sentence parallel-ness such as that proposed by Munteanu et al., (2004) can be incorporated into our Bootstrapping framework.","{'title': '7.', 'number': '6'}"
